title|media|date|desc
Ibama multa Petrobras em R$ 8,19 milhões por vazamento de petróleo no ES|VEJA|01/03/2019|Ibama multa Petrobras em R$ 8,19 milhões por vazamento de petróleo no ES.  De acordo com o Instituto, a mancha de óleo ainda atingia dez quilômetros  quadrados na...
Venda de refinarias da Petrobras pode tornar Brasil refém de monopólios privados|DCM|01/03/2019|Daqui a alguns anos, estaremos importando 1 milhão de barris. E ao vender o  parque de refino da Petrobras, o Brasil não terá agregado um barril a mais.  A...
"Portal Exibidor - Adhemar Oliveira: ""É uma batalha ..."|Revista Exibidor|01/03/2019|Cinearte Petrobras segue como nome da empresa até o dia 31 de março e  Adhemar, que administra o minicomplexo há vinte e um anos, já está em  contato com empresas...
Multiplus ganha ‘ok’ da CVM para fechar capital|Seu Dinheiro|01/03/2019|'JULGAMENTO' DA PETROBRAS? Descubra se a estatal é culpada pela explosão  nos preços dos combustíveis ... ADEUS, BOLSA! Multiplus ganha 'ok' da CVM  para fechar...
Líder do governo minimiza fala de Bolsonaro e diz que presidente “sinalizou vontade de negociar” a Previdência|Seu Dinheiro|01/03/2019|'JULGAMENTO' DA PETROBRAS? Descubra se a estatal é culpada pela explosão  nos preços dos combustíveis. Menu. Seu Dinheiro. Últimas Notícias.
‘Em um Brasil equilibrado, o mercado imobiliário pode dobrar’, diz presidente da MRV|Seu Dinheiro|01/03/2019|'JULGAMENTO' DA PETROBRAS? Descubra se a estatal é culpada pela explosão  nos preços dos combustíveis. Menu. Seu Dinheiro. Últimas Notícias.
ICMS de 18% afeta preço do gás de cozinha no Amazonas ...|Amazonas Atual|01/03/2019|MANAUS – A alíquota de 18% do ICMS (Imposto sobre Circulação de Mercadorias  e Serviços) e a política de preços da Petrobras influenciam diretamente no  preço...
Clientes da XP têm problemas com informe de rendimentos, e página de download está fora do ar|Seu Dinheiro|01/03/2019|'JULGAMENTO' DA PETROBRAS? Descubra se a estatal é culpada pela explosão  nos preços dos combustíveis · Clientes da XP têm problemas com informe de  rendimentos,...
"OAS pagou delatores para ""ajustar"" depoimentos, diz ex ..."|Consultor Jurídico|01/03/2019|"Foi condenado a 11 anos de prisão por Sergio Moro, que viu ""prova robusta""  da participação da OAS no esquema de corrupção envolvendo a Petrobras."
Dividendos todo mês? Veja carteira recomendada do Santander para março|Money Times|01/03/2019|... CVC (CVCB3), Petrobras (PETR4) e outras empresas para ficar de olho  hoje · Sanepar (SAPR11) pagará R$ 154 milhões em juros sobre o capital  próprio...
Amor, dinheiro e os pirralhos correndo pela casa|Seu Dinheiro|02/03/2019|GAME OVER para Petrobras? Clique aqui e descubra 2 ações que 'vencem' a  estatal. Menu.
Demitido? Fabio Schvartsman está de saída da Vale, diz revista|Seu Dinheiro|02/03/2019|'JULGAMENTO' DA PETROBRAS? Descubra se a estatal é culpada pela explosão  nos preços dos combustíveis. Menu.
MAIS LIDAS: A nova fantasia de Eike Batista|Seu Dinheiro|02/03/2019|'JULGAMENTO' DA PETROBRAS? Descubra se a estatal é culpada pela explosão  nos preços dos combustíveis. Menu. Seu Dinheiro. Últimas Notícias.
Como foram as 9 horas de Lula fora da prisão para velório do ...|BBC|02/03/2019|Segundo a Justiça, Lula recebeu propina da empreiteira OAS na forma de um  apartamento no Guarujá, em troca de favores na Petrobras.
Aliados políticos prestam solidariedade a Lula; Maduro envia flores|UOL Notícias|02/03/2019|Caio Paes de Andrade assume a presidência da Petrobras. 28/06/2022 12h21  ... Bolsonaro consolida a intervenção na Petrobras. 28/06/2022 09h20.
Schwartsman: ceder na reforma reduz perspectiva de ...|Poder360|02/03/2019|Teremos nova dinâmica na Petrobras, diz Bolsonaro · Goiás reduz ICMS sobre  combustíveis e energia para 17% · Estatal do pré-sal já arrecadou R$ 1,23  bilhão...
Maratona de aulas para o concurso BRB começa hoje|Estratégia Concursos|02/03/2019|Aprovado em 5º lugar no concurso PETROBRÁS para Análise – Comércio e  Suprimento ... em 5º lugar no concurso PETROBRAS para Análise – Comércio e  Suprimento.
Justiça do Ceará autoriza quebra de sigilo de Camilo Santana (PT) e Cid Gomes (PDT)|O Cafezinho|02/03/2019|... O Cafezinho Espresso · Obituário · Os melhores do blog · Pedro Breier ·  Pesquisa · Petrobrás ... Mourão ironiza possível instalação da CPI da  Petrobras...
Dinheiro da Lava Jato banca reforma em escolas e cria fundo anticorrupção|Folha|03/03/2019|Metade dos valores irá para eventual ressarcimento de investidores da  Petrobras que acionem a estatal na Justiça. A outra metade será  administrada por uma...
Ibovespa acumula queda de 3,35% na semana e fecha ...|Circuito Mato Grosso|03/03/2019|PETROBRAS PN caiu 1,33 por cento e PETROBRAS ON recuou 2,21 por cento,  tendo como pano de fundo a queda dos preços do petróleo no exterior, além  de contínua...
Acordo entre EUA e China para dar fim à guerra comercial está próximo|Seu Dinheiro|03/03/2019|'JULGAMENTO' DA PETROBRAS? Descubra se a estatal é culpada pela explosão  nos preços dos combustíveis. Menu.
Maiores startups do país crescem e já valem R$ 89 bilhões|Seu Dinheiro|03/03/2019|'JULGAMENTO' DA PETROBRAS? Descubra se a estatal é culpada pela explosão  nos preços dos combustíveis · Maiores startups do país crescem e já valem  R$ 89...
Brasil terá sua fatia do bilionário mercado da maconha|Seu Dinheiro|03/03/2019|'JULGAMENTO' DA PETROBRAS? Descubra se a estatal é culpada pela explosão  nos preços dos combustíveis. Menu. Seu Dinheiro. Últimas Notícias.
Descubra os lançamentos e opções de imóveis mais luxuosos do país|Seu Dinheiro|03/03/2019|'JULGAMENTO' DA PETROBRAS? Descubra se a estatal é culpada pela explosão  nos preços dos combustíveis · Descubra os lançamentos e opções de imóveis  mais...
iFood realiza entrega por drone em São Paulo|Money Times|03/03/2019|Se havia dúvida de que a Petrobras (PETR4) amarrava preço do etanol nas  usinas, não há mais · Gasolina e etanol têm primeira queda de preço depois  de três...
EUA e Coreia do Sul encerram principais exercícios militares ...|ISTOÉ DINHEIRO|03/03/2019|Senadores pedem acesso a mensagens de ex-presidente da Petrobras que  poderiam ... Congresso quer esclarecer mensagens de ex-presidente da  Petrobras que...
Lançam no Egito sistema para preservar catacumbas de ...|IstoÉ|03/03/2019|Conselho da Petrobras analisa nome de Andrade. Economia 07:35 ... Economia  07:35. Conselho da Petrobras analisa nome de Andrade · Economia 07:34...
Em campanha, presidente do Fla disse que assumiria responsabilidades|Portal O Dia|03/03/2019|Engenheiro formado na UFRJ - e atleta da seleção de futebol da universidade  - Landim fez carreira na Petrobras. Em 2000, foi convocado nas férias  para...
DOF & Norskan Offshore contrata para operações nas cidades de Macaé e Rio de Janeiro|CPG Click Petroleo e Gas|04/03/2019|Depois de fechar várias contratos recentes com a Petrobras, a empresa  contrata em praticamente em todos os cargos para atividades marítimas  offshore.
Vale nomeia Eduardo de Salles Bartolomeo como presidente ...|Poder360|04/03/2019|... muito bem à Petrobras, diz Sachsida · Paes de Andrade toma posse como  presidente da Petrobras · Países do G7 doará US$ 4,5 bilhões para combate à  fome.
Como Jorge Paulo Lemann perdeu a liderança entre os bilionários brasileiros|Seu Dinheiro|04/03/2019|'JULGAMENTO' DA PETROBRAS? Descubra se a estatal é culpada pela explosão  nos preços dos combustíveis · Como Jorge Paulo Lemann perdeu a liderança  entre os...
Nova regra pode encarecer remessas de dinheiro para o exterior|Seu Dinheiro|04/03/2019|'JULGAMENTO' DA PETROBRAS? Descubra se a estatal é culpada pela explosão  nos preços dos combustíveis. Menu. Seu Dinheiro. Últimas Notícias.
Nas redes sociais, Guaidó avisa que retornou à Venezuela|Money Times|04/03/2019|A alternativa ao papel da Petrobras (PETR4) que pode disparar 183% · 12  fundos imobiliários de CRIs com dividendos de até 20% para você comprar  agora,...
Guide divulga recomendações de dividendos em carteira de março|Money Times|04/03/2019|... CVC (CVCB3), Petrobras (PETR4) e outras empresas para ficar de olho  hoje · Sanepar (SAPR11) pagará R$ 154 milhões em juros sobre o capital  próprio...
Gustavo passa por exames no Corinthians para saber ...|ISTOÉ Independente|04/03/2019|Petrobras aprova Andrade como conselheiro e CEO ... Senadores pedem acesso  a mensagens de ex-presidente da Petrobras que poderiam implicar Bolsonaro.
No Twitter, Bolsonaro divulga canal do YouTube de ...|Poder360|04/03/2019|Governo apresenta nova identidade e novo passaporte · Procuradora de SP se  dá aumento e receberá salário de ministro · Teremos nova dinâmica na  Petrobras,...
Obras na usina termoelétrica de Macaé: Entregue seu currículo em mãos|CPG Click Petroleo e Gas|04/03/2019|'Caio Paes não atende os requisitos para presidente da Petrobras' –  disseram os petroleiros na greve de ontem (27/06). 28 de junho de 2022 —  Flavia Marinho.
Dinheiro da Lava Jato usado em fundo anticorrupção e obras em escolas|Diário de Notícias|05/03/2019|Prestes a completar cinco anos, a investigação que destapou um esquema de  corrupção na Petrobras e outros entes públicos pelo país prepara-se para  criar um...
Petrobras vai perfurar em Sagitário|CPG Click Petroleo e Gas|05/03/2019|A Petrobras planeja perfurar um poço de avaliação sobre o prospecto  Sagitário no segundo trimestre, buscando mais valor do pré-sal na Bacia de  Santos.
Lance por aeroporto será de R$ 218 milhões|Seu Dinheiro|05/03/2019|'JULGAMENTO' DA PETROBRAS? Descubra se a estatal é culpada pela explosão  nos preços dos combustíveis. Menu. Seu Dinheiro. Últimas Notícias.
O que é PGBL, o plano de previdência privada que pode ser abatido na declaração de IR|Seu Dinheiro|05/03/2019|'JULGAMENTO' DA PETROBRAS? Descubra se a estatal é culpada pela explosão  nos preços dos combustíveis. Menu.
Daniela Mercury envia carta para o presidente Jair Bolsonaro|Conexão Política|05/03/2019|Bolsonaro diz que Petrobras “traiu o povo” e propõe criação de CPI.  Presidente defende investigação sobre diretoria e conselho da empresa  estatal. Davy...
Ivete Sangalo e o marido se disfarçam para curtir carnaval de ...|ISTOÉ Independente|05/03/2019|Ciro Nogueira ataca Petrobras com expectativa de novo aumento de ... Lira  anuncia reunião de líderes para discutir política de preços da Petrobras.
As várias faces de Cate Blanchett em mostra sobre os 20 ...|Correio Braziliense|05/03/2019|O futuro já começou. O que é a Web 3.0 e como ela vai impactar as nossas  Vidas! Petrobras perde R$ 27,3 bi em valor de mercado em apenas um dia...
Disputa no comércio online reduz ociosidade de galpão perto da capital|Economia & Negócios|05/03/2019|Mudança de presidente da Petrobras será inócua para controlar os preços;  leia análise · Auxílio Brasil: famílias reclamam de demora e falta de  informações...
Confusão faz bloco da Ludmilla acabar uma hora mais cedo no Rio|Metrópoles|05/03/2019|Caio Paes de Andrade toma posse como novo presidente da Petrobras. Paes de  Andrade será o quarto presidente da Petrobras na gestão do presidente  Jair...
Adolescente é suspeita de matar e esconder corpo de avó por 2 meses|Jornal da Record|05/03/2019|Brasília Petrobras anuncia diretor de exploração como presidente interino ·  Saúde Caso de varíola do macaco no RJ é o primeiro do Brasil de alguém que  não...
"Operação ""lava jato"" se torna meio para que o MPF vire gestor ..."|Consultor Jurídico|06/03/2019|"O PT anunciou esta semana que vai questionar no Supremo Tribunal Federal o  acordo assinado entre a Petrobras e os procuradores da ""lava jato"", que  prevê a..."
Apesar dos lucros impressionantes da Petrobras, sua dívida ainda é alta|CPG Click Petroleo e Gas|06/03/2019|Para cada segmento de negócios em que a Petrobras recua, uma nova  oportunidade se abrirá para investidores privados. A estatal brasileira de  petróleo,...
Jovem Aprendiz Petrobras 2019 - Vagas, Inscrições e Dúvidas|Edital Concursos Brasil|06/03/2019|O Programa Jovem Aprendiz Petrobras permite ao jovens não só a primeira  experiência profissional, mas também uma serie de cursos adicionais que  tornarão os...
China planeja novas medidas para atrair investimento estrangeiro|Seu Dinheiro|06/03/2019|'JULGAMENTO' DA PETROBRAS? Descubra se a estatal é culpada pela explosão  nos preços dos combustíveis. Menu.
Aroeira estreia no 247 com charge sobre a fundação de R$ 2,5 bi da Lava Jato|Brasil 247|06/03/2019|Aroeira critica a decisão da Petrobras de transferir R$ 2,5 bilhões para  uma fundação que será conduzida pela força-tarefa da Lava Jato.
Juíza diz que não descumpriu decisão do STF ao prender Paulo Preto|Agência Brasil|06/03/2019|... Jato como suposto operador financeiro em um esquema da Odebrecht para  pagar indevidamente políticos e agentes públicos que eram ligados à  Petrobras.
União, e não Judiciário, decide sobre valores recuperados ...|Consultor Jurídico|06/03/2019|"Em acordo firmado com procuradores da ""lava jato"", a Petrobras depositou R$  2,5 bilhões em conta vinculada à 13ª Vara Federal de Curitiba."
Bridgestone Firestone abre vagas de emprego e estágio em várias regiões|Escola Educação|06/03/2019|Petrobras lança novo edital para pequenos negócios tecnológicos. O Grupo  Bridgestone tinha 181 unidades de produção em 24 países até julho de 2018.
Imperatriz Leopoldinense e Império Serrano são rebaixadas|ISTOÉ DINHEIRO|06/03/2019|Bolsonaro: está caminhando para resolver a coisa da Petrobras. Giro 21:28.  Um dos críticos mais severos de Tesla acha que a empresa está enfrentando...
E se o golden-shower fosse um oferecimento da CAIXA?|Conexão Política|06/03/2019|Bolsonaro diz que Petrobras “traiu o povo” e propõe criação de CPI.  Presidente defende investigação sobre diretoria e conselho da empresa  estatal. Davy...
ANP abre consulta pública para edital da concorrência do gasoduto Bolívia-Brasil|O Globo|07/03/2019|Com a medida, a Petrobras poderá deixar de ser a única importadora a  utilizar o Gasbol, conforme já esperado pelo mercado. A petroleira estatal  vem...
Rico aumenta exposição a papéis defensivos e recomenda 10 ações para comprar em março|InfoMoney|07/03/2019|Além disso, houve aumento na participação de Petrobras (PETR4) e de CVC  (CVCB3), bem como a inclusão de “puts” (opções de venda) para proteger a  carteira:...
Lyft, rival da Uber nos EUA, abre a temporada dos IPOs das empresas nascidas na era do smartphone|Seu Dinheiro|07/03/2019|'JULGAMENTO' DA PETROBRAS? Descubra se a estatal é culpada pela explosão  nos preços dos combustíveis. Menu. Seu Dinheiro. Últimas Notícias.
Bolsonaro: esperamos que Previdência não seja muito desidratada|Seu Dinheiro|07/03/2019|'JULGAMENTO' DA PETROBRAS? Descubra se a estatal é culpada pela explosão  nos preços dos combustíveis. Menu. Seu Dinheiro. Últimas Notícias.
MPF acha anotações que ligam Paulo Preto a um dos primeiros delatores da Lava-Jato|O Globo|07/03/2019|... vez na investigação em 2014, numa planilha apreendida com o ex-gerente  da Petrobras Pedro Barusco como um dos 11 operadores de propina da estatal.
Por outras conversas de elevador|Seu Dinheiro|07/03/2019|PETROBRAS AMEAÇADA? Descubra se a estatal é culpada pela explosão nos  preços dos combustíveis. Menu. Seu Dinheiro. Últimas Notícias.
TRF4 confirma que Odebrecht não pode ter contas bloqueadas|Agência Brasil|07/03/2019|... na Justiça Federal para cobrar o ressarcimento pelos desvios de  recursos públicos na Petrobras, que foram descobertos com as investigações  da Lava Jato.
O Blockchain pode aposentar os cartórios?|Money Times|07/03/2019|... Se havia dúvida de que a Petrobras (PETR4) amarrava preço do etanol nas  usinas, ... Petrobras (PETR4), dividendos e mais: Veja os destaques da  semana no...
Corretoras veem Índice Bovespa acima de 110 mil pontos com reforma da Previdência|Money Times|07/03/2019|... Se havia dúvida de que a Petrobras (PETR4) amarrava preço do etanol nas  usinas, ... Petrobras (PETR4), dividendos e mais: Veja os destaques da  semana no...
ENTREVISTA: Iuri Barbosa Gonçalves – Aprovado em 3º lugar no concurso PRF para o estado do Pará|Estratégia Concursos|07/03/2019|Nesse cenário, muitas empresas têm seus navios afretados pela Petrobras  (até mesmo as que não são subsidiárias desta). Logo, devido a série de  escândalos e a...
Lava Jato vai criar fundo com dinheiro da Petrobras|Gazeta do Povo|08/03/2019|Um acordo firmado entre a Petrobras, a força-tarefa da Lava Jato no  Ministério Público Federal (MPF) em Curitiba e o Departamento de Justiça  norte-americano...
Eunício recebeu propina da Petrobras em conta na Suíça, diz empresário|UOL Notícias|08/03/2019|Ferraz acrescenta que o ex-deputado Índio da Costa (PSD-RJ) recebeu  dinheiro para protegê-lo na CPI da Petrobras de 2014, mas o político  lembrou ao UOL que...
O que Braskem, Petrobras e Natura têm em comum? Ações entre as mais recomendadas para março|Seu Dinheiro|08/03/2019|Ações entre as mais recomendadas para março. Braskem e Petrobras continuam  entre as queridinhas dos gestores enquanto os papéis da Natura ganham  espaço. Jasmine...
3 ações para comprar em março|Seu Dinheiro|08/03/2019|O que Petrobras, Braskem e Natura têm em comum? Se você pensou no uso de  petróleo e seus derivados na indústria de cosméticos, saiba que não é isso.
Bolsonaro diz que irá este ano à China e que relação entre os países vai melhorar|Seu Dinheiro|08/03/2019|GAME OVER para Petrobras? Clique aqui e descubra 2 ações que 'vencem' a  estatal. Menu.
Como investir na bolsa: o que você precisa fazer para conseguir comprar e vender ações|Seu Dinheiro|08/03/2019|GAME OVER para Petrobras? Clique aqui e descubra 2 ações que 'vencem' a  estatal. Menu.
Perseguição de cristãos em países islâmicos, hindus e de regimes comunistas aumenta em 2019|Conexão Política|08/03/2019|Bolsonaro diz que Petrobras “traiu o povo” e propõe criação de CPI ·  Critério para renovar concessão da Globo será “100% técnico”, diz Fábio  Faria.
As posições de liderança precisam de mais mulheres, diz ...|Poder360|08/03/2019|... muito bem à Petrobras, diz Sachsida · Paes de Andrade toma posse como  presidente da Petrobras · Países do G7 doará US$ 4,5 bilhões para combate à  fome.
Mulheres só ganharão o mesmo que homens em 202 anos, diz Fórum Econômico Mundial|InfoMoney|08/03/2019|trending_up Sucessão na Petrobras. trending_up InfoTrade. trending_up Renda  Extra Imobiliária. trending_up Viver de dividendos.
Anna Coleman – A mulher que devolveu a vida aos soldados mutilados após a Primeira Guerra Mundial|Conexão Política|08/03/2019|Petrobras confirma Caio Mario Paes de Andrade como novo presidente da  estatal · Bolsonaro diz que exagerou sobre 'botar cara no fogo' por  Ribeiro,...
Petrobras anuncia economia de US$ 8,1 bi até 2023|Época Negócios|09/03/2019|Petrobras anuncia economia de US$ 8,1 bi até 2023. A novidade não afeta a  programação de investimentos. Nas novas medidas, a companhia afirma que a...
Ministério Público entrega segredos tecnológicos e comerciais da Petrobras para os EUA|Carta Campinas|09/03/2019|O resumo da história é o seguinte: A Lava Jato investiga a Petrobras e o  governo dos Estados Unidos aproveita e multa a Petrobras.
"Lava Jato: ONG bilionária com dinheiro da Petrobras é vista como ""Estado paralelo"""|Carta Capital|09/03/2019|Lava Jato: ONG bilionária com dinheiro da Petrobras é vista como “Estado  paralelo”. Para juristas e políticos, fundo criado com o aval dos Estados  Unidos fere a...
"Existência de acordo para MPF gerir fundo bilionário da ""lava ..."|Consultor Jurídico|09/03/2019|"Um acordo assinado pela Petrobras e pelos procuradores da ""lava jato"" prevê  a criação de um fundo a ser administrado pelo Ministério Público Federal  para..."
Ações devem sofrer impacto de incertezas com a reforma da Previdência|Seu Dinheiro|09/03/2019|'JULGAMENTO' DA PETROBRAS? Descubra se a estatal é culpada pela explosão  nos preços dos combustíveis. Menu.
Nubank, Inter e Neon são melhores bancos do Brasil, aponta ranking da Forbes|Seu Dinheiro|09/03/2019|'JULGAMENTO' DA PETROBRAS? Descubra se a estatal é culpada pela explosão  nos preços dos combustíveis. Menu.
É possível viver (ou morrer) de day-trade na bolsa?|Seu Dinheiro|09/03/2019|'JULGAMENTO' DA PETROBRAS? Descubra se a estatal é culpada pela explosão  nos preços dos combustíveis. Menu.
Conheça as novidades dos menus do D.O.M. e da Casa do Porco|Seu Dinheiro|09/03/2019|'JULGAMENTO' DA PETROBRAS? Descubra se a estatal é culpada pela explosão  nos preços dos combustíveis. Menu.
Luiza Trajano, Luciano Hang, irmãos Batista: os novos bilionários brasileiros, segundo a Forbes|Seu Dinheiro|09/03/2019|'JULGAMENTO' DA PETROBRAS? Descubra se a estatal é culpada pela explosão  nos preços dos combustíveis. Menu. Seu Dinheiro. Últimas Notícias.
Exclusivo: XP esclarece notícia no WhatsApp sobre “esquema pirâmide” de assessor|Money Times|09/03/2019|Gasolina e etanol têm primeira queda de preço depois de três meses de altas  · Se havia dúvida de que a Petrobras (PETR4) amarrava preço do etanol nas  usinas...
Mito da ‘Petrobras quebrada’ sabota maior estatal brasileira|Carta Capital|10/03/2019|Destaca-se nessa dilapidação o aniquilamento da Petrobras, a maior empresa  do Brasil e uma das mais importantes do mundo, motor da maior cadeia  produtiva de...
Entenda o fundo que a Lava Jato quer criar e por que magistrados são contra|UOL Notícias|10/03/2019|Janot havia requerido que 80% do dinheiro arrecadado ficasse com a  Petrobras, enquanto o restante fosse divido igualitariamente entre STF e  PGR. No pedido, ele...
Uma análise do acordo entre Petrobras, DoJ e MPF|O Cafezinho|10/03/2019|Ou seja, o acordo firmado com o Ministério Público significa que o governo  americano tungará a Petrobras em R$ 660 milhões. Nada mal. Já o acordo  mostrado no...
Avião Boeing 737 MAX sofre dois acidentes em poucos meses|Seu Dinheiro|10/03/2019|'JULGAMENTO' DA PETROBRAS? Descubra se a estatal é culpada pela explosão  nos preços dos combustíveis · Avião Boeing 737 MAX sofre dois acidentes em  poucos...
Música clássica: mulheres se destacam no calendário de 2019 no Brasil|O Globo|10/03/2019|No Rio, a OSB preparou um concerto só com música escrita por mulheres,  enquanto a Petrobras Sinfônica estreará uma obra para trombone e orquestra  da...
Clubes de charutos aliam serviços exclusivos, brindes de luxo e outras regalias|Seu Dinheiro|10/03/2019|'JULGAMENTO' DA PETROBRAS? Descubra se a estatal é culpada pela explosão  nos preços dos combustíveis. Menu. Seu Dinheiro. Últimas Notícias.
Jornalista de Minas Gerais é eleita Miss Brasil 2019|Pleno.News|10/03/2019|3 Dallagnol rebate críticas a acordo entre MPF e Petrobras. Em segundo  lugar ficou a modelo Luana Lobo, de 24 anos, que representou o Ceará; e em  terceiro a...
Reconhecida na série 'O Mecanismo', Erika Marena é a nova ...|Conexão Política|10/03/2019|Petrobras confirma Caio Mario Paes de Andrade como novo presidente da  estatal · Bolsonaro diz que exagerou sobre 'botar cara no fogo' por  Ribeiro,...
Ator francês se autoproclama presidente e reconhece José de ...|Blog do Esmael|10/03/2019|... sessão será retomada nesta terça-feira 20 de junho de 2022, 20:17;  Bolsonaro chama Zé Trovão para nova cruzada contra a Petrobras 20 de junho  de 2022,...
“Uma instituição que não aceita crítica não é verdadeiramente grande”, diz procurador da ...|Jornal GGN|10/03/2019|... publicada no dia em que Estadão e Folha disparam contra o papel da Lava  Jato de Curitiba na criação de um fundo privado com R$ 2,5 bilhões da  Petrobras.
Petrobras espera fechar venda de gasodutos da TAG ainda neste mês|Época Negócios|11/03/2019|A Petrobras pode concluir a venda de sua rede gigante de gasodutos no  Brasil ainda neste mês, no que poderia ser a maior venda de ativos da  empresa,...
Ibama multa Petrobras em R$ 100 mil por descarte irregular em navio-plataforma do pré-sal|G1|11/03/2019|A Petrobras foi multada em R$ 100 mil pelo Instituto Brasileiro do Meio  Ambiente e dos Recursos Naturais Renováveis (Ibama) pelo despejo irregular  de água...
Investidor de debêntures da Rumo vai receber juros de 4,50% ao ano mais IPCA, isento de IR|Seu Dinheiro|11/03/2019|GAME OVER para Petrobras? Clique aqui e descubra 2 ações que 'vencem' a  estatal. Menu.
68 companhias aéreas operam com o Boeing 737 MAX; Gol é a única brasileira|Seu Dinheiro|11/03/2019|'JULGAMENTO' DA PETROBRAS? Descubra se a estatal é culpada pela explosão  nos preços dos combustíveis. Menu. Seu Dinheiro. Últimas Notícias.
A verdade está lá fora|Seu Dinheiro|11/03/2019|'JULGAMENTO' DA PETROBRAS? Descubra se a estatal é culpada pela explosão  nos preços dos combustíveis. Menu. Seu Dinheiro · Últimas Notícias.
O modelo 3G sobrevive a consumidores exigentes e concorrência sem barreiras?|Seu Dinheiro|11/03/2019|'JULGAMENTO' DA PETROBRAS? Descubra se a estatal é culpada pela explosão  nos preços dos combustíveis · O modelo 3G sobrevive a consumidores  exigentes e...
Consórcio do grupo CCR vence leilão de concessão da Linha 15 – Prata do monotrilho de São Paulo|Seu Dinheiro|11/03/2019|GAME OVER para Petrobras? Clique aqui e descubra 2 ações que 'vencem' a  estatal · Consórcio do grupo CCR vence leilão de concessão da Linha 15 –  Prata do...
