title|media|date|desc
Polícia paulista recupera R$1,5 milhão de assalto a banco em Botucatu|Diário do Poder|01/08/2020|Lucro abusivo da Petrobras é de meio bilhão por dia · Diário do Poder. Novo  ministro define privatização da Petrobras como prioridade.
Com investimento de R$ 30 milhões, obras de ampliação do Porto do Pecém são iniciadas no estado do Ceará|Click Petróleo e Gás|01/08/2020|A previsão de entrega do primeiro módulo é até fevereiro de 2021. Veja  também. Petrobras e WEG fecham contrato: Centenas de motores,  turbogeradores e inversores...
Praça de Atendimento de Santo André amplia horário de ...|Abc do Abc|01/08/2020|Parceria da Prefeitura com Petrobras e Instituto Seci beneficiará 1.566  famílias - Continue lendo. Munícipes de Santo André recebem auxílio para  compra de...
EXCLUSIVO: Petrobrás tem 'depósito' irregular de resíduos no fundo do mar|Época Negócios|02/08/2020|"Sem nenhum tipo de licenciamento ambiental, a Petrobrás ergueu um  ""almoxarifado submarino"" no litoral brasileiro, lotado com milhares de  maquinários e..."
Petrobras desaponta construção naval nacional: Estaleiros perdem o Filé mignon de obras para 3 navios pla ...|Click Petróleo e Gás|02/08/2020|Petrobras desaponta construção naval nacional: Estaleiros perdem o Filé  mignon de obras para 3 navios plataformas do tipo FPSO no gigantesco campo  de Búzios, no...
Churrascaria famosa de Londres oferece refeições por US$ 13|Money Times|02/08/2020|Gasolina e etanol têm primeira queda de preço depois de três meses de altas  · Se havia dúvida de que a Petrobras (PETR4) amarrava preço do etanol nas  usinas...
Por críticas à Lava Jato, Bolsonaro diz que não responde por outro Poder|Exame|02/08/2020|Petrobras (PETR4): minoritários avisam que vão recorrer se Paes de Andrade  for eleito. Mercados. Há uma hora • 2 min de leitura...
Produção de petróleo da Rússia fica estável em julho, em linha com acordo da Opep+|Money Times|02/08/2020|Gasolina e etanol têm primeira queda de preço depois de três meses de altas  · Se havia dúvida de que a Petrobras (PETR4) amarrava preço do etanol nas  usinas...
Itaipu fará nova operação especial para ajudar no escoamento da soja no Paraguai|Money Times|02/08/2020|... CVC (CVCB3), Petrobras (PETR4) e outras empresas para ficar de olho  hoje · Sanepar (SAPR11) pagará R$ 154 milhões em juros sobre o capital  próprio...
Lojas Renner: Realize CFI lança plataforma de benefícios com mais de 150 marcas|Money Times|02/08/2020|Gasolina e etanol têm primeira queda de preço depois de três meses de altas  · Se havia dúvida de que a Petrobras (PETR4) amarrava preço do etanol nas  usinas...
Empresário e deputado são condenados por fake news sobre Jean Wyllys|Exame|02/08/2020|Petrobras (PETR4): minoritários avisam que vão recorrer se Paes de Andrade  for eleito. Mercados. Há um dia • 2 min de leitura...
Collor desviou recursos de patrocínios da Petrobras e da Caixa, diz PF em relatório|Folha|03/08/2020|Collor desviou recursos de patrocínios da Petrobras e da Caixa, diz PF em  relatório. Documento aponta possível prática dos crimes de peculato e  lavagem; ex-...
Petrobras reduz preço de gás para distribuidoras em 48% em dólar e 35% em reais|Estado de Minas|03/08/2020|Conforme a lei, os reajustes são aplicados pelas agências reguladoras  estaduais. A Petrobras afirma que tem feito sua parte no termo de  compromisso assinado com...
O que muda na nova gasolina vendida no Brasil?|Exame|03/08/2020|A Petrobras, que detém 90% do mercado nacional, afirma já seguir os novos  padrões. Entenda o que muda no combustível. Consumo. Exigência de uma massa  específica...
Petrobras (PETR4) Anuncia Venda da sua Participação na PBio|The Capital Advisor|03/08/2020|"A Petrobras reitera que o desinvestimento na PBio está ""alinhada à  estratégia de otimização do portfólio e à melhoria de alocação do capital  da companhia,..."
Petrobras inicia processo de arrendamento do terminal de regaseificação de gás natural liquefeito (GNL) na ...|CPG Click Petroleo e Gas|03/08/2020|Petrobras publica edital para licitação de terminal de regaseificação de  gás natural liquefeito (GNL) na Bahia e conta com dez empresas na disputa.
Gasolina com novo padrão passa a valer nesta segunda; veja perguntas e respostas|Autoesporte|03/08/2020|A Petrobras, responsável pela produção de cerca de 90% da gasolina vendida  ... (ANP) e da Petrobras e traz uma série de perguntas e respostas sobre o  tema:.
Petrobras obtém liberação comercial para térmica em ...|CanalEnergia|03/08/2020|... a operação comercial da segunda unidade geradora (50 MW) da  termelétrica da Refinaria Abreu e Lima, de posse da Petrobras no município  de Ipojuca (PE).
Muitas vagas de emprego para a nova sede da empresa de Engenharia, focada na indústria petrolífera UO-SEAL (Petrobras), Epman no Nordeste|Click Petróleo e Gás|03/08/2020|Com a perspectiva da sua nova planta entrar em operação no mês que vem, a  empresa que está focada na indústria petrolífera UO-SEAL (Petrobras),  estima abrir...
JSL pretende fazer oferta de ações após concluir ...|Investing.com|03/08/2020|Por Rodrigo Viga Gaier RIO DE JANEIRO (Reuters) - O presidente-executivo da  Petrobras (SA:PETR4), José Mauro Coelho, pediu demissão nesta  segunda-feira, abrindo...
Viaduto vegetado para trânsito de micos-leões é inaugurado no Rio|Agência Brasil|03/08/2020|Entre o viaduto e a reserva, há uma faixa de cerca de 25 metros, por onde  passam gasodutos da Petrobras. Já há conversas com a estatal sobre como  ligar o...
Unigel arrenda Fafens da Petrobras e deve gerar R$ 2 bilhões por ano|Correio Braziliense|04/08/2020|A Petrobras transmitiu formalmente, nesta terça-feira (4/8), a posse das  unidades da Bahia e de Sergipe das Fábricas de Fertilizantes Nitrogenados  (Fafens)...
Unigel assume de fábricas de fertilizantes da Petrobras e reativará unidades em 2021|Money Times|04/08/2020|O acordo foi anunciado pela Petrobras em novembro do ano passado.  “Atualmente, no Brasil, não há produção de ureia nacional e é necessário  importar cinco...
Reativação de fábricas de fertilizantes deve gerar faturamento bilionário|VEJA|04/08/2020|A Petrobras transmitiu hoje a posse das unidades da Bahia e de Sergipe da  Fafen – Fábricas de Fertilizantes Nitrogenados – para a multinacional  Unigel.
Mais cara, nova gasolina chega aos postos para combater ...|Brasil de Fato|04/08/2020|"Gasolina de baixa qualidade invadiu o mercado nacional com a mudança da  política de preços da Petrobrás, em 2017. Redação. Brasil de Fato | São  Paulo (SP) |. 04..."
Petrobras manda funcionários de volta ao trabalho após teste positivo para coronavírus|Agência Pública|04/08/2020|Petrobras manda funcionários de volta ao trabalho após teste positivo para  coronavírus. Rovena Rosa/Agência Brasil.
Ocyan busca plataformas maiores para cimentar retorno ao ...|Portos e Navios|04/08/2020|A Ocyan mira contratos, potencialmente de centenas de milhões de dólares,  para plataformas de águas profundas que atendem empresas como a Petrobras.
Doze empresas na disputa pelo terminal de GNL da Bahia|EPBR|04/08/2020|Petrobras vai arrendar o terminal até dezembro de 2023, sem previsão de  prorrogação. A Trafigura, comercializadora multinacional de commodities e  energia, teve...
Flotel OOS Tiradentes volta ao trabalho para a Petrobras na Bacia de Campos neste mês de agosto para campa ...|Click Petróleo e Gás|04/08/2020|Petrobras deve retomar operações do flotel OOS Tiradentes na Bacia de  Campos, ... de acomodação offshore para a campanha da Petrobras na  plataforma P-40,...
As 19 ações brasileiras preferidas pelo Bank of America|Money Times|04/08/2020|Navio da Petrobras Favorita: Petrobras é a ação com maior peso na carteira  brasileira do Bank of America (Imagem: Agência Petrobras).
Banco Safra anuncia nova edição de desafio universitário de gestão de ativos|Money Times|04/08/2020|... Vale (VALE3), Taesa (TAEE11): 10 ações para lucrar com dividendos,  segundo o Inter · A alternativa ao papel da Petrobras (PETR4) que pode  disparar 183%...
Unigel assume fábricas de fertilizantes da Petrobras e ...|GlobalFert|05/08/2020|Unigel assume fábricas de fertilizantes da Petrobras e reativará unidades  em 2021. 5 de agosto de 2020. O grupo do setor petroquímico Unigel assumiu  a partir...
Guedes admite que Bolsonaro pediu ajuda aos chineses para leilão do pré-sal|Correio Braziliense|05/08/2020|O presidente teve que pedir para uma empresa chinesa comparecer e não ficar  só a Petrobras no leilão;, afirmou. Guedes elogiou a proposta do senador  José Serra...
Por que a nova gasolina vai reduzir casos de combustível batizado|UOL|05/08/2020|De acordo com a ANP (Agência Nacional do Petróleo, Gás Natural e  Biocombustíveis) e a Petrobras, a nova gasolina também dificulta a  respectiva adulteração...
Processo seletivo offshore para contratação IMEDIATA requisita candidatos do Rio de Janeiro para oportunidade de emprego, neste dia 05|CPG Click Petroleo e Gas|05/08/2020|Contratos da Locar no Rio de Janeiro demanda emprego offshore neste dia  05/08 para profissionais marítimos que tenham experiência em contrato  Petrobras.
BMW tem prejuízo de 230 milhões de euros no 2º trimestre|ISTOÉ DINHEIRO|05/08/2020|Ibovespa aprofunda queda aquém dos 99 mil pontos de olho em Petrobras e  China · Política 12:15. A discussão começou por conta de uma postagem de  Guga Noblat...
Bianca Andrade surge de maiô na web e fãs tecem elogios: ''Uma deusa''|AnaMaria|05/08/2020|José Mauro Coelho pediu demissão três dias após a Petrobras anunciar um  novo aumento de preços. Economia. Presidente da Petrobras renuncia ao cargo  diante...
Necton substitui Bradespar por Trisul na carteira mensal de small caps|Money Times|05/08/2020|... A alternativa ao papel da Petrobras (PETR4) que pode disparar 183% ·  Efeito Petrobras (PETR4): Banco do Brasil (BBAS3) acumula perdas de 10% no  mês;...
Lula poderá ser candidato se vencer novamente no STF|VEJA|05/08/2020|Na sentença que o condenou, Sérgio Moro escreveu que nunca tinha dito que o  triplex tinha relação com a Petrobras. Mas se não tinha então o processo  não deveria...
O Copom define a Selic. Mas quem é o Copom?|SpaceMoney|05/08/2020|Ibovespa sobe 2,1%, aos 100 mil pts. com Petrobras (PETR4) e Vale (VALE3);  dólar cai 0,3%, a R$ 5,23. 17h16 - 27 Jun 2022 · [OGF - VIP - SPACENOW  DESKTOP]...
Robôs do mundo industrial podem ser alvo de ataques cibernéticos|Money Times|05/08/2020|As universidades e institutos de pesquisa decidem se desejam integrar o  Ros-I por meio da interface, acrescentou. Leia também: Petrobras. Empresas  · Comitê da...
Petrobras quebrou um recorde mensal de produção de petróleo em seu campo de águas profundas – Búzios|CPG Click Petroleo e Gas|06/08/2020|Petrobras atinge produção recorde em petróleo no campo de Búzios em julho.  A Petrobras informou na quarta-feira que seus quatro FPSOs instalados no  campo – P-74...
Plataforma da Petrobras na Bacia de Campos tem 42 infectados pelo novo coronavírus|O Globo|06/08/2020|Sem informar o total de trabalhadores contaminados na P-50 a Petrobras  informou que, por questões preventivas, testou com o RT-PCR todos os  trabalhadores a...
A Indústria de Exploração e Produção Centro Oeste Óleo e Gás compra campo terrestre da Petrobras em Sergipe|Click Petróleo e Gás|06/08/2020|Petrobras faturou 37,6 milhões de dólares com a venda do campo de petróleo  terrestre Dó-Ré-Mi, na lagoa do Sergipe, para a Centro Oeste Óleo e Gás.
Nova gasolina ainda não impacta o preço praticado nas bombas de Caxias do Sul|GZH|06/08/2020|A Petrobras já vinha adotando isso. Claro que agora organizou o mercado —  explica Martins. Outro fator que deve contribuir para o baixo impacto nas  revendas é a...
BNDES tem mais R$ 55 bi em ações para vender até o fim de 2022|Exame|06/08/2020|No mercado, os comentários são de que as próximas empresas alvo de  movimentos desse tipo serão Petrobras (fatia remanescente da oferta de  fevereiro),...
BNDES prepara venda de Petro. Como isso impacta seu ...|E-Investidor|06/08/2020|Isso evita oscilações bruscas no preço dos papéis; BNDES não está se  desfazendo das ações porque não confia mais na Petrobras, e sim para gerar  caixa e se...
Royal IHC fornecerá equipamentos para FPSO Anna Nery destinado ao campo de Marlim da Petrobras|CPG Click Petroleo e Gas|06/08/2020|Segundo a Royal IHC, o FPSO será instalado no campo de Marlim da Petrobras  na bacia de Campos, a 150 km da costa do Brasil.
Motor vai ficar mais potente com a nova gasolina brasileira?|AutoPapo|06/08/2020|A Petrobras diz que essa já é a octanagem da gasolina dela; então nesse  caso você não vai perceber modificação nenhuma. VEJA TAMBÉM:.
Procedimento contra juíza Gabriela Hardt é arquivado por ...|Consultor Jurídico|06/08/2020|... Conselho Nacional do Ministério Público e do Conselho Nacional de  Justiça e que a Petrobras e a AGU foram intimadas para acompanhar todo o  procedimento.
Nota falsa de R$ 200 começa a circular no Rio|Poder360|06/08/2020|Paes de Andrade vai fazer muito bem à Petrobras, diz Sachsida · Paes de  Andrade toma posse como presidente da Petrobras · Países do G7 doará US$  4,5 bilhões...
Petrobras entra na fase final para vender suas operações na Amazônia|O Globo|07/08/2020|RIO - A Petrobras anunciou hoje que deu mais um passo para vender suas  operações na Amazônia. A estatal iniciou a fase final (vinculante) para se  desfazer...
Petrobras vai hibernar plataforma de gás de Merluza|EPBR|07/08/2020|A Petrobras vai hibernar a plataforma de Merluza (PMLZ-1), em águas rasas  na Bacia de Santos. Unidade está com a produção interrompida desde março de  2020,...
Petrobras aprova hibernação da plataforma de Merluza|Money Times|07/08/2020|A hibernação não impactará o processo de desinvestimento do Polo Merluza e  o suprimento de gás natural ao mercado da Baixada Santista, afirmou a  Petrobras. “...
BNDES ainda não tem decisão sobre venda de Petrobras|Valor Econômico|07/08/2020|O Banco Nacional de Desenvolvimento Econômico e Social (BNDES) ainda não  tem definição sobre a venda de ações preferenciais de Petrobras que estão  na carteira...
Plataformas leiloadas pela Petrobras por R$ 7,5 mi estavam no fim de sua vida útil|Política|07/08/2020|A Petrobras não divulgou valor mínimo para venda das plataformas e não há  estimativas disponíveis que permitam afirmar que os itens leiloados tinham  o valor...
Petróleo: qual a diferença entre Brent e WTI?|Você SA|07/08/2020|O da Venezuela e o que a Petrobras extrai de seus campos mais rasos (os do  “pós-sal”) são da turma dos pesados. O da Arábia Saudita, mais leve.
Mercado Livre ultrapassa a Vale e se torna empresa mais valiosa da América Latina|Valor Econômico|07/08/2020|... quinta-feira (6) o Mercado Livre atingiu um valor de mercado de US$  60,644 bilhões, acima da Vale (US$ 59,363 bilhões) e Petrobras (US$ 57,537  bilhões).
BNDES faz o maior block trade da AL com venda de R$ 8,1 ...|ISTOÉ DINHEIRO|07/08/2020|No primeiro trimestre, o BNDESPar, que antes da crise atual vinha com uma  estratégia de desinvestimentos, já havia vendido R$ 22 bilhões em ações da  Petrobras,...
Onyx assume ter recebido R$ 300 mil de propina da JBS|ISTOÉ DINHEIRO|07/08/2020|Petrobras sofre prejuízo de R$ 2,7 bilhões no 2º trimestre. Agência  Petrobrás. A pandemia do coronavírus afetou fortemente os negócios da  Petrobras.
Empresa multinacional offshore do Reino Unido expande contratos para o Brasil|CPG Click Petroleo e Gas|07/08/2020|A Subsea Energy Solutions está de olho nos negócios no Brasil e desejar  criar bons relacionamentos com operadoras de petróleo e gás do nível da  Petrobras.
Braskem: muita emoção e muitas saídas para a maior petroquímica da AL|Exame|08/08/2020|A Petrobras é sócia no comando, mas por meio de um acordo de acionistas com  poucos direitos: tem uma posição de 47% das ações ordinárias, mais  preferenciais...
Refinaria Presidente Getúlio Vargas (REPAR) da Petrobras contará com serviços da empresa Lottos Engenharia|CPG Click Petroleo e Gas|08/08/2020|A Lottus Engenharia firmou contrato para prestar serviços de construção,  instalação e montagem além de outras operações na refinaria da Petrobras  REPAR,...
Nova gasolina será obrigatória no Brasil em agosto?|Grupo Solaris|08/08/2020|Hoje, de acordo com a Petrobras, a octanagem mínima da gasolina comum é de  87 unidades. Outros tipos de gasolina comercializados pela estatal,...
Brasil exporta 3,5 vezes mais para a China do que para os ...|Poder360|08/08/2020|... Conselho elege Paes de Andrade como presidente da Petrobras ·  Minoritários da Petrobras acionam CVM contra nomeação de Andrade.  publicidade...
Caio Mesquita: Nunca aposte contra a América|Money Times|08/08/2020|Gasolina e etanol têm primeira queda de preço depois de três meses de altas  · Se havia dúvida de que a Petrobras (PETR4) amarrava preço do etanol nas  usinas...
Escassez de óleo de soja eleva preço do biodiesel; vendas ...|EPBR|08/08/2020|Esta semana, a Petrobras publicou um comunicado pra imprensa sobre o  recorde das vendas do diesel S10, menos poluente que o S500 (redução do  teor de...
Construção de resort Quinta Santa Bárbara será retomada em ...|Jornal Opção|08/08/2020|Chegou a hora de tirar a máscara da Petrobrás  https://www.jornalopcao.com.br/bastidores/chegou-a-hora-de-tirar-a-mascara-da-petrobras-406451/  …
Trump, Wenbin e Tiktok, o elenco da nova Guerra Fria|Money Times|08/08/2020|... CVC (CVCB3), Petrobras (PETR4) e outras empresas para ficar de olho  hoje · Sanepar (SAPR11) pagará R$ 154 milhões em juros sobre o capital  próprio...
Manifestantes defendem impeachment de Bolsonaro em ato ...|Poder360|08/08/2020|... 63% acham que existe homofobia no Brasil · Fatos da Semana: ex-ministro  preso, Petrobras e PoderData · A lei da lasquinha · É o sistema, estúpido!
Agora é oficial: maior parte do polo petroquímico gaúcho está ...|GZH|09/08/2020|"A Petrobras é considerada ""sócia relevante"" da Braskem, porque tem um  percentual muito semelhante de ações, embora as decisões sejam da Odebrecht  (veja quadro..."
Zuckerberg entra para clube de centibilionários com Bezos, Gates|Money Times|09/08/2020|... Se havia dúvida de que a Petrobras (PETR4) amarrava preço do etanol nas  usinas, ... Petrobras (PETR4), dividendos e mais: Veja os destaques da  semana no...
Covid-19:Itália tem 463 novos casos e duas mortes em 24 horas|Diário do Poder|09/08/2020|Lucro abusivo da Petrobras é de meio bilhão por dia · Diário do Poder. Novo  ministro define privatização da Petrobras como prioridade.
Roche: a maior fortuna familiar da Suíça prospera há 124 anos|Money Times|09/08/2020|Duschmale – assim como o restante do grupo de acionistas – não quis  comentar. Leia também: Petrobras · Economia · Petrobras e crise no MEC:  veja...
Cleo posta vídeo no qual ela e os irmão desejam feliz Dia dos Pais a Fabio Júnior|Yahoo Vida e Estilo|09/08/2020|Lula e Ciro criticam política de preços da Petrobras, assim como Bolsonaro;  veja reação de candidatos. há 15 minutos. Folhapress...
"Deputado bolsonarista é condenado por dossiê contra ""antifascistas"""|Exame|09/08/2020|Governistas travam assinaturas pela CPI da Petrobras, cobrada por  Bolsonaro. Medo de recessão, crise dos combustíveis, CVC, Eneva e o que  mais move.
Oceaneering está com vagas de emprego para Macaé e Rio de Janeiro para inspetor de equipamentos, assistente e coordenador de projetos|CPG Click Petroleo e Gas|09/08/2020|petrobras, reunião, presidente · Conselho da Petrobras fará reunião na  segunda- feira, 27, para considerar nome de novo ... diesel, petrobras,  importação...
"Irmão mais novo do ex-ministro, Arthur Weintraub vira ""guru"" da cloroquina"|Exame|09/08/2020|Nova diretoria da Petrobras pode mudar política de preços, diz Bolsonaro.  Siga-nos: Facebook da Exame · Instagram da Exame · LinkedIn da Exame.
Bolsonaro é condenado a pagar honorários de processo contra Jean Wyllys|Exame|09/08/2020|Operação abafa no Planalto: governo mapeia nomes na CPI e faz pente-fino.  Como bolsonaristas lideraram a disputa pela Petrobras nas redes sociais.
Braskem dispara 9,3% após Odebrecht anunciar venda de sua participação na petroquímica|Money Times|10/08/2020|A Petrobras (PETR3; PETR4) é também acionista e possui 47% do votante e  36,1% do total. O restante tem negociação no mercado acionário.
Petrobras avança processo de venda do campo offshore de Tartaruga, localizado em águas rasas da Bacia Sergipe-Alagoas|CPG Click Petroleo e Gas|10/08/2020|A petroleira brasileira Petrobras iniciou a fase vinculante para a venda de  toda a sua participação no campo de águas rasas de Tartaruga, localizado na  Bacia de...
Rio de Janeiro é selecionado para programa de empreendedorismo internacional do MIT|Época Negócios|10/08/2020|O investimento previsto para a implementação do projeto é de R$ 3,2  milhões. Furnas e Petrobras irão contribuir com R$ 1,3 milhão cada e os R$  600 mil restantes...
Africa e BR Distribuidora lançam campanha e novo ...|Propmark|10/08/2020|Posto Petrobras é o posto raiz, com gasolina, gasolina e atendimento com  simpatia, simpatia. Daí, para chegar no conceito da campanha foi um pulo”,  comentam...
As 5 empresas de capital aberto mais valiosas do Brasil ...|E-Investidor|10/08/2020|Considerando apenas o mercado brasileiro, além de Vale, Petrobras e Itaú, o  top cinco das companhias de maior valor de mercado abarca também a Ambev  (US$ 38...
Vazamento de óleo ameaça mar cristalino das Ilhas Maurício; veja fotos|Exame|10/08/2020|Interferência na Petrobras para frear reajuste de diesel e gasolina deixa  estatal à deriva. Brasil. Há 6 horas • 8 min de leitura...
Bahia é o primeiro estado nordestino a receber a Gincana do ...|Estradas|10/08/2020|Em parceria com os postos Petrobras da Rede Siga Bem (considerados a casa  do caminhoneiro fora de casa) – que patrocina o evento juntamente com a  IVECO -, a...
Etanol: safra corrida encheu os tanques das usinas, mas recuo ajuda na competitividade|Money Times|10/08/2020|... uma outra rodada de elevação na indústria poderia tirar um pouco do  fôlego caso a Petrobras (PETR3; PETR4) não renove aumento da gasolina na  refinaria,...
Novo CEO da Equinor quer empresa como a melhor em petróleo offshore e gás|Money Times|10/08/2020|Gasolina e etanol têm primeira queda de preço depois de três meses de altas  · Se havia dúvida de que a Petrobras (PETR4) amarrava preço do etanol nas  usinas...
Por que o ouro não para de subir|Você SA|10/08/2020|Petrobras, Embraer e a turma do metal sobem com a expectativa pelo Show do  Trilhão. Mas o metal que vai bem mesmo no ano é o amarelo.
Campo de Lula da Petrobras mudará de nome após determinação do TRF4|Jornal da Record|11/08/2020|O campo de Lula da Petrobras, no pré-sal da Bacia de Santos, no Rio de  Janeiro, vai voltar a se chamar campo de Tupi. A modificação é uma  exigência do TRF4...
Fim dos leilões de biodiesel planejado para 2022|EPBR|11/08/2020|A Petrobras, que é responsável por operacionalizar a comercialização de  biodiesel desde o início do PNPB, planeja vender mais de 50% da sua  capacidade de refino...
Nova gasolina deixa motor mais potente? Esclareça mitos e verdades|UOL|11/08/2020|A partir de janeiro de 2022, a octanagem RON da gasolina comum sobe para 93  - a Petrobras, responsável pelo refino de cerca de 90% da gasolina vendida  no Brasil...
Incentivo fiscal a empresas de petróleo e gás supera toda a ...|Amazonas Atual|11/08/2020|Companhias que usam mais bens de exploração, como a Petrobras, responsável  por 80% da produção do país, acabaram sendo mais beneficiadas pelo Repetro.
Botijão custa R$ 26 nas refinarias e R$ 70 ao consumidor|Correio do Estado|11/08/2020|O valor entregue pelas distribuidoras é de R$ 54,93 e a média praticada  pelas revendas é de R$ 72,02, praticamente a mesma média de março. Segundo  a Petrobras,...
Gasolina de aviação com suspeita de contaminação foi importada em março e repassada para outro navio|G1|11/08/2020|No documento, a Petrobras afirma que o lote de AVGAS importado com quase 5  milhões de quilos foi adquirido diretamente de seu produtor no Golfo do  México e...
BTG Pactual lucra R$ 987 milhões no segundo trimestre ...|TradeMap|11/08/2020|Chaminé de produção de óleo da Petrobras · A crise que pode enfraquecer o  motor de dividendos da Petrobras – veja o que marcou a semana.
Brasilcom defende redução da mistura obrigatória de ...|EPBR|11/08/2020|Como reajuste da Petrobras afeta plano do governo para baratear  combustíveis · André Ramalhoe1 outro(s). 17 de junho de 2022 - Atualizado  em 21 de junho de...
Ouro é guiado por liquidez, não juros reais, diz CrossBorder|Money Times|11/08/2020|... Bradesco (BBDC4) ou BB (BBAS3)? Por dividendos, uma empresa é melhor  agora, diz BBA · CVC (CVCB3), Petrobras (PETR4) e outras empresas para  ficar de...
Banco Inter estende acordo com seguradora Liberty, em negócio de até R$ 368 mi|Money Times|11/08/2020|Gasolina e etanol têm primeira queda de preço depois de três meses de altas  · Se havia dúvida de que a Petrobras (PETR4) amarrava preço do etanol nas  usinas...
Petrobras confirma aumentos de 4% na gasolina e de 2% no diesel a partir de amanhã|Valor Investe|12/08/2020|A Petrobras confirmou há pouco aumento de 4% no preço do litro de gasolina  e de 2% no preço do diesel (modalidades S10 e S500), a partir de amanhã,...
