title|media|date|desc
Famílias começam a voltar para casa após rompimento de barragem no Ceará|Congresso em Foco|22/08/2020|Petrobras: comitê se reúne para avaliar indicação de Paes de Andrade ·  Congresso em Foco · Assista Em tour pelo Nordeste, Bolsonaro é hostilizado  no São...
Vagas onshore para Angra dos Reis e região são oferecidas por multinacional de recrutamento e seleção no setor de petróleo e gás, neste dia 22|Click Petróleo e Gás|22/08/2020|Petrobras concretiza venda de oito campos de petróleo por 94,2 milhões de  dólares, no estado da Bahia para SPE Rio Ventura · Muitas vagas offshore em  Rio...
Brasil, o país da sobremesa!|Money Times|22/08/2020|Mudar a estrutura produtiva de um país no sentido de enriquecimento não é  tarefa fácil. O mercado sozinho não consegue! Leia também: Petrobras.  Empresas.
Qual a diferença entre auxílio-doença e auxílio-acidente?|Jornal Contábil|22/08/2020|Presidente afirma que vai propor à Câmara CPI para investigar Petrobras ·  Chamadas · Petrobras deve anunciar novos aumentos no preço de combustíveis.
'Ainda vale a pena viver', diz Ângela Leal, extasiada após quarentena com a filha, Leandra|Folha|22/08/2020|Leandra: Uma coisa que resume bem a situação do Rival é que a gente teve o  patrocínio da Petrobras durante 19 anos. Ele foi aprovado no governo FHC e  foi...
Gustavo Santos Raposo assume a presidência da Transpetro|Portos e Navios|23/08/2020|Em nota, a subsidiária da Petrobras informa que o pedido foi por questões  pessoais. O diretor financeiro da Transpetro, Gustavo Santos Raposo,  assumiu a...
Como aplicar e garantir R$ 1 milhão|Eu Quero Investir|23/08/2020|Radar traz Petrobras (PETR3; PETR4), CSN (CSNA3) e GPA (PCAR3) · Com Selic  a 13,25%, a poupança vale a pena? Descubra aqui · Mercados operam em baixa  com...
O que ficará pelo caminho com o possível fim da Lava-Jato em Curitiba|VEJA|23/08/2020|MPF do Paraná anuncia a devolução de recursos da corrupção recuperados pela  Lava Jato para a Petrobras, em Curitiba - 07/12/2017 Vagner  Rosário/VEJA.com.
Vazamento de óleo no mar poderão ser identificados por Drone e barco não tripulado|Money Times|23/08/2020|Gasolina e etanol têm primeira queda de preço depois de três meses de altas  · Se havia dúvida de que a Petrobras (PETR4) amarrava preço do etanol nas  usinas...
Aras opina contra recurso para reverter cassação do mandato de Selma Arruda|Congresso em Foco|23/08/2020|Oposição pede acesso a troca de mensagens entre Bolsonaro e ex-presidente  da Petrobras · Congresso em Foco · Deputados pedem convocação de Anderson  Torres...
Flávio Bolsonaro destinou R$442 mil a Queiroz e familiares de miliciano|Exame|23/08/2020|Flávio Bolsonaro afirma que pai não mudará política de preços da Petrobras.  Pacheco defende reajustes automáticos de salários para juízes. Brasil.
ANJ e OAB criticam ameaça de Bolsonaro a repórter|Exame|23/08/2020|Petrobras (PETR4): minoritários avisam que vão recorrer se Paes de Andrade  for eleito. Mercados. Há 8 horas • 2 min de leitura...
Caio Mesquita: De boas intenções o inferno está cheio|Money Times|23/08/2020|Gasolina e etanol têm primeira queda de preço depois de três meses de altas  · Se havia dúvida de que a Petrobras (PETR4) amarrava preço do etanol nas  usinas...
"Investimento milionário | Nestlé irá investir R$ 763 milhões no Brasil este ano, 40% a mais no comparativo com 2019"|Click Petróleo e Gás|23/08/2020|Conselho da Petrobras fará reunião na segunda- feira, 27, para considerar  nome de novo presidente da estatal. 25 de junho de 2022 — Roberta Souza.
Projeto Golfinho Rotador comemora 30 anos de trabalho de preservação em Noronha|G1|23/08/2020|A Organização tem o apoio do Programa Petrobras Socioambiental. Segundo a  direção do Projeto Golfinho Rotador, o objetivo principal é sensibilizar  pessoas...
JBS desbanca Petrobras e se torna maior empresa do país em receita|O Globo|24/08/2020|SÃO PAULO — A JBS, uma das maiores processadoras de carne do mundo, superou  a Petrobras em receita pela primeira vez num trimestre, segundo  levantamento da...
Petrobras coloca à venda Alto do Rodrigues, Ubarana, a ...|EPBR|24/08/2020|A Petrobras anunciou nesta segunda (24) que colocou à venda 26 campos  terrestres e em águas rasas, além da Refinaria Clara Camarão.
Refinaria Duque de Caxias (Reduc) da Petrobras conclui sua primeira operação de cabotagem de Diesel S10|CPG Click Petroleo e Gas|24/08/2020|Escoamento do combustível por navios eleva competitividade da Petrobras na  cabotagem. A Refinaria Duque de Caxias (Reduc) tem capacidade para produzir  150...
Eneva obtém autorização da ANP para atuar em carregamento de gás natural|ACritica.NET|24/08/2020|... ao terminal de Gás Natural Liquefeito (GNL) da Petrobras na Bahia. ...  para carregamento de gás no Brasil foi concedida para a Petrobras em 2014.
Demissões em estatais: STF julga caso que pode ampliar dispensas|Gazeta do Povo|24/08/2020|A maior é a da Petrobras, de R$ 19.664. Para Augusto Aras, as estatais que  concorrem com empresas privadas devem ter mais liberdade para demitir  empregados. A...
"Artigo | Por que Campos e Macaé estão arrecadando menos ..."|Brasil de Fato|24/08/2020|Leilão de campos de petróleo marca a perda de soberania nacional. - Foto:  Alexandre Brum/Petrobras. A Agência Nacional...
Recurso de loteria poderá ser usado para câmera de ...|Câmara dos Deputados|24/08/2020|"Audiência Pública - Tema: ""Fechamento da Petrobras na Bahia e o desmonte da  Petrobras. Benes Leocádio quer dar uma maior cobertura nas áreas de risco  das..."
Omega pretende ampliar portfólio de parques eólicos na Bahia e fecha contrato milionário com a francesa EDF Renewables|Click Petróleo e Gás|24/08/2020|O anúncio da compra foi dado neste domingo (23). Leia também. Refinaria  Duque de Caxias (Reduc) da Petrobras conclui sua primeira operação de  cabotagem de...
STF bate martelo e Governo do Rio terá que pagar R$ 2 bi de indenização sobre desapropriação de terreno da refinaria de Manguinhos Refit|Click Petróleo e Gás|24/08/2020|Petrobras: Refinaria Duque de Caxias (Reduc) passa a utilizar água de reúso  e reduz em até 5% do consumo de água bruta da refinaria...
Podemos requer prorrogação da Operação Lava Jato|Senado Federal|24/08/2020|... (PGR) no qual solicitam a prorrogação da atuação da força-tarefa  Operação Lava Jato no Paraná, que apura a ocorrência de corrupção na  Petrobras.
Petrobras inicia a venda de infraestruturas essenciais de óleo ...|EPBR|25/08/2020|Petrobras pretende acelerar a liquidação de sua posição no Rio Grande do  Norte ... O processamento de gás de terceiro é discutido pela Petrobras com  o Cade,...
Lava-Jato apura propinas de R$ 4 milhões a diretores da Petrobras|Valor Investe|25/08/2020|... supostas irregularidades em negociações entre empreiteiras e a  Petrobras, com suspeita de pagamento sistemático de propina a diretores da  petroleira.
CVM suspende julgamento de caso sobre testes de impairment na Petrobras|InfoMoney|25/08/2020|CVM suspende julgamento de caso sobre testes de impairment na Petrobras. Um  pedido de vista da diretora Flávia Perlingeiro adiou o veredicto da  autarquia sobre...
Ministro do TCU tem bens bloqueados por suspeita de ...|Consultor Jurídico|25/08/2020|... do cartel das empreiteiras na época em que presidia a Comissão  Parlamentar Mista de Inquérito da Petrobras (CPMI), no Congresso Nacional,  em 2014.
Em cinco anos na bacia de Santos, monitoramento de praia ...|DomTotal|25/08/2020|O PMP da Bacia de Santos é o mais recente da Petrobras. As equipes dos PMPs  trabalham diariamente no resgate de animais marinhos debilitados e de  carcaças...
Petrobras é acionada por depositar de forma irregular toneladas de equipamentos e tubulações de plataformas de petróleo na Bacia de Campos, Rio de Janeiro|Click Petróleo e Gás|25/08/2020|Denominado de “almoxarifado submarino”, Petrobras acumula sem nenhum  licenciamento ambiental na Bacia de Campos, toneladas de materiais de suas  plataformas...
Credicard ZERO: clientes poderão customizar cartão e receber parte do valor das compras de volta|Money Times|25/08/2020|Gasolina e etanol têm primeira queda de preço depois de três meses de altas  · Se havia dúvida de que a Petrobras (PETR4) amarrava preço do etanol nas  usinas...
Com venda de ativos anunciada, Petrobras poderá deixar RN ...|G1|26/08/2020|De acordo com o Roberto Ardenghy, a Petrobras vai encerrar todas suas  operações de exploração de petróleo em terra para focar nas águas  profundas. A explicação?
JBS supera Petrobras pela primeira vez e registra maior receita trimestral do Brasil; confira o ranking|InfoMoney|26/08/2020|De acordo com a Economatica, desde 1998 a Petrobras não perde o posto de  empresa com maior receita do País. As duas últimas vezes que...
Petrobras aprova venda total de ações na BR Distribuidora|ACritica.NET|26/08/2020|O Conselho de Administração da Petrobras aprovou hoje (26) a proposta de  venda da integralidade de sua participação remanescente de 37,5% no capital  social...
CVM suspende julgamento que apura suposta falha da PwC em auditorias da Petrobras|InfoMoney|26/08/2020|O outro avalia se houve falha da KPMG e dois sócios ao auditar os balanços  da Petrobras de 2009 a 2011. A atuação da empresa e da PwC passam por sua  análise...
Abertura do mercado de gás pode gerar 4 milhões de empregos|Amazonas Atual|26/08/2020|A maior parte das empresas ainda tem contratos válidos com a Petrobras até  2021. A lei porá fim à exclusividade. Assim como no caso do projeto do  saneamento, o...
ConJur - Após denúncia, ministros do TCU se solidarizam ...|Consultor Jurídico|26/08/2020|... das empreiteiras na época em que era senador e presidia a Comissão  Parlamentar Mista de Inquérito da Petrobras (CPMI), no Congresso Nacional,  em 2014.
Fugro e Petrobras assinam contrato de longo prazo para serviços de ROV no Brasil|Click Petróleo e Gás|26/08/2020|A Fugro, em parceria com a Solstad e a Oceanpact, obteve três contratos de  longo prazo com a Petrobras para fornecer serviços de veículos operados...
TRF-4 derruba decisão de Moro e absolve ex-tesoureiro do PT|Amazonas Atual|26/08/2020|A turma considerou ainda extinta a punibilidade do ex-diretor de serviços  da Petrobras, Renato Duque, sobre o crime de corrupção passiva nesta  investigação.
Economia: Diogo Mac Cord é nomeado secretário especial de Desestatização|Correio Braziliense|26/08/2020|Conselho da Petrobras dá sinal verde para reajuste no preço do diesel ...  Petrobras anuncia gasolina e diesel mais caros a partir deste sábado (18).
PE Avança: Amcham Recife lança projeto para debater inovação econômica|Folha PE|26/08/2020|Petrobras reabre processo de venda de três refinarias. ESTATAL. Petrobras  reabre processo de venda de três refinarias, entre elas a Refinaria Abreu e  Lima.
Karavan O&G e Seacrest Capital compram 27 campos da ...|EPBR|27/08/2020|A Petrobras anunciou na noite desta quinta (27/8) que vendeu para a Karavan  SPE Cricaré, parceria entre a Karavan O&G Participações e Consultoria (51%)  e a...
Petrobras vê mercado para Transpetro em serviços para ...|EPBR|27/08/2020|A Petrobras está promovendo mudanças no modelo de negócio de downstream  para um cenário posterior a venda das refinarias e acredita que pode  transformar a...
Petrobras se prepara para mercado aberto|Valor Econômico|27/08/2020|Petrobras se prepara para mercado aberto. Estatal criou este ano uma  diretoria dedicada exclusivamente à área de logística e comercialização.  Por André Ramalho...
Petrobras aprovou ontem à noite (26/08) venda total de suas ações da BR Distribuidora|Click Petróleo e Gás|27/08/2020|Petrobras vendeu 30% das ações da BR Distribuidora no ano passado. Como a  participação da estatal ficou menor que 50%, a operação significou a  privatização...
O Rio Grande do Norte precisa continuar sua marcha de ...|EPBR|27/08/2020|A continuidade e a aceleração de vendas de campos terrestres dentro do  programa de desinvestimento da Petrobras, assim como resultantes de  outras...
TCU vê gestão temerária em compra de ações da Petrobrás pelo fundo soberano|Economia & Negócios|27/08/2020|TCU vê gestão temerária em compra de ações da Petrobrás pelo fundo  soberano. O ex-ministro da Fazenda, Guido Mantega, o ex-secretário do  Tesouro Nacional, Arno...
Actemium assina contrato com a Petrobras para serviços nas plataformas de petróleo offshore P-74, P-75, P- ...|Click Petróleo e Gás|27/08/2020|Situadas no campo de Búzios, as plataformas de petróleo da Petrobras irão  contar com a construção e montagem de novos módulos offshore pela Actemium.
Petrobras e DOF Subsea fecham quatro contratos no valor de US$ 110 milhões para projetos offshore no Brasil|Click Petróleo e Gás|27/08/2020|Empresa offshore da Noruega, a DOF Subsea obtém negócios de 18 meses para  trabalhos de pesquisa e inspeção na costa brasileira para a Petrobras.
180 vagas de emprego de nível fundamental e médio para contratos Petrobras offshore e onshore em Macaé e Espírito Santo|CPG Click Petroleo e Gas|27/08/2020|A Petrobras fechou mais três contratos com a Elfe Engenharia, ... de três  novos contratos junto a Petrobrás no mês de Junho de 2020; UO-Rio lote A,...
Etanol deixará de valer a pena com a nova gasolina? Não é bem assim|UOL|27/08/2020|Isso sem contar que, segundo a ANP e a Petrobras, os benefícios da nova  formulação são mais perceptíveis em motores modernos - especialmente os  equipados com...
FUP aprova proposta da Petrobras que dá estabilidade de emprego até 2022|Valor Econômico|28/08/2020|A Petrobras se comprometeu a não realizar demissões sem justa causa até 31  de agosto de 2022. Os empregados da estatal são contratados no regime  celetista...
Petrobras aumenta preço do gás de cozinha em 5%. Distribuidoras vão repassar|Blog do Correio Braziliense|28/08/2020|A Petrobras confirmou, nesta sexta-feira (28/08), mais um aumento no preço  médio do gás de cozinha (GLP), desta vez, de 5,0%. As distribuidoras já  avisaram que...
Petrobras concretiza venda de 27 campos de petróleo no ES para Karavan O&G e Seacrest Capital por 155 milhões de dólares|CPG Click Petroleo e Gas|28/08/2020|A Karavan O&G, deterá 51%, enquanto a empresa Seacrest Capital, deterá os  demais 49%. A petrobras informa que o valor da venda é de US$ 155 milhões,  sendo (a)...
Petrobras planeja logística para atender mercados onde não ...|Jornal do Comércio|28/08/2020|Estatal colocou oito refinarias à venda, entre elas a Refap, no Rio Grande  do Sul. ANDRÉ VALETIM/BANCO DE IMAGENS PETROBRAS/DIVULGAÇÃO/JC. As  discussões sobre o...
Meio ambiente perde R$ 76 milhões para a covid-19 em ...|Poder360|28/08/2020|Esse é o dinheiro que coube aos 3 Estados da parcela da multa da Petrobras  destinada para ações contra o desmatamento. Os 9 Estados da Amazônia legal  receberam...
A produção de gás natural na Bacia Potiguar no período 2000 ...|EPBR|28/08/2020|Com a priorização por parte da Petrobras pelos prolíficos reservatórios do  pré-sal, emerge uma conjuntura interessante para empresas independentes  assumirem a...
630 empregos diretos e indiretos em nova fábrica da JBS, a empresa que superou a Petrobras em receita. Unidade em SP será inaugurada em 2021|CPG Click Petroleo e Gas|28/08/2020|Depois de 22 anos, Petrobras perde liderança em receita para a processadora  de carnes JBS. No segundo trimestre, o frigorífico gerou R$ 67,6 bilhões  contra R$...
55% do empresariado avaliam o governo Bolsonaro como ótimo/bom|Exame|28/08/2020|Líder do governo na Câmara pede assinaturas para CPI da Petrobras. Preço do  combustível é uma decisão da Petrobras, não do governo, diz ministro.
Bolsonaro vive seu melhor momento político, mas está perto de jogar tudo fora|Money Times|28/08/2020|Comprar ou vender? Mercado vê riscos políticos que podem afetar ação da  Petrobras. Leia mais sobre: Economia, Eleições,...
Refinaria na Nigéria é a maior aposta de bilionário africano|Money Times|28/08/2020|Gasolina e etanol têm primeira queda de preço depois de três meses de altas  · Se havia dúvida de que a Petrobras (PETR4) amarrava preço do etanol nas  usinas...
Breve história do monopólio do petróleo no Brasil: vamos vender tudo para “os gringos”?|Money Times|29/08/2020|Petrobrás Abrir mão das refinarias contribuirá para o enfraquecimento da  Petrobras em um movimento contrário ao das companhias atuantes no setor,...
Belle Silva escolhe bolsa de R$ 15 mil para viajar entre Paris e Itália para curtir férias|Yahoo Notícias|29/08/2020|Bolsonaro diz que Petrobras pode perder mais R$30 bilhões em valor de  mercado com CPI. há um dia. Extra. Homem é acusado de decapitar ex-namorada  grávida de...
Ouvimos Gregorio Duvivier sobre seu tema da vez: day trade|Exame|29/08/2020|Ibovespa fecha em forte alta com aprovação do novo presidente da Petrobras  (PETR3). Mercados. Há uma hora • 4 min de leitura...
Submarino do PROSUB, S43 Angostura construído pela ICN realizou o embarque do primeiro tubo de lançamento ...|CPG Click Petroleo e Gas|29/08/2020|Petrobras encomenda de empresa em Belo Horizonte 34 torpedos de ancoragem  para o FPSO Mero 1 · Muitas vagas abertas na construção civil para  trabalhar em...
Um ano depois, óleo deixa rastro de danos ambientais e na pesca do Nordeste|Folha|29/08/2020|... a retirada do óleo começou a ser feita de forma coordenada por Forças  Armadas e Petrobras, além de órgãos ambientais federais, estaduais e  municipais.
Top Picks: Saída da Petrobrás da BR Distribuidora é positiva ...|Portos e Navios|30/08/2020|A saída definitiva da Petrobrás do capital da BR Distribuidora, anunciada  esta semana, é positiva para as duas companhias, segundo analistas do  mercado...
Guilherme Estrella: Não teríamos descoberto o pré-sal com a ...|Tribuna do Norte|30/08/2020|Guilherme de Oliveira Estrella, geólogo e ex-diretor de Exploração e  Produção da Petrobras entre os anos de 2003 a 2012 é considerado um dos  grandes...
Um caminho para destravar os investimentos em infraestrutura|Congresso em Foco|30/08/2020|CPI da Petrobras é improvável, afirma líder de frente dos caminhoneiros ·  Lucas Neiva · Ao Vivo Câmara aprova criação de fundos de projetos para  consórcios.
Venda de navios encalha com Covid e regras mais rígidas|Money Times|30/08/2020|Gasolina e etanol têm primeira queda de preço depois de três meses de altas  · Se havia dúvida de que a Petrobras (PETR4) amarrava preço do etanol nas  usinas...
Equinor entrega equipamentos offshore com drones e se torna a primeira do mundo na modalidade dentro da indústria de petróleo e gás|CPG Click Petroleo e Gas|30/08/2020|Pela primeira vez no Brasil Drone é utilizado na inspeção de espaço  confinado em plataforma da Petrobras · Acaba de ser construído um drone  para vigilância...
Brasil espera que EUA revertam redução de cota para aço semiacabado|Exame|30/08/2020|Nova diretoria da Petrobras pode mudar política de preços, diz Bolsonaro.  Balcão de operações no FNDE: entenda as acusações de corrupção contra  Milton...
Lojas Renner (LREN3) Anuncia a Inauguração de Novas Lojas|The Capital Advisor|30/08/2020|O QUE LER AGORA... · Ibovespa Sobe +0,21% Após Demissão na Petrobras; PRIO3  +3,90% · Carteira Recomendada GuiaInvest Vale a Pena o Canal? (Análise) ·  Ministro diz...
Um ano de manchas de óleo no Nordeste: relembre um dos ...|O POVO|30/08/2020|Uma investigação feita pela Petrobras e pela Marinha, porém, identificou a  mesma “assinatura” do óleo da Venezuela no petróleo que apareceu nas praias  do...
Petrobras anuncia implementação de plano home office pós pandemia para funcionários|CPG Click Petroleo e Gas|31/08/2020|O modelo permanente home office Petrobras pode ajudar na redução de custos  por meio da otimização da ocupação de prédios administrativos.
Se Refinaria for privatizada, RS pode ficar sem representação ...|Brasil de Fato|31/08/2020|A campanha Petrobras Fica vai ser lançada no Rio Grande do Sul nesta  quinta-feira, 3 de setembro, às 19h, em audiência pública virtual  transmitida pela...
Brazil's Lower House close to vote end of Petrobras virtual ...|Reuters|31/08/2020|Petrobras, as the producer is known, lost the monopoly in the oil and gas  sector by law more than two decades ago, but in practice kept a virtual  monopoly...
Actemium assinou contrato com a Petrobras para a execução de serviços na Refinaria de Paulínia (Replan), em São Paulo|Click Petróleo e Gás|31/08/2020|O prazo de execução do contrato entre a Petrobras e a Actemium é de  aproximadamente 600 dias e contará com soluções na Refinaria de Paulínia,  em São Paulo.
BTG Pactual, Petrobrás e até governo brasileiro têm recursos em paraísos fiscais|Cointelegraph|31/08/2020|Entre as surpresas da lista de empresas e entidades brasileiras estão o  banco BTG Pactual, fundado pelo ministro da economia Paulo Guedes, a  Petrobrás e até...
"O pai do pré-sal fala sobre a Petrobras: ""Ela está provocando o povo""- CPG Click Petroleo e Gas"|Click Petróleo e Gás|31/08/2020|Em entrevista com Luis Nassif, o Pai do Pré-sal e ex- diretor da Petrobras  Guilherme Estrella fala sobre o papel central da estatal brasileira na  indústria e...
Vital do Rêgo, ministro do TCU, torna-se réu na Lava Jato|Poder360|31/08/2020|... ele deveria evitar que os executivos da construtora OAS fossem  convocados para prestar depoimento nas comissões parlamentares de inquérito  da Petrobras.
Há exatos 4 anos, Dilma Rousseff sofria o segundo impeachment na história do país|Aventuras na História|31/08/2020|Na época, Eduardo...
Lucro da Afya cresce 163% no 2º trimestre e soma R$ 82,6 milhões|Money Times|31/08/2020|Comprar ou vender? Mercado vê riscos políticos que podem afetar ação da  Petrobras. Leia mais sobre: Ações, AFYA,...
Advogado da família do pastor Anderson pede para Maia afastar Flordelis|Exame|31/08/2020|Criminosos atacam agência da Caixa em Itajubá, interior de MG; veja vídeo.  Governistas travam assinaturas pela CPI da Petrobras, cobrada por Bolsonaro.
