title|media|date|desc
Proposta cria passaporte sanitário válido na pandemia de Covid-19|Exame|12/05/2021|Teto do ICMS e demissão na Petrobras são destaques da semana. Brasil ...  Teto do ICMS e demissão na Petrobras são destaques da semana.
O que mudou no Brasil 5 anos após o afastamento de Dilma|ISTOÉ DINHEIRO|12/05/2021|O impeachment, porém, teve como pano de fundo outros motivos: recessão  econômica intensa, enorme escândalo de corrupção envolvendo a Petrobras,  protestos de...
Com mais vendas, Raia Drogasil (RADL3) lucra R$ 177,9 milhões, alta de 16,5%|Suno|12/05/2021|Petrobras (PETR4) e Eletrobras (ELET3) são destaques do mercado · Notícias  Negócios Com mais vendas, Raia Drogasil (RADL3) lucra R$ 177,9 milhões,...
Petrobras reverte prejuízo e tem lucro de R$ 1,16 bilhão no primeiro trimestre|G1|13/05/2021|Petrobras reverte prejuízo e tem lucro de R$ 1,16 bilhão no primeiro  trimestre. No mesmo período do ano passado, estatal reportou perdas de R$  48,5 bilhões.
Petrobras obtém lucro de mais de R$ 1 bilhão no primeiro trimestre|Agência Brasil|13/05/2021|Aumento da produção. Com relação ao resultado operacional, no primeiro  trimestre de 2021, a Petrobras aumentou sua produção de petróleo e gás  natural em 3% em...
Petrobras lucra R$ 1,17 bilhão no 1º trimestre e Ebitda cresce 30,5% na comparação anual|InfoMoney|13/05/2021|SÃO PAULO – A Petrobras (PETR3; PETR4) lucrou R$ 1,167 bilhão no primeiro  trimestre de 2021, revertendo o prejuízo de R$ 48,52 bilhões registrado no  mesmo...
3R Petroleum está em fase de negociação final com ...|Portos e Navios|13/05/2021|3R Petroleum está em fase de negociação final com Petrobras por campo na  Bacia de Campos. Clipping: Offshore: 13 Mai 2021.
Mais um surto de Covid-19 em plataformas da Petrobrás ...|Abc do ABC|13/05/2021|Mais um surto de Covid-19 em plataformas da Petrobrás, desta vez na P-47.  Treze petroleiros com sintomas da doença desembarcaram nesta semana. Quatro  deles...
Petrobras anuncia as feiras e ações literárias que serão patrocinadas|Revista News|13/05/2021|O programa Petrobras Cultural Para Crianças irá patrocinar feiras e ações  literárias voltados para o público infantil, com ênfase em crianças de até  6 anos...
Porto do Açu – Açú Petróleo fecha contrato com a Petrobras para exportar 240 milhões de barris de petróleo em dois anos|CPG Click Petroleo e Gas|13/05/2021|Açu Petróleo assinou contrato com a Petrobras que vai mais do que dobrar o  volume de óleo exportado pela petroleira no terminal do Porto do Açu.
Onyx disse em 2015 sobre direito de ficar calado em CPI: 'Só bandido usa'|Estado de Minas|13/05/2021|... Onyx Lorenzoni (Democratas), usou o Twitter, em 2015, para comentar  decisão do ex-presidente da Petrobras, Nestor Cerveró, de ficar em silêncio  durante...
Petrobras não chega a um acordo com Proquigel e irá desativar usina termelétrica na Bahia|CPG Click Petroleo e Gas|13/05/2021|A Petrobras publicou uma nota, na última terça-feira (11/05), anunciando  que irá desativar a usina termelétrica TermoCamaçari, no estado da Bahia,...
Sindipetro promove ação, em Canoas, pelo preço justo da gasolina|Sul 21|13/05/2021|A ação faz parte das campanhas “Petrobrás Fica no RS” e “A Petrobrás é  nossa. O preço pode ser justo”. Segundo Miriam Cabreira, diretora do  sindicato, o governo...
Petrobras diz que busca competitividade com política de preços de combustíveis|CNN Brasil|14/05/2021|A nova gestão da Petrobras manteve a maneira de gerenciar ajustes de preços  dos combustíveis e busca praticar valores em níveis competitivos,...
Mesmo na pandemia, Petrobras fecha trimestre com lucro de R$ 1,2 bi|Agência Brasil|14/05/2021|﻿Mesmo com o agravamento da pandemia no país, a Petrobras obteve no  primeiro trimestre do ano um lucro líquido de R$ 1,2 bilhão.
Petrobras e Eletrobras reportam lucros bilionários no 1º trimestre em meio a mudanças de gestão|Forbes Brasil|14/05/2021|Em meio à dança das cadeiras em suas presidências, a Eletrobras e a  Petrobras divulgaram nesta semana seus resultados do primeiro trimestre  deste ano – e...
Petrobras Cultural Para Crianças divulga feiras e ações ...|PublishNews|14/05/2021|A verba investida pela Petrobras será de R$ 3 milhões. A lista traz  projetos de referência nacional, como a Flipinha, eixo infantil da Flip  (Feira Literária...
Sinais de dividendos e de políticas pró-mercado: os fatores que fizeram a Petrobras ganhar R$ 15,7 bi após o balanço|InfoMoney|14/05/2021|A Petrobras ainda conseguiu aumentar sua participação nos mercados dos dois  combustíveis para 73%. Na comparação com o quarto trimestre do ano passado,  houve...
Petrobras em queda, bancos tradicionais em alta: Forbes lista 21 maiores empresas de capital aberto no Brasil|GQ Brasil|14/05/2021|Petrobras em queda, bancos tradicionais em alta: Forbes lista 21 maiores  empresas de capital aberto no Brasil. Holding do Itaú lidera lista baseada  em valor de...
ANP autoriza Petrobras e Ambar a importarem gás natural|CanalEnergia|14/05/2021|A Agência Nacional de Petróleo, Gás Natural e Biocombustíveis autorizou  nesta sexta-feira, 14 de maio, que a Petrobras importe GNL de qualquer país  no...
Petrobras, Magazine Luiza, Renner, Qualicorp, Centauro e mais: veja destaques de empresas|Valor Investe|14/05/2021|Petrobras, Magazine Luiza, Renner, Qualicorp, Centauro e mais: veja  destaques de empresas. Cosan, Enjoei, MMX, Orizon, PDG Realty, Portobello,  Vivara, Cemig e...
Ultrapar deve terminar ano com novo portfólio de ativos|Época Negócios|14/05/2021|Uma das ações é entrada do grupo em área de refino de petróleo, por meio da  compra da Refap, da Petrobras. 1 min de leitura.
Arrecadação de royalties vai a R$ 3,3 bilhões em março e ...|Poder360|14/05/2021|Agência Petrobras/Flávio Emanuel. Fachada do edifício-sede da Petrobras, no  Rio de Janeiro Ludmylla Rocha 14.maio.2021 (sexta-feira) - 20h56.
Petrobras reduz número de plataformas e custos de ...|Portos e Navios|16/05/2021|A Petrobras fechou o primeiro trimestre de 2021 com 47 plataformas sob sua  operação, ante 86 em igual período do ano anterior, disse o diretor  executivo da...
Petrobras espera ter decisão final sobre plataforma de ...|Portos e Navios|16/05/2021|A Petrobras pretende ter a decisão final de investimento para a plataforma  do projeto de águas profundas na Bacia de Sergipe-Alagoas até meados de  2022,...
Especial: Bolsonaro faz indústria naval regredir aos anos 1990|Partido dos Trabalhadores|16/05/2021|Revitalizada pelos governos petistas, a indústria naval brasileira regride  à era de Fernando Henrique Cardoso, quando o sucateamento da Petrobras  conduziu...
Ricardo Nunes assume prefeitura de São Paulo em definitivo|Suno|16/05/2021|Petrobras (PETR4): 'Tenho uma ideia de fatiar a empresa', afirma ·  Petrobras (PETR4): 'Tenho uma ideia de fatiar a empresa', afirma Bolsonaro.
CEO do Spotify (S1PO34) tem oferta de compra recusada pelo Arsenal|Suno|16/05/2021|Oi (OIBR3) adia novamente prazo final para recuperação judicial · Petrobras  (PETR4): Lira quer 'pressão máxima' para reduzir preço dos combustíveis.
Saraiva (SLED4) reduz para R$ 20,3 milhões o prejuízo no 1TRI21|Eu Quero Investir|16/05/2021|Radar traz Petrobras (PETR3; PETR4), Vale (VALE3) e Eneva (ENEV3) · Por  redacao.euqueroinvestir em 03/06/22 · 1 · FII Summit: os REITs chegaram  para ficar.
Ex-diretor da Petrobras assume presidência do Instituto Brasileiro de Petróleo|CNN Brasil|17/05/2021|O engenheiro Eberaldo de Almeida Neto vai assumir a presidência do  Instituto Brasileiro de Petróleo e Gás (IBP). Ex-funcionário da Petrobras,  onde trabalhou...
Após Itaú BBA, Bradesco BBI eleva recomendação para Petrobras e diz que “hora de comprar ação é agora”|InfoMoney|17/05/2021|SÃO PAULO – A confiança com as ações da Petrobras (PETR3;PETR4) – que já  vinha subindo depois dos tempos turbulentos registrados em fevereiro com a  saída do...
ANP define especificações para 'diesel verde'|Época Negócios|17/05/2021|"No ano passado, a Petrobras disse ter concluído com sucesso testes em  escala industrial em uma de suas refinarias para a produção do ""diesel  renovável"", que..."
Petrobras (PETR4) Soma US$ 2,5 Bi em Desinvestimentos em 2021|The Capital Advisor|17/05/2021|A intenção da Petrobras (PETR4) é dar continuidade ao programa de venda de  ativos, inclusive a venda de oito refinarias. imagem. Eduardo-photo...
Petrobras tem expectativas para perfurar pelo menos três poços de petróleo, na foz do Amazonas, até final de 2022|CPG Click Petroleo e Gas|17/05/2021|A Petrobras possui planejamento para começar a perfuração em poços de  petróleo na bacia da foz do Rio Amazonas no próximo ano.
ANP publica especificação brasileira do diesel verde|BiodieselBR.com|17/05/2021|O movimento gerou atritos entre a Petrobras e os fabricantes de biodiesel  que temiam que a estatal tirasse proveito de sua posição de mercado para  avançar sobre...
Governo do DF avança no processo de licitação do Hospital Oncológico de Brasília|Diário do Poder|17/05/2021|Diário do Poder. Dá para alterar a política de usura na Petrobras · Diário  do Poder ... Diário do Poder. Lucro abusivo da Petrobras é de meio bilhão  por dia.
Miss Brasil é vice na disputa do Miss Universo - 17/05/2021 ...|Tribuna do Norte|17/05/2021|Petrobras conclui teste de produção de querosene de conteúdo renovável ...  Westin: Modelo de privatização da Petrobras será abarcado em projeto e  depende do...
A pedido de bancários da Caixa, Dieese faz levantamento e ...|Revista Forum|17/05/2021|“O resultado de 2019, por exemplo, foi fortemente influenciado pela venda  de Notas do Tesouro Nacional (NTN-B) e de ações da Petrobras”, explica  Sergio...
Rio não é mais o segundo parque industrial do país. Veja quem é o novo vice|Blogs|17/05/2021|"O Comperj, maior obra em atividade da Petrobras, também teve contratos  alterados que causaram prejuízos à estatal | Genilson Araújo / 21-3-2014."
Petrobras terá mais duas sondas em operação até setembro|Portos e Navios|18/05/2021|O comprimento do navio sonda é de 230 metros, o que equivale a duas vezes a  altura do Edifício-Sede (Edise) da Petrobras. As sondas de perfuração  marítimas...
Petrobras: administração acerta no discurso – está na hora de comprar as ações|Money Times|18/05/2021|Está na hora de adquirir as ações da Petrobras (PETR4), afirmou a Ágora  Investimentos. A corretora revisou a recomendação do papel de neutra para  compra,...
Petrobras reabre processo de venda do maior polo de ...|A Gazeta|18/05/2021|Petrobras reabre processo de venda do maior polo de petróleo do Norte do ES  · Petroleira tenta vender a área desde o ano passado, mas não teve sucesso  em meio à...
Preço da gasolina ultrapassa R$ 6 e etanol atinge quase R$ 5 nos postos de combustíveis e da um soco no bolso dos consumidores|CPG Click Petroleo e Gas|18/05/2021|Há postos em Brasília em que o litro do etanol passa de R$ 4,70. Petróleo  sobe na última sexta (14/05) e Petrobras deve aumentar, ainda mais, o preço  da...
Mercado de gás de cozinha teme nova interferência|Valor Econômico|18/05/2021|Em paralelo, o segmento de distribuição vive uma nova dinâmica, depois da  compra da Liquigás pelo consórcio Copagaz - Itaúsa - Nacional Gás Butano. A  Petrobras...
MPE investiga possível prejuízo aos cofres públicos com venda da Refap|Sul 21|18/05/2021|Luciano Velleda A perspectiva de privatização da Refinaria Alberto  Pasqualini (Refap), localizada em Canoas, pode levar a Petrobras a vender  uma área que...
Privatização da Eletrobras pode receber aval da Câmara nesta terça|Exame|18/05/2021|É só com o aval do legislativo que empresas como a gigante do setor de  energia, bancos públicos e a Petrobras podem sair do controle estatal.
Tubulações, andaimes e válvulas voam pelos ares com explosão na refinaria da Petrobras na Bahia|CPG Click Petroleo e Gas|18/05/2021|Tubulações, andaimes e válvulas voam pelos ares com explosão na refinaria  da Petrobras na Bahia · Acidente na Refinaria Landulpho Alves (RLAM) causa  deslocamento...
Pague Menos compra Extrafarma por R$ 600 mi, segundo ...|TradeMap|18/05/2021|O grupo está em negociações exclusivas com a Petrobras para a aquisição da  refinaria Regap, localizada no Rio Grande do Sul.
Sem apoio no Congresso, Bolsonaro diz que pode recorrer ao ...|EPBR|18/05/2021|“Quando aumenta a gasolina, o pessoal me culpa. Agora, quando eu diminuo,  não baixa na ponta da linha”, reclamou o presidente a seus apoiadores. A  Petrobras,...
Trabalhadores da Petrobras Biocombustível entram em greve ...|Brasil de Fato|19/05/2021|"A privatização da Petrobras Biocombustível foi anunciada em julho de 2020 e  está na fase vinculante de venda das usinas. Catarina Barbosa. Belém (PA) |  Brasil..."
Petrobras tem novo diretor-executivo de Governança|CNN Brasil|19/05/2021|O novo diretor executivo de Governança e Conformidade da Petrobras,  Salvador Dahan, tomou posse na terça-feira, segundo comunicado ao mercado  da estatal.
Há 1 mês na Petrobras, Silva e Luna mantém 'calmaria', dizem analistas|Exame|19/05/2021|As últimas quatro semanas não foram muito diferentes na Petrobras do que  haviam sido os meses anteriores, mesmo com novo presidente, novo conselho e  nova...
Estados rejeitam mudar ICMS de combustíveis e deputados ...|Câmara dos Deputados|19/05/2021|Apesar de reconhecerem o impacto do tributo no valor pago nos postos de  abastecimento, eles culparam a política da Petrobras que vincula os preços  ao...
Preços dos combustíveis não param de subir no Distrito Federal|Correio Braziliense|19/05/2021|Apesar do dólar mais comportado e da pausa dada pela Petrobras nos  reajustes cobrados nas refinarias, o consumidor não tem trégua na hora de  abastecer o...
Morreu ontem (18/05) petroleiro da Aker Solutions após passar mal embarcado em plataforma da Petrobras na Bacia de Campos|CPG Click Petroleo e Gas|19/05/2021|Petrobras informou no dia 31/01 a morte de colaborador em acidente  ocorrido, no FPSO Cidade de Mangaratiba. Informações sobre um acidente  fatal a bordo do FPSO...
Petrobras amplia frota de sondas de perfuração para intensificar atividades exploratórias e de desenvolvimento da produção offshore nas Bacias de Campos, Espírito Santo e Santos|CPG Click Petroleo e Gas|19/05/2021|Com as quatro novas sondas de perfuração, Petrobras atingirá em setembro  deste ano uma frota de 22 unidades marítimas em operação nas bacias de  Campos e...
Do anonimato ao protagonismo feminino - Projeto Mão na Massa|Diário de Canoas|19/05/2021|Criação da Escola de Gastronomia pela Associação de Mulheres Multiplicar só  foi possível em razão da parceria com a Petrobras, através do Programa  Petrobras...
Trigo e soja despencam em Chicago com vendas de fundos; milho fica estável|Money Times|19/05/2021|Últimas Notícias Cotações Comprar ou Vender FGTS Eletrobras Petrobras ·  Instagram · YouTube · Linkedin Facebook · Google Facebook Twitter.
Consumo de gás para gerar energia cresce e influencia ...|Amazonas Atual|19/05/2021|A Petrobras prevê para agosto parada para manutenção no sistema de  Mexilhão, um dos principais produtores de gás do país, o que deve levar à  paralisação de...
Servidores de subsidiária da Petrobras entram em greve por tempo indeterminado na Bahia|G1|20/05/2021|Os servidores da Petrobras Biocombustível (PBio) na cidade de Candeias, na  região metropolitana de Salvador, iniciaram uma greve nesta quinta-feira  (20),...
Unigel aposta no agronegócio para lucrar com fábrica arrendada da Petrobrás|Terra|20/05/2021|RIO - Grande fornecedora de ureia para o agronegócio no Brasil, a Unigel  Agro Sergipe, fábrica de fertilizantes arrendada da Petrobrás no ano  passado,...
Morre o arquiteto José Maria Gandolfi, professor de Jaime Lerner e criador do prédio da Petrobras|Tribuna do Paraná|20/05/2021|... José Maria Gandolfi, professor de Jaime Lerner e criador do prédio da  Petrobras no RJ ... como o edifício sede da Petrobrás, faleceu vítima de  câncer.
Preço da gasolina, etanol e diesel não param de subir, deputados se negam mudar ICMS em meio a disparada nos preços do combustíveis e Petrobras ´paga o pato`|CPG Click Petroleo e Gas|20/05/2021|Petrobras é ´atacada` pela disparada nos preços dos combustíveis, por  deputados — que se negam mudar ICMS em meio à crise causada por aumentos  consecutivos...
Perspectiva é de otimismo com cautela, diz Unigel|Valor Econômico|20/05/2021|Petroquímica acaba de colocar em operação a primeira fábrica de  fertilizantes arrendada da Petrobras, em Sergipe. Por Stella Fontes — De  São Paulo.
Governo prepara extinção de 2 mil atos normativos na Previdência|VEJA|20/05/2021|Repercutiu dentro e fora do Brasil a decisão do presidente Jair Bolsonaro  de trocar mais uma vez o comando da Petrobras. Na segunda substituição em  pouco...
Lupo contrata bancos para abrir capital na B3, diz portal|Suno|20/05/2021|Petrobras (PETR4) e Eletrobras (ELET3) são destaques do mercado · Notícias  Negócios Lupo contrata bancos para abrir capital na B3, diz portal.
Fitch Affirms COMGAS's IDR at 'BB'; Outlook Negative|Fitch Ratings|20/05/2021|... nos próximos anos, apesar de os contratos de fornecimento com a  Petróleo Brasileiro S.A. (Petrobras) vencerem em dezembro de 2021 e em  dezembro de 2023.
Fenarroz 2021 ocorrerá de 12 a 17 de outubro|Rede Novo Tempo de Comunicação|20/05/2021|Petrobras anuncia aumento na gasolina, no diesel e gás de cozinha.  05/07/2021 · Medicamentos têm aumento de até 10.000% nos preços durante  pandemia.
Migrantes e refugiados são capacitados em educação ...|Amazonas Atual|20/05/2021|sede da Petrobras · Economia · Privatização da Petrobras não tem prazo para  ser enviada ao Congresso, diz governo · 2 de junho de 2022.
Petrobras (PETR4): Bolsonaro questiona preços de combustíveis mas nega canetada|Suno|21/05/2021|“A Petrobras vai visar o lucro sim, mas também vai ver a parte social. Tem  certos preços que não têm cabimento continuar. E não é na canetada não,  fiquem...
Petrobras recebe ofertas por fatia em gasoduto, dizem fontes|Forbes Brasil|21/05/2021|A Petrobras colocou suas participações no gasoduto TBG de 2.593 km, que  importa gás da Bolívia, e no gasoduto TSB, no extremo sul, à venda em  dezembro,...
Trabalhadores da Petrobras entram em greve contra ...|FDR|21/05/2021|Nesta quinta-feira (20), os trabalhadores da Petrobras Biocombustível  (PBio) entraram em greve por tempo indeterminado. Esta paralisação acontece  como forma...
Petrobras pode recuperar R$ 4,4 bi com exclusão de ICMS do PIS/Cofins|CNN Brasil|21/05/2021|A Petrobras comunicou na quinta-feira (21), que a decisão do Supremo  Tribunal Federal (STF) de excluir o valor do ICMS da base de cálculo do PIS  e do Cofins...
Petrobras, Usiminas, Marfrig, Traders Club, Stone, Renner e mais: veja destaques de empresas|Valor Investe|21/05/2021|Petrobras, Usiminas, Marfrig, Traders Club, Stone, Renner e mais: veja  destaques de empresas. Uma fala do presidente Jair Bolsonaro pode fazer  preço no mercado.
Morre aos 88 anos o arquiteto José Maria Gandolfi|Casa Vogue|21/05/2021|Com 37 prêmios na carreira, ele deixou sua marca em obras em Curitiba e  pelo país, como o edifício-sede da Petrobras, no Rio.
Presidente da Petrobras e prefeito de Macaé se reúnem para tratar geração de empregos e investimentos em portos, construção de usinas termelétricas e ampliação do aeroporto na cidade|CPG Click Petroleo e Gas|21/05/2021|O presidente da Petrobras e o prefeito Welberth Rezende, buscam geração de  empregos e investimentos para a cidade do petróleo! A semana inicou com  boas notícias...
'Desistir não era uma opção', diz Cristina Pinho, primeira mulher a gerenciar uma plataforma de petróleo no Brasil|O Globo|21/05/2021|Em sua passagem pela Petrobras, por exemplo, ela relata que não havia  quartos nem banheiros para as mulheres que trabalhavam embarcadas.
MP da Eletrobras (ELET3): privatização ou 'jabuti'? Entenda o caso|Suno|21/05/2021|Petrobras (PETR4): 'Tenho uma ideia de fatiar a empresa', afirma ·  Petrobras (PETR4): 'Tenho uma ideia de fatiar a empresa', afirma Bolsonaro.
Cinco passos para se tornar um líder populista e fazer sucesso|Consultor Jurídico|21/05/2021|... por exemplo — que chegaram a virar sócios da apelidada Fundação  Dallagnol, que drenaria algo como R$ 2,5 bilhões da Petrobras. Troca de cipó
Petrobras renova patrocínio a 22 atletas olímpicos e paraolímpicos|UOL|22/05/2021|"A Petrobras renovou por mais um semestre o patrocínio direito a esportistas  brasileiros por meio do ""Time Petrobras"", agora composto por 22 atletas  que..."
ConJur - Moraes: Justiça do Trabalho e matérias de ...|Consultor Jurídico|22/05/2021|Esse é um alerta a todos os funcionários de Petrobras, Correios e CEF que  buscam reaver os prejuízos financeiros decorrentes do Plano de  Equacionamento de...
Greta Thunberg quer rediscutir a forma como alimentos são produzidos|Money Times|22/05/2021|Últimas Notícias Cotações Comprar ou Vender FGTS Eletrobras Petrobras ·  Instagram · YouTube · Linkedin Facebook · Google Facebook Twitter.
Proposta de edital do segundo leilão do pré-sal sai em junho, informa ministério|Click Guarulhos|22/05/2021|A Petrobras fechou um contrato com a União em 2010 para exploração de até 5  bilhões de barris de petróleo do pré-sal, em quatro áreas (Itapu, Búzios,  Sépia e...
VÍDEO: Alcoolizado e sem CNH, jovem perde controle e invade casa no DF|Correio Braziliense|22/05/2021|Eixo Capital. Aumento das forças de segurança no centro da briga eleitoral.  Nas entrelinhas: Trapalhada de Bolsonaro deixa Petrobras à deriva...
Fusão entre Marfrig e BRF seria positiva, mas não livre de desafios|Money Times|22/05/2021|Últimas Notícias Cotações Comprar ou Vender FGTS Eletrobras Petrobras ·  Instagram · YouTube · Linkedin Facebook · Google Facebook Twitter.
Goiás terá plano para Regime de Recuperação Judicial até dezembro, diz Caiado|Correio Braziliense|22/05/2021|Petrobras avisa que vai manter preços de mercado; defasagem sobe. 14:09 -  06/05/2022 - Compartilhe. Cookie Policy. Utilizamos cookies essenciais e...
Caixa paga hoje auxílio emergencial a nascidos em junho|Money Times|22/05/2021|Também é necessário cumprir outros requisitos para ter direito à nova  rodada. Leia também: petrobras · Privatização · Qual o melhor modelo de  privatização para...
Canadá recruta brasileiros para preencher muitas vagas de emprego e não há limite de idade para os candidatos|CPG Click Petroleo e Gas|22/05/2021|... 105 vagas de emprego para trabalhar na multinacional Ambev, a maior  cervejaria do planeta, hoje 21 de maio · Presidente da Petrobras e prefeito  de Macaé...
Covid-19: vírus primitivo pode aumentar mortes em UTIs, diz Fiocruz|Money Times|22/05/2021|Últimas Notícias Cotações Comprar ou Vender FGTS Eletrobras Petrobras ·  Instagram · YouTube · Linkedin Facebook · Google Facebook Twitter.
Valor em caixa da Vale é maior do que o da Petrobras|CNN Brasil|24/05/2021|A Petrobras disse ainda que a prática de preços internacionais na venda de  combustíveis foi “essencial” para continuar a reduzir o seu endividamento,  mesmo com...
Petrobras prevê investir US$ 300 milhões até 2025 em refinarias que não serão vendidas|G1|24/05/2021|A Petrobras afirmou que as unidades que receberão os aportes serão as  refinarias Presidente Bernardes, Duque de Caxias, Capuava, Paulínia e  Henrique Lage.
Na Câmara, Petrobras defende política de preços e críticos ...|EPBR|24/05/2021|Segundo o gerente-geral de Marketing e Comercialização no Mercado Interno  da Petrobras, Sandro Paes Barreto, a decisão de venda das refinarias tem  como base a...
Petrobras abre 335 vagas para jovens aprendizes|G1|24/05/2021|A Petrobras abriu nesta segunda-feira (24) as inscrições para o segundo  ciclo do Programa Petrobras Jovem Aprendiz. Serão oferecidas 335 vagas em  municípios...
Petrobras e Subsea 7 assinam contrato no campo de Mero, no pré-sal de Santos|Money Times|24/05/2021|A Petrobras (PETR4) assinou um “grande contrato” com a companhia de  serviços do setor de petróleo Subsea 7 para o desenvolvimento de  equipamentos e...
Ibovespa engata alta puxado por Petrobras e varejistas; dólar cai a R$ 5,32|InfoMoney|24/05/2021|SÃO PAULO – O Ibovespa opera em alta nesta segunda-feira (24) depois de  começar a sessão entre perdas e ganhos. Quem puxa a Bolsa são as ações da  Petrobras...
Petrobras: sair definitivamente da BR Distribuidora é bom para ambas|Money Times|24/05/2021|A venda das ações que a Petrobras (PETR3; PETR4) ainda possui da BR  Distribuidora (BRDT3) será fácil e positiva para as duas empresas. A  avaliação é da...
Preço do gás natural veicular bate recorde e reduz renda de taxistas e motoristas de aplicativo|Folha|24/05/2021|Repasse de reajuste da Petrobras levou combustível a maior valor desde o  início da série histórica da ANP. Facebook; WhatsApp; Twitter; Facebook;  WhatsApp
Magazine Luiza lidera ranking de retorno a acionista|Mercado e Consumo|24/05/2021|No mesmo levantamento, a Vale e a Petrobras garantiram vaga no ranking  formado pelas 200 maiores empresas com capitalização de mercado de no  mínimo US$ 68...
Banco do Brasil, Bombeiros RJ, Petrobrás, Uerj e PC CE são d...|Folha Dirigida|24/05/2021|A Petrobras abriu nesta segunda-feira, 24, as inscrições para o segundo  ciclo do Programa Petrobras Jovem Aprendiz (PPJA), com oferta de 335 vagas.
