title|media|date|datetime|desc|link|img
Valor de venda de refinaria da Petrobras é questionado em ...|Câmara dos Deputados|01/06/2021||Refinaria foi vendida por US$ 1,6 bilhões; Petrobras chegou a avaliar a refinaria baiana em US$ 3 bilhões; TCU lembra que a venda só será concluída em...|https://www.camara.leg.br/noticias/767001-valor-de-venda-de-refinaria-da-petrobras-e-questionado-em-debate-tcu-ainda-avalia-preco/|data:image/gif;base64,R0lGODlhAQABAIAAAP///////yH5BAEKAAEALAAAAAABAAEAAAICTAEAOw==
Petrobras vende sua participação na Eólica Mangue Seco 2 por 34,2 milhões de reais no Rio Grande do Norte|Click Petróleo e Gás|01/06/2021||Por R$ 34,2 milhões, a Petrobras vendeu sua participação de 51% da Sociedade Eólica Mangue Seco 2, localizada no estado do Rio Grande do Norte (RN).|https://clickpetroleoegas.com.br/petrobras-vende-sua-participacao-na-eolica-mangue-seco-2-por-342-milhoes-de-reais-no-rio-grande-do-norte/|data:image/gif;base64,R0lGODlhAQABAIAAAP///////yH5BAEKAAEALAAAAAABAAEAAAICTAEAOw==
Terreno da Planta de Amônia em Uberaba está à venda por mais de R$ 8 milhões|G1|01/06/2021||Fábrica de amônia foi um projeto da Petrobras para alavancar a produção de fertilizantes em uma das principais regiões agrícolas do país, mas foi suspensa...|https://g1.globo.com/mg/triangulo-mineiro/noticia/2021/06/01/terreno-da-planta-de-amonia-em-uberaba-esta-a-venda-por-mais-de-r-8-milhoes.ghtml|data:image/gif;base64,R0lGODlhAQABAIAAAP///////yH5BAEKAAEALAAAAAABAAEAAAICTAEAOw==
Vale desativa píer que foi arrendado pela Petrobras, no Porto de Tubarão, no Espírito Santo. Cerca de 300 funcionários serão demitidos|CPG Click Petroleo e Gas|01/06/2021||O contrato entre a Vale e a Petrobras terminou ontem (31/05). A estatal realizava o serviço de fornecimento de bunker no Porto de Tubarão, em Vitória.|https://clickpetroleoegas.com.br/vale-desativa-pier-que-foi-arrendado-pela-petrobras-no-porto-de-tubarao-no-espirito-santo-cerca-de-300-funcionarios-serao-demitidos/|data:image/gif;base64,R0lGODlhAQABAIAAAP///////yH5BAEKAAEALAAAAAABAAEAAAICTAEAOw==
Produção de petróleo em abril cresceu 4,6% em relação a ...|Poder360|01/06/2021||Plataforma P-56, da Petrobras, durante batismo em Angra dos Reis-RJ. Produção de petróleo em abril de 2021 aumentou 4,6% em relação a março Poder360...|https://www.poder360.com.br/brasil/producao-de-petroleo-em-abril-cresceu-46-em-relacao-a-marco-diz-anp/|data:image/gif;base64,R0lGODlhAQABAIAAAP///////yH5BAEKAAEALAAAAAABAAEAAAICTAEAOw==
Demissão na Petrobras: 3 meses depois, empresa não ...|Poder360|01/06/2021||Mais de 3 meses depois de o presidente Jair Bolsonaro anunciar a demissão do ex-presidente da Petrobras Roberto Castello Branco, a companhia ainda não...|https://www.poder360.com.br/economia/demissao-na-petrobras-3-meses-depois-empresa-nao-recuperou-valor-de-mercado/|data:image/gif;base64,R0lGODlhAQABAIAAAP///////yH5BAEKAAEALAAAAAABAAEAAAICTAEAOw==
Investimento total no campo de Bacalhau é estimado em US ...|EPBR|01/06/2021||A Equinor comprou o ativo da Petrobras em 2012. Localizado no polígono do pré-sal, a maior parte do projeto – descobertas de Carcará e Guanxuma – estão no...|https://epbr.com.br/investimento-total-no-campo-de-bacalhau-e-estimado-em-us-8-bilhoes/|data:image/gif;base64,R0lGODlhAQABAIAAAP///////yH5BAEKAAEALAAAAAABAAEAAAICTAEAOw==
Gasmig busca amenizar impactos do aumento do gás natural|Estado de Minas|01/06/2021||A Petrobras reiterou, ainda, que o preço final do gás natural ao consumidor não é determinado somente pelo preço de venda, mas pelas margens das distribuidoras...|https://www.em.com.br/app/noticia/economia/2021/06/01/internas_economia,1272562/gasmig-busca-amenizar-impactos-do-aumento-do-gas-natural.shtml|data:image/gif;base64,R0lGODlhAQABAIAAAP///////yH5BAEKAAEALAAAAAABAAEAAAICTAEAOw==
Em novo aumento, gasolina chega a ser vendida a R$ 6,29 ...|Cidade Verde|01/06/2021||Desde o dia 1º de maio, o valor do litro da gasolina não sofre reajuste da Petrobras nas refinarias, mas essa não é a realidade nos postos de combustíveis...|https://cidadeverde.com/noticias/347871/em-novo-aumento-gasolina-chega-a-ser-vendida-a-r-629-em-teresina|data:image/gif;base64,R0lGODlhAQABAIAAAP///////yH5BAEKAAEALAAAAAABAAEAAAICTAEAOw==
Ibovespa sobe 1,5% e passa de 128 mil pontos após PIB surpreender positivamente o mercado|Valor Investe|01/06/2021||... ferro ajudam a impulsionar ações de gigantes da bolsa, como Vale e Petrobras ... Destaques de empresas: Vivara, Eletrobras, Gol, Totvs, Vale, Petrobras,...|https://valorinveste.globo.com/cotacoes/bolsa-ao-vivo/ao-vivo/bolsa-ao-vivo-1-de-junho-de-2021.ghtml|data:image/gif;base64,R0lGODlhAQABAIAAAP///////yH5BAEKAAEALAAAAAABAAEAAAICTAEAOw==
Refino do pré-sal sobe 30% até abril e é 55% do total ...|CNN Brasil|02/06/2021||O processamento de petróleo do pré-sal brasileiro em refinarias da Petrobras alcançou a marca de 1,186 milhão de barris por dia entre janeiro e abril deste...|https://www.cnnbrasil.com.br/business/refino-do-pre-sal-sobe-30-ate-abril-e-e-55-do-total-processado-diz-petrobras/|data:image/gif;base64,R0lGODlhAQABAIAAAP///////yH5BAEKAAEALAAAAAABAAEAAAICTAEAOw==
Petrobras anuncia captação de bonds para recompra de até ...|ISTOÉ DINHEIRO|02/06/2021||De acordo com o comunicado da Petrobras, a ideia é recomprar os bonds com vencimento em 2050, que pagam juro de 6,750%, e dos quais existem US$ 1,467 bilhão em...|https://www.istoedinheiro.com.br/petrobras-anuncia-captacao-de-bonds-para-recompra-de-ate-us-25-bi-em-titulos/|data:image/gif;base64,R0lGODlhAQABAIAAAP///////yH5BAEKAAEALAAAAAABAAEAAAICTAEAOw==
Petrobras recupera valor de mercado perdido com demissão ...|Poder360|02/06/2021||A Petrobras superou na 3ª feira (1º.jun.2021) o valor de mercado que tinha quando o presidente Jair Bolsonaro anunciou a demissão do presidente da estatal...|https://www.poder360.com.br/economia/petrobras-recupera-valor-de-mercado-perdido-com-demissao-de-castello-branco/|data:image/gif;base64,R0lGODlhAQABAIAAAP///////yH5BAEKAAEALAAAAAABAAEAAAICTAEAOw==
C-Suite: Salvador Dahan é o novo diretor de governança e conformidade da Petrobras|Forbes Brasil|02/06/2021||Salvador Dahan: A Petrobras investiu grandemente no fortalecimento do seu sistema de integridade e conseguiu virar uma página da sua história. Estamos em uma...|https://forbes.com.br/carreira/2021/06/c-suite-salvador-dahan-e-o-novo-diretor-de-governanca-e-conformidade-da-petrobras/|data:image/gif;base64,R0lGODlhAQABAIAAAP///////yH5BAEKAAEALAAAAAABAAEAAAICTAEAOw==
Investigação no Brasil liga trading americana Freepoint a esquemas de propina|Época Negócios|02/06/2021||A Polícia Federal suspeita que a empresa, por meio de um intermediário, tenha pago funcionários da Petrobras por um período de aproximadamente sete anos.|https://epocanegocios.globo.com/Empresa/noticia/2021/06/investigacao-no-brasil-liga-trading-americana-freepoint-esquemas-de-propina.html|data:image/gif;base64,R0lGODlhAQABAIAAAP///////yH5BAEKAAEALAAAAAABAAEAAAICTAEAOw==
Manutenção em plataforma da Petrobras levará a perda de 3 ...|Poder360|02/06/2021||Isso porque a Petrobras vai fazer uma parada programada para manutenção da plataforma de Mexilhão e do gasoduto Rota 1, que escoa gás natural produzido em...|https://www.poder360.com.br/brasil/manutencao-em-plataforma-da-petrobras-levara-a-perda-de-35-mil-mw/|data:image/gif;base64,R0lGODlhAQABAIAAAP///////yH5BAEKAAEALAAAAAABAAEAAAICTAEAOw==
Refino do pré-sal cresce 30%; representa 55% do total ...|ISTOÉ DINHEIRO|02/06/2021||RIO DE JANEIRO (Reuters) – O processamento de petróleo do pré-sal brasileiro em refinarias da Petrobras alcançou a marca de 1,186 milhão de barris por dia...|https://www.istoedinheiro.com.br/refino-do-pre-sal-cresce/|data:image/gif;base64,R0lGODlhAQABAIAAAP///////yH5BAEKAAEALAAAAAABAAEAAAICTAEAOw==
Santander contrata ex-CFO da Petrobras como chefe de estratégia|Money Times|02/06/2021||O Banco Santander Brasil (SANB11) contratou Andrea Marques de Almeida, que foi diretora financeira da Petrobras (PETR4) até abril deste ano, para comandar a...|https://www.moneytimes.com.br/santander-contrata-ex-cfo-da-petrobras-como-chefe-de-estrategia/|data:image/gif;base64,R0lGODlhAQABAIAAAP///////yH5BAEKAAEALAAAAAABAAEAAAICTAEAOw==
Preço médio do diesel está 45% maior do que há um ano ...|Poder360|02/06/2021||petrobras-gasolina. Copyright Sérgio Lima/Poder360. Na imagem, caminhões chegam à distribuidoras da Petrobras Pedro Pligher 02.jun.2021 (quarta-feira) -...|https://www.poder360.com.br/brasil/preco-medio-do-diesel-esta-45-maior-do-que-ha-um-ano-mostra-levantamento/|data:image/gif;base64,R0lGODlhAQABAIAAAP///////yH5BAEKAAEALAAAAAABAAEAAAICTAEAOw==
ANP publica pré-edital do segundo leilão do excedente da ...|EPBR|02/06/2021||... os últimos meses articulando novas regras para facilitar o pagamento à Petrobras das indenizações por investimentos já realizados em Sépia e Atapu.|https://epbr.com.br/anp-publica-pre-edital-do-segundo-leilao-do-excedente-da-cessao-onerosa/|data:image/gif;base64,R0lGODlhAQABAIAAAP///////yH5BAEKAAEALAAAAAABAAEAAAICTAEAOw==
País produz menos, importação de diesel cresce 57% e é a maior desde 2013|UOL Economia|03/06/2021||A fatia da Petrobras nas importações também cresceu de um mês para outro. Em março, segundo a ANP, 25,7% do diesel importado foi trazido pela Petrobras. Em...|https://economia.uol.com.br/noticias/redacao/2021/06/03/diesel-importacao-petrobras-aumento-abril.htm|data:image/gif;base64,R0lGODlhAQABAIAAAP///////yH5BAEKAAEALAAAAAABAAEAAAICTAEAOw==
PETR3 e PETR4: em qual ação da Petrobras vale a pena ...|E-Investidor|03/06/2021||No caso da Petrobras, o investidor majoritário é o Governo Federal, de forma que os outros acionistas não têm um impacto significativo nas escolhas e elas...|https://einvestidor.estadao.com.br/mercado/petr3-petr4-qual-acao-da-petrobras-vale-a-pena-investir/|data:image/gif;base64,R0lGODlhAQABAIAAAP///////yH5BAEKAAEALAAAAAABAAEAAAICTAEAOw==
Aeronave da Omni Air sofre acidente em plataforma da Petrobras no Rio|AEROIN|03/06/2021||... se acidentou durante um exercício de treinamento na sonda SS-75 Ocean Courage da Diamond Offshore, arrendada à Petrobras, na noite de ontem, 2 de junho.|https://aeroin.net/aeronave-da-omni-air-sofre-acidente-em-plataforma-da-petrobras-no-rio/|data:image/gif;base64,R0lGODlhAQABAIAAAP///////yH5BAEKAAEALAAAAAABAAEAAAICTAEAOw==
Braskem será uma das mais afetadas com MP aprovada na Câmara|VEJA|03/06/2021||... a vender sua participação na petroquímica até o fim do ano para pagar credores. O outro sócio, a Petrobras, também vai se desfazer de sua parte.|https://veja.abril.com.br/coluna/radar-economico/braskem-sera-uma-das-mais-afetadas-com-mp-aprovada-na-camara/|data:image/gif;base64,R0lGODlhAQABAIAAAP///////yH5BAEKAAEALAAAAAABAAEAAAICTAEAOw==
Preço da gasolina, etanol, diesel e GNV não param de subir e o mais novo combustível biometano veio para ´salvar` motoristas de aplicativo, taxistas e trabalhadores|CPG Click Petroleo e Gas|03/06/2021||Petrobras fez um novo reajuste no preço do GNV, aumentando 39% para as distribuidoras. Segundo o levantamento feito pela Agência Nacional de Petróleo,...|https://clickpetroleoegas.com.br/preco-da-gasolina-etanol-diesel-e-gnv-nao-param-de-subir-e-o-mais-novo-combustivel-gnc-veio-para-salvar-motoristas-de-aplicativo-taxistas-e-trabalhadores/|data:image/gif;base64,R0lGODlhAQABAIAAAP///////yH5BAEKAAEALAAAAAABAAEAAAICTAEAOw==
Fiat e Jeep dominam vendas de carros 0 km em maio; Chevrolet Onix sai do top 10|CNN Brasil|03/06/2021||Petrobras conclui análise de indicados e trocas no Conselho devem ficar para o ... Petrobras conclui análise de indicados e trocas no Conselho devem ficar...|https://www.cnnbrasil.com.br/business/fiat-e-jeep-dominam-vendas-de-carros-0-km-em-maio-chevrolet-onix-sai-do-top-10/|data:image/gif;base64,R0lGODlhAQABAIAAAP///////yH5BAEKAAEALAAAAAABAAEAAAICTAEAOw==
Euforia na bolsa: mercado projeta Ibovespa aos 145 mil pontos em 2021|Exame|03/06/2021||Em apenas dez dias no fim de fevereiro - quando o presidente Jair Bolsonaro anunciou a mudança no comando da Petrobras (PETR3/PETR4), assustando os...|https://exame.com/invest/mercados/euforia-na-bolsa-mercado-projeta-ibovespa-aos-145-mil-pontos-em-2021/|data:image/gif;base64,R0lGODlhAQABAIAAAP///////yH5BAEKAAEALAAAAAABAAEAAAICTAEAOw==
Justiça do Rio arquiva processo contra Felipe Neto por corrupção de menores|CBN|03/06/2021||Comentaristas. No caso da Petrobras, 'Bolsonaro e o centrão foram derrotados' ... No caso da Petrobras, 'Bolsonaro e o centrão foram derrotados'.|https://cbn.globoradio.globo.com/media/audio/342691/justica-do-rio-arquiva-processo-contra-felipe-neto.htm|data:image/gif;base64,R0lGODlhAQABAIAAAP///////yH5BAEKAAEALAAAAAABAAEAAAICTAEAOw==
Vídeo: Navio repleto de produtos químicos naufraga no Sri Lanka e deixa 5.600 barcos pesqueiros sem trabalhar|Click Petróleo e Gás|03/06/2021||Ocyan assina contrato com empresa norueguesa de serviços offshore para descomissionamento dos sistemas submarinos de plataformas de produção da Petrobras...|https://clickpetroleoegas.com.br/navio-repleto-de-produtos-quimicos-naufraga-no-sri-lanka-e-deixa-5-600-barcos-pesqueiros-sem-trabalhar/|data:image/gif;base64,R0lGODlhAQABAIAAAP///////yH5BAEKAAEALAAAAAABAAEAAAICTAEAOw==
Raízen protocola pedido para IPO, que pode ser um dos maiores da história|Exame|03/06/2021||Veja Também · Ibovespa cai para mínima do ano com surpresa negativa da inflação nos EUA · Títulos da Petrobras parecem caros com queda de prêmio de risco · Ambev (...|https://exame.com/invest/mercados/ipo-da-raizen-companhia-protocola-pedido-de-registro-para-oferta/|data:image/gif;base64,R0lGODlhAQABAIAAAP///////yH5BAEKAAEALAAAAAABAAEAAAICTAEAOw==
Petrobras anuncia parada programada de plataforma de Mexilhão e gasoduto Rota 1|Money Times|04/06/2021||“Como medida adicional, a Petrobras irá conciliar a manutenção da plataforma de Mexilhão e do gasoduto Rota 1 às paradas programadas de usinas termelétricas...|https://www.moneytimes.com.br/petrobras-anuncia-parada-programada-de-plataforma-de-mexilhao-e-gasoduto-rota-1/|data:image/gif;base64,R0lGODlhAQABAIAAAP///////yH5BAEKAAEALAAAAAABAAEAAAICTAEAOw==
Fitch Ratings Assigns Petrobras' Proposed Issuance 'BB-'|Fitch Ratings|04/06/2021||Fitch Ratings Atribui Rating 'BB–' à Proposta de Emissão da Petrobras. Brazil Fri 04 Jun, 2021 - 9:04 AM ET.|https://www.fitchratings.com/research/pt/corporate-finance/fitch-ratings-assigns-petrobras-proposed-issuance-bb-04-06-2021|data:image/gif;base64,R0lGODlhAQABAIAAAP///////yH5BAEKAAEALAAAAAABAAEAAAICTAEAOw==
Petrobras, Marfrig, BRF, Rede D’Or, PagSeguro e mais: veja destaques de empresas|Valor Investe|04/06/2021||Petrobras, Marfrig, BRF, Rede D'Or, PagSeguro e mais: veja destaques de empresas. A JBS USA e a Pilgrim's anunciaram que todas as suas instalações estão...|https://valorinveste.globo.com/mercados/renda-variavel/empresas/noticia/2021/06/04/petrobras-marfrig-brf-rede-dor-pagseguro-e-mais-veja-destaques-de-empresas.ghtml|data:image/gif;base64,R0lGODlhAQABAIAAAP///////yH5BAEKAAEALAAAAAABAAEAAAICTAEAOw==
Acidente com helicóptero AW139 em plataforma marítima da Petrobras|Cavok|04/06/2021||Já a Petrobras, responsável pela unidade marítima, informou que a sonda não estava em operação e não houve impacto ao meio ambiente.|https://www.cavok.com.br/acidente-com-helicoptero-aw139-em-plataforma-maritima-da-petrobras|data:image/gif;base64,R0lGODlhAQABAIAAAP///////yH5BAEKAAEALAAAAAABAAEAAAICTAEAOw==
As ações favoritas para o mês de junho, segundo 16 corretoras|Seu Dinheiro|04/06/2021||Esse é o caso da mais recente candidata à fênix brasileira, a Petrobras. A empresa até começou o ano bem e, inclusive, liderou nossa seleção de ações...|https://www.seudinheiro.com/2021/bolsa-dolar/acao-do-mes-junho-2021/|data:image/gif;base64,R0lGODlhAQABAIAAAP///////yH5BAEKAAEALAAAAAABAAEAAAICTAEAOw==
Gás de cozinha tem forte alta e complica orçamento de famílias|Correio Braziliense|04/06/2021||"Questionada, a Petrobras, por meio de sua assessoria de imprensa, respondeu que não há previsão de reajustes de preços de GLP com frequência mínima mensal: ""..."|https://www.correiobraziliense.com.br/economia/2021/06/4929003-gas-de-cozinha-tem-forte-alta-e-complica-orcamento-de-familias.html|data:image/gif;base64,R0lGODlhAQABAIAAAP///////yH5BAEKAAEALAAAAAABAAEAAAICTAEAOw==
Gincana do Caminhoneiro realiza final nos dias 10 e 11, na ...|Estradas|04/06/2021||... da Petrobras, com foco nos caminhoneiros. Ainda de acordo com os organizadores, mais de 10 mil caminhoneiros participaram das ações do evento.|https://estradas.com.br/gincana-do-caminhoneiro-realiza-final-nos-dias-10-e-11-na-dutra-em-roseira-sp/|data:image/gif;base64,R0lGODlhAQABAIAAAP///////yH5BAEKAAEALAAAAAABAAEAAAICTAEAOw==
Ibovespa bate novo recorde e supera marca de 130 mil pontos|Valor Econômico|04/06/2021||Com ajuda de pesos pesados na bolsa, como Petrobras e bancos, foi o sétimo avanço consecutivo do índice e o quinto recorde de fechamento.|https://valor.globo.com/financas/noticia/2021/06/04/ibovespa-fecha-em-alta-de-040percent-aos-130126-pontos.ghtml|data:image/gif;base64,R0lGODlhAQABAIAAAP///////yH5BAEKAAEALAAAAAABAAEAAAICTAEAOw==
Em Cubatão, ato simbólico marcará entrega de cartões do 'Projeto Ação Cesta Básica'|Diário do Litoral|04/06/2021||"A cerimônia terá a presença do prefeito municipal, Ademario Silva e da presidente da entidade, Sônia Onuki. ""Agradecemos a Petrobras por mais esta parceria com..."|https://www.diariodolitoral.com.br/cubatao/em-cubatao-ato-simbolico-marcara-entrega-de-cartoes-do-projeto-acao/146207/|data:image/gif;base64,R0lGODlhAQABAIAAAP///////yH5BAEKAAEALAAAAAABAAEAAAICTAEAOw==
BRF (BRFS3) investirá R$ 233 milhões em suas fábricas em Goiás|Suno|04/06/2021||Radar: Petrobras (PETR4) lidera ranking de dividendos, ação da Eletrobras (ELET3) vira “top pick” para o BTG e papéis da Gol (GOLL4) desabam.|https://www.suno.com.br/noticias/brf-brfs3-investira-233-mi-fabricas-goias/|data:image/gif;base64,R0lGODlhAQABAIAAAP///////yH5BAEKAAEALAAAAAABAAEAAAICTAEAOw==
Solidariedade a Alessandro Trindade, diretor do Sindeptro-NF|Partido dos Trabalhadores|05/06/2021||O Partido dos Trabalhadores solidariza-se com o companheiro Alessandro Trindade, demitido pela direção da Petrobras por arrecadar e distribuir alimentos...|https://pt.org.br/solidariedade-a-alessandro-trindade-diretor-do-sindeptro-nf/|data:image/gif;base64,R0lGODlhAQABAIAAAP///////yH5BAEKAAEALAAAAAABAAEAAAICTAEAOw==
Demitidos pela Lava Jato vivem de bicos e Uber à espera de ...|Brasil de Fato|05/06/2021||“Hoje, a Petrobras está mandando para fora as plataformas P78 e a P79.” O que mais dói. Almir Marvila tem 58 anos, entrou no setor naval em 1985 e compartilha...|https://www.brasildefato.com.br/2021/06/05/demitidos-pela-lava-jato-fazem-bicos-e-uber-a-espera-de-investimentonosetornaval|data:image/gif;base64,R0lGODlhAQABAIAAAP///////yH5BAEKAAEALAAAAAABAAEAAAICTAEAOw==
Cartão de crédito Banco do Brasil: conheça 5 opções SEM ...|Seu Crédito Digital|05/06/2021||Cashback: com suas compras você acumula pontos que podem virar desconto na fatura. Consumindo no seu posto premmiado e pagando com o Cartão Petrobras, você...|https://seucreditodigital.com.br/cartao-de-credito-banco-brasil-sem-anuidade/|data:image/gif;base64,R0lGODlhAQABAIAAAP///////yH5BAEKAAEALAAAAAABAAEAAAICTAEAOw==
5 fatores que explicam como o Ibovespa chegou aos 130 mil pontos|Exame|05/06/2021||As receitas líquidas somadas de um grupo com 268 empresas de capital aberto -- excluídas Vale (VALE3), Petrobras (PETR3, PETR4) e Suzano (SUZB3) para não...|https://exame.com/invest/mercados/5-fatores-que-explicam-como-o-ibovespa-chegou-aos-130-mil-pontos/|data:image/gif;base64,R0lGODlhAQABAIAAAP///////yH5BAEKAAEALAAAAAABAAEAAAICTAEAOw==
Maior distribuidora do Amazonas, Atem avança rumo ao sul do país|Blog O Globo|05/06/2021||... e mira a aquisição da Reman, a refinaria da Petrobras em Manaus. ... Rodrigues e Ramos se reúnem com representantes da Petrobras e da Receita Federal em...|https://blogs.oglobo.globo.com/capital/post/maior-distribuidora-do-amazonas-atem-avanca-rumo-ao-sul-do-pais.html|data:image/gif;base64,R0lGODlhAQABAIAAAP///////yH5BAEKAAEALAAAAAABAAEAAAICTAEAOw==
Sem medo do tradicional, Tarpon Capital usa o value investing e aposta em agro e saúde|Suno|05/06/2021||O Ibovespa ainda é muito mal representado, concentrado em Vale (VALE3), Petrobras (PETR4) e bancos. No caso da Vale, por exemplo, ela depende muito mais da...|https://www.suno.com.br/noticias/tarpon-capital-agronegocio-saude-bolsa-ipos/|data:image/gif;base64,R0lGODlhAQABAIAAAP///////yH5BAEKAAEALAAAAAABAAEAAAICTAEAOw==
Pezão é condenado por Bretas a 98 anos de prisão na Operação Boca de Lobo|Correio Braziliense|05/06/2021||Digite seu endereço de e-mail para acompanhar as notícias diárias do Correio Braziliense. MAIS LIDAS. Após anúncio de aumento, Petrobras é pressionada pelo...|https://www.correiobraziliense.com.br/politica/2021/06/4929156-pezao-e-condenado-por-bretas-a-98-anos-de-prisao-na-operacao-boca-de-lobo.html|data:image/gif;base64,R0lGODlhAQABAIAAAP///////yH5BAEKAAEALAAAAAABAAEAAAICTAEAOw==
Dia do Engenheiro Mecânico: conheça os melhores concursos da área|Estratégia Concursos|05/06/2021||Aprovado em 18º lugar na Petrobras para Engenharia de Petróleo. ENTREVISTA: Italo Pereira – Aprovado em 18º lugar na Petrobras para Engenharia de Petróleo.|https://www.estrategiaconcursos.com.br/blog/dia-do-engenheiro-mecanico-conheca-os-melhores-concursos-da-area/|data:image/gif;base64,R0lGODlhAQABAIAAAP///////yH5BAEKAAEALAAAAAABAAEAAAICTAEAOw==
Bolsonaro extingue a Ceitec, estatal brasileira referência na ...|Brasil de Fato|05/06/2021||Após impeachment, parcela da Petrobras na economia brasileira cai 34%. Outras notícias. Auxílio Brasil: empréstimo consignado representa financeirização de...|https://www.brasildefato.com.br/2021/06/05/bolsonaro-extingue-a-ceitec-estatal-brasileira-referencia-na-fabricacao-de-chips|data:image/gif;base64,R0lGODlhAQABAIAAAP///////yH5BAEKAAEALAAAAAABAAEAAAICTAEAOw==
Amparo, no interior de SP, faz lockdown aos finais de semana para conter covid-19|Money Times|05/06/2021||Entenda · Copel (CPLE6), Petrobras (PETR4) e mais 9 ações com dividendos de até 65%; veja o ranking do 1º semestre · B3 (B3SA3) está com desconto de 30%;...|https://www.moneytimes.com.br/amparo-no-interior-de-sp-faz-lockdown-aos-finais-de-semana-para-conter-covid-19/|data:image/gif;base64,R0lGODlhAQABAIAAAP///////yH5BAEKAAEALAAAAAABAAEAAAICTAEAOw==
Petrobras sinaliza cobrança a ex-vereador delator da Lava ...|O Liberal|06/06/2021||A Petrobras sinalizou, na Justiça, que deverá cobrar o ex-vereador de Americana Alexandre Correa de Oliveira Romano por prejuízos com a corrupção na estatal...|https://liberal.com.br/cidades/americana/petrobras-sinaliza-cobranca-a-ex-vereador-delator-da-lava-jato-1532622/|data:image/gif;base64,R0lGODlhAQABAIAAAP///////yH5BAEKAAEALAAAAAABAAEAAAICTAEAOw==
9 momentos que marcam a saga da 'CPIs' no Brasil|Aventuras na História|06/06/2021||Sala de comissões do Senado Federal durante reunião da CPI Mista da Petrobras - Senado Federal/Wikimedia Commons ... 2009 e 2015: Petrobrás.|https://aventurasnahistoria.uol.com.br/noticias/reportagem/9-momentos-que-marcam-saga-da-cpis-no-brasil.phtml|data:image/gif;base64,R0lGODlhAQABAIAAAP///////yH5BAEKAAEALAAAAAABAAEAAAICTAEAOw==
Marco Legal das Startups é avanço, mas faltou ambição; veja as vitórias e derrotas do setor|Suno|06/06/2021||Petrobras (PETR4) vai contratar soluções de startups; veja como participar ... Petrobras (PETR4) paga R$ 6,6 por ação e lidera ranking de dividendos em 2022...|https://www.suno.com.br/noticias/marco-legal-das-startups-avanco-falta-ambicao/|data:image/gif;base64,R0lGODlhAQABAIAAAP///////yH5BAEKAAEALAAAAAABAAEAAAICTAEAOw==
Polícia encontra corpo que pode ser de PM desaparecido em Heliópolis|Jornal da Record|06/06/2021||A polícia encontrou neste sábado (5), durante as buscas pelo policial militar Leandro Patrocínio no terreno da Petrobras, em Heliópolis, zona sul de São...|https://noticias.r7.com/sao-paulo/policia-encontra-corpo-que-pode-ser-de-pm-desaparecido-em-heliopolis-06062021|data:image/gif;base64,R0lGODlhAQABAIAAAP///////yH5BAEKAAEALAAAAAABAAEAAAICTAEAOw==
Need For Speed Hot Pursuit Remastered chegará ao Xbox ...|TudoCelular.com|06/06/2021||Petrobras inicia a montagem do supercomputador Pégaso em Várzea Grande, no Rio de Janeiro 1. Economia e mercado 6 horas atrás A previsão é de que o...|https://www.tudocelular.com/tech/noticias/n175447/need-for-speed-hot-pursuit-remastered-game-pass.html|data:image/gif;base64,R0lGODlhAQABAIAAAP///////yH5BAEKAAEALAAAAAABAAEAAAICTAEAOw==
Magalu e Via Varejo: confira essa batalha de gigantes|EuQueroInvestir|06/06/2021||Radar traz Petrobras (PETR3; PETR4), Eletrobras (ELET3; ELET6) e Eternit (ETER3) · Futuros de NY operam sem direção definida com Fed e China no radar do...|https://euqueroinvestir.com/batalha-de-gigantes-no-varejo-magalu-e-via-varejo-disputam-e-commerce|data:image/gif;base64,R0lGODlhAQABAIAAAP///////yH5BAEKAAEALAAAAAABAAEAAAICTAEAOw==
Alicia Silverstone reproduz cena icônica de 'As Patricinhas de Beverly Hills'|Notícias ao Minuto Brasil|06/06/2021||'Se precisar trocar cinco vezes presidente da Petrobras, eu troco', diz Bolsonaro. PEC 'Kamikaze': Câmara analisa destaque para tornar permanente Auxílio de...|https://www.noticiasaominuto.com.br/celebridades/1811054/alicia-silverstone-reproduz-cena-iconica-de-as-patricinhas-de-beverly-hills|data:image/gif;base64,R0lGODlhAQABAIAAAP///////yH5BAEKAAEALAAAAAABAAEAAAICTAEAOw==
