title|media|date|datetime|desc|link|img
Petrobras conclui venda de fatia no campo de Lapa para TotalEnergies|Forbes Brasil|01/09/2021||A Petrobras informou hoje (1°) que finalizou a cessão de sua participação de 10% no campo de Lapa para a TotalEnergies. A operação foi concluída com o...|https://forbes.com.br/forbes-money/2021/09/petrobras-conclui-venda-de-fatia-no-campo-de-lapa-para-totalenergies/|data:image/gif;base64,R0lGODlhAQABAIAAAP///////yH5BAEKAAEALAAAAAABAAEAAAICTAEAOw==
Presidente da Petrobras coloca militares na cúpula da estatal|UOL Economia|01/09/2021||Segundo apurou o Estadão, Silva e Luna já contratou pelo menos seis militares para atuar em postos de apoio à presidência da Petrobras e da Transpetro,...|https://economia.uol.com.br/noticias/estadao-conteudo/2021/09/01/silva-e-luna-militariza-cupula-da-petrobras.htm|data:image/gif;base64,R0lGODlhAQABAIAAAP///////yH5BAEKAAEALAAAAAABAAEAAAICTAEAOw==
Mubadala cria empresa para operar refinaria comprada da Petrobras na Bahia|Valor Econômico|01/09/2021||Mubadala cria empresa para operar refinaria comprada da Petrobras na Bahia. A Acelen vai fazer a gestão e a operação da refinaria de petróleo Landulpho Alves (...|https://valor.globo.com/empresas/noticia/2021/09/01/mubadala-cria-empresa-para-operar-refinaria-comprada-da-petrobras-na-bahia.ghtml|data:image/gif;base64,R0lGODlhAQABAIAAAP///////yH5BAEKAAEALAAAAAABAAEAAAICTAEAOw==
Observatório Social da Petrobras e FNP vão vender gás de cozinha a R$ 60 em SP, PA e RJ|CPG Click Petroleo e Gas|01/09/2021||O Observatório Social da Petrobras (OSP) e a Federação Nacional dos Petroleiros (FNP) venderão os botijões de gás de cozinha a R$ 60, na quinta-feira (2),...|https://clickpetroleoegas.com.br/observatorio-social-da-petrobras-e-fnp-vao-vender-gas-de-cozinha-a-r-60-em-sp-pa-e-rj/|data:image/gif;base64,R0lGODlhAQABAIAAAP///////yH5BAEKAAEALAAAAAABAAEAAAICTAEAOw==
Distribuidoras elevam preço do botijão de gás em 7% para o consumidor|Exame|01/09/2021||Rumores no setor indicam que a Petrobras também deverá reajustar o preço do combustível, que já acumula 38% de alta no ano. A política vai seguir dando o tom na...|https://exame.com/economia/distribuidoras-elevam-preco-do-botijao-de-gas-em-7-para-o-consumidor/|data:image/gif;base64,R0lGODlhAQABAIAAAP///////yH5BAEKAAEALAAAAAABAAEAAAICTAEAOw==
Economistas dizem que causa da alta da gasolina não é a política de preços da Petrobras|G1|01/09/2021||Em fevereiro, o presidente Bolsonaro anunciou a demissão de Roberto Castello Branco do comando da Petrobras. O presidente se mostrava irritado com Castello...|https://g1.globo.com/jornal-nacional/noticia/2021/09/01/economistas-dizem-que-causa-da-alta-da-gasolina-nao-e-a-politica-de-precos-da-petrobras.ghtml|data:image/gif;base64,R0lGODlhAQABAIAAAP///////yH5BAEKAAEALAAAAAABAAEAAAICTAEAOw==
TIM e Petrobras projetam uso de constelação LEO após testes com Telesat|Teletime|01/09/2021||A TIM e a Petrobras estão planejando o uso de conectividade fornecida por satélites de baixa órbita (LEO) após testes bem sucedidos ao lado da operadora...|https://teletime.com.br/01/09/2021/tim-e-petrobras-projetam-uso-de-constelacao-leo-apos-testes-com-telesat/|data:image/gif;base64,R0lGODlhAQABAIAAAP///////yH5BAEKAAEALAAAAAABAAEAAAICTAEAOw==
OceanPact firma contratos de serviços de embarcações com Petrobras|Valor Econômico|01/09/2021||A OceanPact comunicou ao mercado que formalizou quatro contratos de prestação de serviços com a Petrobras, sendo dois para afretamento de embarcações do...|https://valor.globo.com/empresas/noticia/2021/09/01/oceanpact-firma-contratos-de-servios-de-embarcaes-com-petrobras.ghtml|data:image/gif;base64,R0lGODlhAQABAIAAAP///////yH5BAEKAAEALAAAAAABAAEAAAICTAEAOw==
Combustíveis: fracasso em venda de refinaria acende sinal amarelo na Petrobras|Money Times|01/09/2021||A Petrobras (PETR4) fracassou na última semana ao tentar vender a refinaria Abreu e Lima, comentaram o Itaú BBA, Ágora Investimentos e BTG Pactual em...|https://www.moneytimes.com.br/combustiveis-fracasso-em-venda-de-refinaria-acende-sinal-amarelo-na-petrobras/|data:image/gif;base64,R0lGODlhAQABAIAAAP///////yH5BAEKAAEALAAAAAABAAEAAAICTAEAOw==
Vibra quer migrar funcionários para novo plano de aposentadoria em 2022|Valor Econômico|01/09/2021||Posto de Gasolina Posto BR — Foto: Divulgação/Petrobras 1 de 1 Posto de Gasolina Posto BR — Foto: Divulgação/Petrobras. Posto de Gasolina Posto BR — Foto:...|https://valor.globo.com/empresas/noticia/2021/09/01/vibra-quer-migrar-funcionarios-para-novo-plano-de-aposentadoria-em-2022.ghtml|data:image/gif;base64,R0lGODlhAQABAIAAAP///////yH5BAEKAAEALAAAAAABAAEAAAICTAEAOw==
Petrobras pode perder R$ 13 bi com decisão do Senado ...|CNN Brasil|02/09/2021||Petrobras pode perder R$ 13 bi com decisão do Senado sobre planos de saúde. Na negociação do acordo coletivo 2020-2022, a proporção do custeio do plano de saúde...|https://www.cnnbrasil.com.br/business/petrobras-pode-perder-r-13-bi-com-decisao-do-senado-sobre-planos-de-saude/|data:image/gif;base64,R0lGODlhAQABAIAAAP///////yH5BAEKAAEALAAAAAABAAEAAAICTAEAOw==
Pré-sal: começa produção de volumes excedentes no Campo de Búzios|Agência Brasil|02/09/2021||A operadora do Contrato de Partilha de Produção de Búzios é a Petrobras, com participação de 90%, tendo como parceiros as empresas CNODC Brasil Petróleo e...|https://agenciabrasil.ebc.com.br/economia/noticia/2021-09/pre-sal-comeca-producao-de-volumes-excedentes-no-campo-de-buzios|data:image/gif;base64,R0lGODlhAQABAIAAAP///////yH5BAEKAAEALAAAAAABAAEAAAICTAEAOw==
Coparticipação de plano de saúde da Petrobras será mantida em 40%|Valor Investe|02/09/2021||A Petrobras comunicou ao mercado há pouco que será mantida a coparticipação de 40% dos beneficiários de seus planos de saúde durante a vigência do atual...|https://valorinveste.globo.com/mercados/renda-variavel/empresas/noticia/2021/09/02/coparticipacao-de-plano-de-saude-da-petrobras-sera-mantida-em-40percent.ghtml|data:image/gif;base64,R0lGODlhAQABAIAAAP///////yH5BAEKAAEALAAAAAABAAEAAAICTAEAOw==
Ação subsidia a venda de botijão de gás a R$ 60, em Belém ...|Brasil de Fato|02/09/2021||Nesta quinta-feira (2), o Observatório Social da Petrobrás (OSP) e a Federação ... a política de preços imposta pelo governo Bolsonaro para a Petrobras é...|https://www.brasildefato.com.br/2021/09/02/acao-subsidia-a-venda-de-botijao-de-gas-a-r-60-em-belem-capital-do-para|data:image/gif;base64,R0lGODlhAQABAIAAAP///////yH5BAEKAAEALAAAAAABAAEAAAICTAEAOw==
'Skandi Achiever' da DOF permanecerá com a Petrobras até o ...|Portos e Navios|02/09/2021||A operadora de navios offshore norueguesa DOF Subsea obteve novo contrato com a Petrobras. Após o recente acordo de três anos garantido para uma dupla de...|https://www.portosenavios.com.br/noticias/offshore/skandi-achiever-da-dof-permanecera-com-a-petrobras-ate-o-4t-2022|data:image/gif;base64,R0lGODlhAQABAIAAAP///////yH5BAEKAAEALAAAAAABAAEAAAICTAEAOw==
Petrobras retomará trabalho presencial no Centro do Rio a partir de outubro|Diário do Rio|02/09/2021||Um dos principais empreendimentos comerciais da região central do Rio de Janeiro, o edifício-sede da Petrobras, localizado no número 65 da Avenida República...|https://diariodorio.com/petrobras-retomara-trabalho-presencial-no-centro-do-rio-a-partir-de-outubro/|data:image/gif;base64,R0lGODlhAQABAIAAAP///////yH5BAEKAAEALAAAAAABAAEAAAICTAEAOw==
OceanPact fecha quatro contratos para serviços de ...|TradeMap|02/09/2021||A OceanPact (OPCT3) comunicou ao mercado na última quarta-feira, 01, que fechou quatro contratos com a Petrobras, sendo dois para afretamento de embarcações...|https://trademap.com.br/agencia/mercados/blog-oceanpact-fecha-quatro-contratos-para-servicos-de-embarcacoes-com-a-petrobras|data:image/gif;base64,R0lGODlhAQABAIAAAP///////yH5BAEKAAEALAAAAAABAAEAAAICTAEAOw==
"Felipe Neto: ""colunista do InfoMoney patrocina post com ..."|Revista Forum|02/09/2021||... fundador do Spotniks patrocinou, a partir do dia 30 de agosto, tem o título: “Quanto custaria reverter a privatização da Petrobras como quer Ciro Gomes”.|https://revistaforum.com.br/redes-sociais/2021/9/2/felipe-neto-colunista-do-infomoney-patrocina-post-com-ataques-ciro-gomes-102816.html|data:image/gif;base64,R0lGODlhAQABAIAAAP///////yH5BAEKAAEALAAAAAABAAEAAAICTAEAOw==
Ibovespa começa na segunda-feira com 7 novas ações ...|Money Times|02/09/2021||De acordo com a B3, os cinco ativos que apresentaram o maior peso na composição desta última prévia: Vale, Itaú Unibanco, Petrobras, Bradesco e Petrobras ON...|https://www.moneytimes.com.br/ibovespa-comeca-na-segunda-feira-com-7-novas-acoes-mostra-3a-previa/|data:image/gif;base64,R0lGODlhAQABAIAAAP///////yH5BAEKAAEALAAAAAABAAEAAAICTAEAOw==
Preço do gás de cozinha sofre o sétimo reajuste do ano|ACidadeON|02/09/2021||Desta vez, o reajuste não será da Petrobras, mas das empresas distribuidoras do produto. Segundo dados da Agência Nacional de Petróleo (ANP), o botijão de 13...|https://www.acidadeon.com/araraquara/economia/NOT,0,0,1661111,preco-do-gas-de-cozinha-sofre-o-setimo-reajuste-do-ano.aspx|data:image/gif;base64,R0lGODlhAQABAIAAAP///////yH5BAEKAAEALAAAAAABAAEAAAICTAEAOw==
Petrobras quer esclarecer, de uma vez por todas, o preço dos combustíveis|Money Times|03/09/2021||A Petrobras (PETR4) vai iniciar nesta sexta-feira uma campanha de esclarecimento sobre o preço da gasolina, que em alguns postos do país já chega perto de 7...|https://www.moneytimes.com.br/petrobras-quer-esclarecer-de-uma-vez-por-todas-o-preco-dos-combustiveis/|data:image/gif;base64,R0lGODlhAQABAIAAAP///////yH5BAEKAAEALAAAAAABAAEAAAICTAEAOw==
Nove empresas disputam a 17ª Rodada de Licitações da ANP em outubro|Agência Brasil|03/09/2021||Além da 3R Petroleum Óleo e Gás S.A., as áreas ofertadas serão disputadas pela Petrobras e pelas empresas Chevron Brasil Óleo e Gás Ltda., Shell Brasil...|https://agenciabrasil.ebc.com.br/economia/noticia/2021-09/nove-empresas-disputam-17a-rodada-de-licitacoes-da-anp-em-outubro|data:image/gif;base64,R0lGODlhAQABAIAAAP///////yH5BAEKAAEALAAAAAABAAEAAAICTAEAOw==
Posto da Petrobras no Paraguai não vende gasolina a R$ 2 ...|Aos Fatos|03/09/2021||É de 2018, não atual, um vídeo gravado em um posto da Petrobras que vendia o litro de gasolina a R$ 2,62 no Paraguai, diferentemente do que afirmam...|https://www.aosfatos.org/noticias/posto-da-petrobras-no-paraguai-nao-vende-gasolina-a-r-262-video-e-de-2018/|data:image/gif;base64,R0lGODlhAQABAIAAAP///////yH5BAEKAAEALAAAAAABAAEAAAICTAEAOw==
Petrobras fecha contrato com a TechnipFMC e Dof Subsea, para fretamento e serviços de longo prazo por navios de apoio|Click Petróleo e Gás|03/09/2021||A Petrobras contratou os navios Skandi Vitória e Skandi Niterói. O início das operações das embarcações está previsto para fevereiro de 2022.|https://clickpetroleoegas.com.br/petrobras-fecha-contrato-com-a-technipfmc-e-dof-subsea-para-fretamento-e-servicos-de-longo-prazo-por-navios-de-apoio/|data:image/gif;base64,R0lGODlhAQABAIAAAP///////yH5BAEKAAEALAAAAAABAAEAAAICTAEAOw==
O salto na competição do downstream brasileiro|EPBR|03/09/2021||Quando a Petrobras foi criada em 1953, o segmento de downstream tinha quatro décadas de desenvolvimento no país, contava com 6 refinadores privados,...|https://epbr.com.br/o-salto-na-competicao-do-downstream-brasileiro/|data:image/gif;base64,R0lGODlhAQABAIAAAP///////yH5BAEKAAEALAAAAAABAAEAAAICTAEAOw==
Petroleiros fazem ação no RJ de venda de botijão de gás de ...|Brasil de Fato|03/09/2021||Para o coordenador geral da FUP, Deyvid Bacelar, os reajustes que a Petrobrás vem aplicando não apenas no gás de cozinha, mas também no óleo diesel e na...|https://www.brasildefato.com.br/2021/09/03/petroleiros-fazem-acao-no-rj-de-venda-de-botijao-de-gas-de-cozinha-a-preco-justo|data:image/gif;base64,R0lGODlhAQABAIAAAP///////yH5BAEKAAEALAAAAAABAAEAAAICTAEAOw==
Entenda como é composto o preço dos combustíveis e o impacto do ICMS nesse custo|CNN Brasil|03/09/2021||Além do valor da Petrobras e do ICMS, ainda há outros custos como o etanol, que é adicionado à gasolina, com o equivalente a 16,3% do preço, a distribuição e...|https://www.cnnbrasil.com.br/business/entenda-como-e-composto-o-preco-dos-combustiveis-e-o-impacto-do-icms-nesse-custo/|data:image/gif;base64,R0lGODlhAQABAIAAAP///////yH5BAEKAAEALAAAAAABAAEAAAICTAEAOw==
SulAmérica e Hapvida disputam HB Saúde|ISTOÉ DINHEIRO|03/09/2021||A Petrobras estuda trocar uma parte ou a totalidade de sua participação na ... entre os desinvestimentos na Braskem por parte da Petrobras e da Novonor...|https://www.istoedinheiro.com.br/sulamerica-e-hapvida-disputam-hb-saude/|data:image/gif;base64,R0lGODlhAQABAIAAAP///////yH5BAEKAAEALAAAAAABAAEAAAICTAEAOw==
Briga de cachorros grandes dos combustíveis pela MP da bandeira já começou|VEJA|03/09/2021||A BR, que agora não é mais da Petrobras e passou a se chamar Vibra Energia, reagiu e entrou com um processo na Justiça do Rio para tentar impedir que a Fit...|https://veja.abril.com.br/coluna/radar-economico/briga-de-cachorros-grandes-dos-combustiveis-pela-mp-da-bandeira-ja-comecou/|data:image/gif;base64,R0lGODlhAQABAIAAAP///////yH5BAEKAAEALAAAAAABAAEAAAICTAEAOw==
Estado não interfere no preço da gasolina, diz secretário da Fazenda de Pernambuco|Folha PE|03/09/2021||Décio garante que a posição em Pernambuco é de que os aumentos só acontecem por conta dos repasses da Petrobras. “A posição do Estado é que não queremos...|https://www.folhape.com.br/economia/estado-nao-interfere-no-preco-da-gasolina/196296/|data:image/gif;base64,R0lGODlhAQABAIAAAP///////yH5BAEKAAEALAAAAAABAAEAAAICTAEAOw==
Petrobras inicia campanha para detalhar custos dos combustíveis|Jornal da Record|04/09/2021||Petrobras destaca peso do ICMS no custo da gasolina. Divulgação/Petrobras. A Petrobras iniciou nesta sexta-feira (4) uma campanha de esclarecimento sobre o...|https://noticias.r7.com/economia/petrobras-inicia-campanha-para-detalhar-custos-dos-combustiveis-04092021|data:image/gif;base64,R0lGODlhAQABAIAAAP///////yH5BAEKAAEALAAAAAABAAEAAAICTAEAOw==
5 anos do golpe: entenda o crime contra a Petrobras e a educação|Partido dos Trabalhadores|04/09/2021||Nos governos Lula e Dilma, a Petrobras não era vista apenas como uma simples empresa, mas como peça central do desenvolvimento do país. Com investimentos...|https://pt.org.br/5-anos-do-golpe-entenda-o-crime-contra-a-petrobras-e-a-educacao/|data:image/gif;base64,R0lGODlhAQABAIAAAP///////yH5BAEKAAEALAAAAAABAAEAAAICTAEAOw==
Militares que comandam estatais acumulam salários e ganham entre R$ 43 mil e R$ 260 mil|Folha|04/09/2021||Já na Petrobras, conforme o formulário de referência divulgado pela estatal aos investidores, a remuneração média mensal chega a R$ 228,2 mil, levando em conta...|https://www1.folha.uol.com.br/mercado/2021/09/militares-que-comandam-estatais-acumulam-salarios-e-ganham-entre-r-43-mil-e-r-260-mil.shtml|data:image/gif;base64,R0lGODlhAQABAIAAAP///////yH5BAEKAAEALAAAAAABAAEAAAICTAEAOw==
Abastecer está caro? Esses aplicativos ajudam a economizar com combustível|Quatro Rodas|04/09/2021||O Premmia é o programa de fidelidade da rede BR Petrobrás e funciona no mesmo esquema de um para um do Abastece Aí. Inclusive, também existe a possibilidade...|https://quatrorodas.abril.com.br/noticias/abastecer-esta-caro-esses-aplicativos-ajudam-a-economizar-com-combustivel/|data:image/gif;base64,R0lGODlhAQABAIAAAP///////yH5BAEKAAEALAAAAAABAAEAAAICTAEAOw==
Méliuz (CASH3) aprova desdobramento de ações de 1 para 6|Suno|04/09/2021||Notícias Negócios Méliuz (CASH3) aprova desdobramento de ações de 1 para 6. DIVIDENDOS. Petrobras (PETR4) e Vivo (VIVT3) pagam proventos nesta semana;...|https://www.suno.com.br/noticias/meliuz-cash3-aprova-desdobramento-acoes/|data:image/gif;base64,R0lGODlhAQABAIAAAP///////yH5BAEKAAEALAAAAAABAAEAAAICTAEAOw==
Agricultura confirma 2 casos de vaca louca e suspende exportação para a China|CNN Brasil|04/09/2021||Petrobras tem preços 8% mais caros que internacionais. Rosa Weber autoriza oitiva de ex-presidentes da Petrobras e do Banco do Brasil...|https://www.cnnbrasil.com.br/business/agricultura-confirma-2-casos-de-vaca-louca-e-suspende-exportacao-para-a-china/|data:image/gif;base64,R0lGODlhAQABAIAAAP///////yH5BAEKAAEALAAAAAABAAEAAAICTAEAOw==
"Presidente da Petrobras faz coro a Bolsonaro e vê ""excesso ..."|ISTOÉ DINHEIRO|05/09/2021||SÃO PAULO (Reuters) – O presidente da Petrobras, Joaquim Silva e Luna, afirmou, em artigo no jornal O Estado de São Paulo neste domingo, que há excesso de...|https://www.istoedinheiro.com.br/presidente-da-petrobras-faz/|data:image/gif;base64,R0lGODlhAQABAIAAAP///////yH5BAEKAAEALAAAAAABAAEAAAICTAEAOw==
Militares em comando de estatais acumulam salários e chegam a receber R$ 260 mil|iG Economia|05/09/2021||As remunerações mais altas são do presidente da Petrobras, o general de Exército Joaquim Silva e Luna, que chegou a uma média mensal de 228,2 mil,...|https://economia.ig.com.br/2021-09-05/militares-comandam-estatais-acumulam-salarios-ganham-entre-r--43-mil-r--260-mil.html|data:image/gif;base64,R0lGODlhAQABAIAAAP///////yH5BAEKAAEALAAAAAABAAEAAAICTAEAOw==
Incomodados com barulho de helicópteros e temendo acidentes, vizinhos do Aeroporto de Jacarepaguá pedem providências|O Globo|05/09/2021||Não respondeu, porém, sobre aumento no número de voos ou alterações de rotas. A Petrobras afirmou que o Aeroporto de Jacarepaguá reúne toda a infraestrutura...|https://oglobo.globo.com/rio/bairros/incomodados-com-barulho-de-helicopteros-temendo-acidentes-vizinhos-do-aeroporto-de-jacarepagua-pedem-providencias-1-25182722|data:image/gif;base64,R0lGODlhAQABAIAAAP///////yH5BAEKAAEALAAAAAABAAEAAAICTAEAOw==
Eneva dá início a novo ciclo de exploração de gás natural na Amazônia|Valor Econômico|05/09/2021||A Eneva também vive a expectativa de adquirir o Polo de óleo e gás de Urucu, operado pela Petrobras no Amazonas. Lino Cancado, diretor de operações da Eneva...|https://valor.globo.com/empresas/noticia/2021/09/05/eneva-da-inicio-a-novo-ciclo-de-exploracao-de-gas-natural-na-amazonia.ghtml|data:image/gif;base64,R0lGODlhAQABAIAAAP///////yH5BAEKAAEALAAAAAABAAEAAAICTAEAOw==
OAB reage à convocação de advogada de Bolsonaro pela CPI|Correio Braziliense|05/09/2021||Digite seu endereço de e-mail para acompanhar as notícias diárias do Correio Braziliense. MAIS LIDAS. Após anúncio de aumento, Petrobras é pressionada pelo...|https://www.correiobraziliense.com.br/politica/2021/09/4947846-oab-reage-a-convocacao-de-advogada-de-bolsonaro-pela-cpi.html|data:image/gif;base64,R0lGODlhAQABAIAAAP///////yH5BAEKAAEALAAAAAABAAEAAAICTAEAOw==
Carteira de dividendos x carteira de crescimento: qual vale ...|EuQueroInvestir|05/09/2021||Radar traz Petrobras (PETR3; PETR4), Eletrobras (ELET3; ELET6) e Eternit (ETER3) · Futuros de NY operam sem direção definida com Fed e China no radar do...|https://euqueroinvestir.com/carteira-de-dividendos-x-carteira-de-crescimento-qual-vale-mais-a-pena|data:image/gif;base64,R0lGODlhAQABAIAAAP///////yH5BAEKAAEALAAAAAABAAEAAAICTAEAOw==
Dasa (DASA3) adquire três hospitais do Grupo Leforte por R$ 1,77 bilhão|Suno|05/09/2021||Radar: Petrobras (PETR4) lidera ranking de dividendos, ação da Eletrobras (ELET3) vira “top pick” para o BTG e papéis da Gol (GOLL4) desabam.|https://www.suno.com.br/noticias/dasa-dasa3-adquire-tres-hospitais-do-grupo-leforte-por-r-177-bilhao/|data:image/gif;base64,R0lGODlhAQABAIAAAP///////yH5BAEKAAEALAAAAAABAAEAAAICTAEAOw==
Bolsonaro entra com ação contra o Congresso por ICMS único|Noticias R7|05/09/2021||"O governador disse, ainda, que o presidente Jair Bolsonaro tem mecanismos tanto em âmbito federal como da estatal Petrobras para estabelecer ""o entendimento..."|https://noticias.r7.com/brasilia/bolsonaro-entra-com-acao-contra-o-congresso-por-icms-unico-05092021|data:image/gif;base64,R0lGODlhAQABAIAAAP///////yH5BAEKAAEALAAAAAABAAEAAAICTAEAOw==
Valores da gasolina assustam! Quanto está custando, em ...|FDR|05/09/2021||Isso por conta da política de preços que vem sendo adotada pela Petrobras desde outubro de 2016, ainda durante o governo Temer, que era o presidente da...|https://fdr.com.br/2021/09/05/valores-da-gasolina-assustam-quanto-esta-custando-em-media-no-seu-estado/|data:image/gif;base64,R0lGODlhAQABAIAAAP///////yH5BAEKAAEALAAAAAABAAEAAAICTAEAOw==
Ações: Por Que Você Deve Trocar Petrobras (PETR4) por ...|Investing.com|06/09/2021||"Fonte: PetroRio e Petrobras. É importante notar que PetroRio cresce em ""pulos"" – quando compra um novo campo, sua produção (e seu Ebitda) dá um salto..."|https://br.investing.com/analysis/acoes-por-que-voce-deve-trocar-petrobras-petr4-por-petrorio-prio3-200444513|data:image/gif;base64,R0lGODlhAQABAIAAAP///////yH5BAEKAAEALAAAAAABAAEAAAICTAEAOw==
Ibovespa passa a operar com nova carteira nesta segunda-feira|Money Times|06/09/2021||Os cinco papéis que apresentaram o maior peso na composição do índice foram Vale (VALE3 – 14,477%), Itaú Unibanco (ITUB4 – 6,180%), Petrobras PN (PETR4...|https://www.moneytimes.com.br/ibovespa-passa-a-operar-com-nova-carteira-nesta-segunda-feira/|data:image/gif;base64,R0lGODlhAQABAIAAAP///////yH5BAEKAAEALAAAAAABAAEAAAICTAEAOw==
Maestro Isaac Karabtchevsky retorna a Sala Cecília Meirelles|Diário do Rio|06/09/2021||A Sala Cecília Meireles, apresenta nesta sexta-feira, 10/9, às 19h, dentro da série Orquestras, a Orquestra Petrobras Sinfônica, sob regência do maestro...|https://diariodorio.com/maestro-isaac-karabtchevsky-retorna-a-sala-cecilia-meirelles/|data:image/gif;base64,R0lGODlhAQABAIAAAP///////yH5BAEKAAEALAAAAAABAAEAAAICTAEAOw==
Entrega bilionária do campo de Albacora é mais um crime de lesa pátria, por Francismar Cunha|Brasil 247|06/09/2021||"""O fatiamento da Petrobras segue a ritmo acelerado desde o golpe de 2016. É neste contexto que Francismar Cunha Ferreira, mestre e doutorando em Geografia..."|https://www.brasil247.com/blog/entrega-bilionaria-do-campo-de-albacora-e-mais-um-crime-de-lesa-patria-por-francismar-cunha|data:image/gif;base64,R0lGODlhAQABAIAAAP///////yH5BAEKAAEALAAAAAABAAEAAAICTAEAOw==
Bagé tem gasolina mais cara do país; São Paulo, a mais barata|EPBR|06/09/2021||Do total, apenas R$ 2 ficam com a Petrobras, garantiu o presidente da ... de todo o valor pago na bomba; em agosto, era 27,5%, segundo dados da Petrobras.|https://epbr.com.br/bage-tem-gasolina-mais-cara-do-pais-sao-paulo-a-mais-barata/|data:image/gif;base64,R0lGODlhAQABAIAAAP///////yH5BAEKAAEALAAAAAABAAEAAAICTAEAOw==
Lula diz que papel do presidente é apresentar soluções e não ...|ISTOÉ DINHEIRO|06/09/2021||... que desse um alento aos trabalhadores, que viesse dizer que a Petrobras vai voltar a vender gasolina pelo custo real e não mais pelo preço em dólar… que...|https://www.istoedinheiro.com.br/lula-diz-que-papel/|data:image/gif;base64,R0lGODlhAQABAIAAAP///////yH5BAEKAAEALAAAAAABAAEAAAICTAEAOw==
Preço da gasolina em Curitiba é menor em relação a outras capitais|Gazeta do Povo|06/09/2021||Traduzindo a explicação, em nota, a Petrobras afirma que na quantia paga pelo litro da gasolina nos postos de abastecimento, em média, apenas R$ 2 são...|https://www.gazetadopovo.com.br/curitiba/preco-gasolina-curitiba-capitais/|data:image/gif;base64,R0lGODlhAQABAIAAAP///////yH5BAEKAAEALAAAAAABAAEAAAICTAEAOw==
Militares acumulam altos salários para comandar estatais|Estado de Minas|06/09/2021||Presidente da Petrobras. As remunerações mais expressivas são pagas ao presidente da Petrobras, o general de Exército Joaquim Silva e Luna. O militar chegou ao...|https://www.em.com.br/app/noticia/politica/2021/09/06/interna_politica,1302920/militares-acumulam-altos-salarios-para-comandar-estatais.shtml|data:image/gif;base64,R0lGODlhAQABAIAAAP///////yH5BAEKAAEALAAAAAABAAEAAAICTAEAOw==
"Famosos prestigiam estreia de ""Bichos Dançantes"""|Portal Anna Ramalho|06/09/2021||A Focus Cia. de Dança, por meio do patrocínio da Petrobras, através da Lei Federal de Incentivo à Cultura, estreou seu primeiro espetáculo infantil,...|https://www.annaramalho.com.br/famosos-prestigiam-estreia-de-bichos-dancantes/|data:image/gif;base64,R0lGODlhAQABAIAAAP///////yH5BAEKAAEALAAAAAABAAEAAAICTAEAOw==
ANP: País gasta mais 20,5% com a importação de petróleo ...|ISTOÉ DINHEIRO|06/09/2021||A principal responsável pela balança comercial brasileira é a Petrobras, que tem na China seu maior comprador. O país asiático respondeu por 45% do volume...|https://www.istoedinheiro.com.br/anp-pais-gasta-mais-205-com-a-importacao-de-petroleo-neste-ano/|data:image/gif;base64,R0lGODlhAQABAIAAAP///////yH5BAEKAAEALAAAAAABAAEAAAICTAEAOw==
Após 18 meses, Isaac Karabtchevsky volta a conduzir concerto da Opes|VEJA RIO|07/09/2021||Após um ano e meio recluso na região serrana do Rio, por causa da pandemia, o maestro Isaac Karabtchevsky, 86 anos, vai voltar a reger a Orquestra Petrobras...|https://vejario.abril.com.br/programe-se/isaac-karabtchevsky-concerto/|data:image/gif;base64,R0lGODlhAQABAIAAAP///////yH5BAEKAAEALAAAAAABAAEAAAICTAEAOw==
Moro: 'Defesa da liberdade deve reforçar a verdade e a democracia'|Correio Braziliense|07/09/2021||"Últimas Notícias · Bolsonaro diz que Petrobras ""traiu o povo brasileiro"" e pede instalação de CPI · Fernando de Noronha: STF marca segunda audiência entre governo..."|https://www.correiobraziliense.com.br/politica/2021/09/4948200-moro-defesa-da-liberdade-deve-reforcar-a-verdade-e-a-democracia.html|data:image/gif;base64,R0lGODlhAQABAIAAAP///////yH5BAEKAAEALAAAAAABAAEAAAICTAEAOw==
