title|media|date|desc
Mortalidade da Covid-19 por cem mil habitantes|Diário do Poder|22/07/2020|Ministro Mendonça cobra da Petrobras motivo das altas de combustíveis ·  Diário do Poder. Arthur Lira pede 'renúncia imediata' do presidente da  Petrobras.
Petrobras reajusta em 5% preço do gás de cozinha nas ...|Poder360|23/07/2020|A Petrobras reajustou em 5% o preço médio do GLP (gás liquefeito de  petróleo) nas suas refinarias. O aumento vale a partir desta 5ª feira  (23.jul.2020).
Petrobras anuncia aumento de 5% no preço do gás de cozinha|Correio Braziliense|23/07/2020|A Petrobras anunciou reajuste em 5% no Gás Liquefeito de Petróleo (GLP),  envasado em botijões. Com isso, o preço médio da estatal para as  distribuidoras do...
Aumento do gás de cozinha nas refinarias pode ter consequência na população|Tv Jornal|23/07/2020|A Petrobras afirmou que aumentou em 5% o preço médio do gás de cozinha, a  partir desta quinta-feira (23). Com isso, o preço médio da Petrobras  equivale a R$...
Banqueiro Juca Abdalla emplaca dois nomes no conselho da Petrobras|Valor Investe|23/07/2020|Dois dos três conselheiros da Petrobras eleitos para representar os  acionistas minoritários foram indicados pelo banco Clássico, que pertence a  José João...
Vasta, da Cogna, lança IPO nos EUA e Dimed levanta R$ 1 bi com oferta; notícias de Petrobras e Vale no radar|InfoMoney|23/07/2020|O Conselho de Administração da Vale aprovou a criação de um “comitê de  nomeação”, a Petrobras pagará dividendos e o Grupo Pão de Açúcar (GPA)  informou a...
Poço seco da Shell ofusca exploração de petróleo no Brasil|Money Times|23/07/2020|A Royal Dutch Shell acaba de perfurar um poço seco na principal região  offshore do Brasil, um sinal de que a Petrobras (PETR3 PETR4) já pode ter  abocanhado...
ConJur - Avio Britto: Marcos regulatórios são fundamentais ...|Consultor Jurídico|23/07/2020|A AGU defendeu que a alienação de ativos de refino faz parte do plano de  negócios e gestão da Petrobras, sendo essa uma decisão tomada pelos  administradores...
Justiça aceita denúncia contra empresário pernambucano ...|Blog do Ricardo Antunes|23/07/2020|Conforme apurado nas investigações, Carrilho participou de esquema que  movimentou R$ 1.773,765,00 em propinas pagas ao ex-diretor da Petrobras  Paulo Roberto...
Chevron usa painéis de energia solar para bombear petróleo nos EUA|O Globo|23/07/2020|Lucros: Petrobras pagará dividendos de 2019 em dezembro, após adiamento  devido à pandemia. Em troca, a Chevron receberá os chamados créditos padrão  de...
Segundo a ANP, descomissionamento de plataformas pode trazer um mar de oportunidades aos nossos estaleiros|Click Petróleo e Gás|23/07/2020|Leilões de plataformas da Petrobras podem aliviar a situação dos estaleiros  parados no Brasil e segundo a ANP cerca de 20 unidades serão  descomissionadas a...
Petrobras vende três plataformas em leilão por US$ 1,45 milhão|Correio Braziliense|24/07/2020|A Petrobras vendeu nesta sexta-feira (24/7), em leilão três plataformas de  petróleo fora de operação para o mesmo comprador pelo valor total de US$  1,45...
Petrobras lança licitação para contratar três novas ...|EPBR|24/07/2020|A Petrobras anunciou nesta sexta-feira (24) que foi aprovada a contratação  de três novas plataformas do tipo FPSO para o campo de Búzios, no pré-sal  da...
Juca Abdalla barra União no conselho da Petrobras|Valor Econômico|24/07/2020|Banqueiro Juca Abdalla se junta a fundos e consegue eleger mais um  representante dos minoritários em assembleia da Petrobras.
ANP está preocupada com abastecimento de gás de cozinha após venda de refinarias da Petrobrás|Economia & Negócios|24/07/2020|Geraldo Falcão/Petrobrás Governo está preocupado com abastecimento de gás  de cozinha após venda de refinarias da Petrobrás Geraldo Falcão/Petrobrás...
Brazil's Petrobras kicks off tender to build three FPSOs in ...|Reuters|24/07/2020|SAO PAULO (Reuters) - Brazilian state-controlled oil company Petrobras said  on Friday it has approved the start of a tender to build three new  floating...
Petrobras informa que FPSO Capixaba voltará a operar no 3° trimestre deste ano|Click Petróleo e Gás|24/07/2020|A unidade da Petrobras está paralisada desde abril, quando trabalhadores da  plataforma foram infectados pelo coronavírus e o FPSO teve de passar por  processo de...
Lives de concertos: tradicional sala Cecília Meireles lança ...|Agência Brasil|24/07/2020|Desde sua criação em 1965, a Casa abriu seu palco para de grandes  apresentações, como a da Orquestra Petrobras e o Festival de Música da  Rádio MEC FM.
BMW apresenta o primeiro SUV 100% elétrico da marca, o iX3|Diário do Poder|24/07/2020|Lucro abusivo da Petrobras é de meio bilhão por dia · Diário do Poder. Novo  ministro define primeira providência: deflagrar privatização da Petrobras.
Câmara celebra Dia da Mulher Negra com projeção de imagens|Folha PE|24/07/2020|Avança no governo projeto para privatizar a Petrobras com diluição de  participação da União · Lira chama presidente da Petrobras de 'ilegítimo' e  ameaça...
Saúde diz que não é obrigada a fornecer testes, respiradores e máscaras|Exame|24/07/2020|Veja Também · Líder do governo na Câmara pede assinaturas para CPI da  Petrobras · Preço do combustível é uma decisão da Petrobras, não do  governo, diz ministro.
Petrobras faturou ontem (24/07) 1,45 milhão de dólares com a venda de 3 plataformas de petróleo|Click Petróleo e Gás|25/07/2020|A plataforma de petróleo da Petrobras mais disputada no leilão foi a P-15,  que arrecadou US$ 750 mil após 43 lances pelo ativo, segundo site do  leiloeiro...
Mais de mil contratos Petrobras: Sondas, Aeronaves, Floatels e embarcações de apoio|Click Petróleo e Gás|25/07/2020|Análise financeira dos contratos de afretamento da Petrobras e adequação de  custos com foco no pré-sal. Em Abril deste ano, a Petrobras informou que...
Toffoli suspende execução da BR Distribuidora em ação ...|Consultor Jurídico|25/07/2020|Na RCL 42.207, a Petrobras Distribuidora sustenta que, mesmo após a  paralisação dos processos, o juízo trabalhista deu prosseguimento a uma das  ações sobre a...
Muriaé é uma das cidades de Minas com gás de cozinha mais caro|Guia Muriaé|25/07/2020|A Petrobras reajustou em 5% o preço médio do gás liquefeito de petróleo  (GLP) nas suas refinarias. O aumento passou a valer a partir da última  quinta-feira...
E-commerce: cupons e cashback movimentam mais de R$ 1,5 bilhão na quarentena|Money Times|25/07/2020|Gasolina e etanol têm primeira queda de preço depois de três meses de altas  · Se havia dúvida de que a Petrobras (PETR4) amarrava preço do etanol nas  usinas...
Pretende trabalhar no mercado offshore? Entenda a diferença entre T-HEUT e HEUT (Treinamento de Escape de ...|CPG Click Petroleo e Gas|25/07/2020|... O HUET não é um treinamento normatizado, por nenhum órgão oficial no  Brasil e não é obrigatório para trabalhos nas plataformas offshore da  Petrobras.
Essas 5 mulheres comandam negócios que você deveria conhecer|Exame|25/07/2020|"Nina também tem no histórico profissional participações em empresas como  SAP, Petrobras, Honda, L'Oréal, Heineken. ""O fomento do letramento  identitário e do..."
Pioneiro do ESG no Brasil vê com “amor e ódio” leva de fundos sustentáveis|Exame|26/07/2020|Vai ficar comprado em Petrobras e Petrobras vai perder seu valor”, afirmou.  Confira a entrevista: O desmatamento da Amazônia se tornou mais relevante?  Por que o...
Bridgewater planeja demissões sob efeito da pandemia no trabalho|Money Times|26/07/2020|O fundo Pure Alpha II da Bridgewater perdeu 20,6% no primeiro semestre.  Leia também: Comprar ou vender? Petrobras (PETR4): “...
Dois jovens morrem após grave acidente de carro em Goiânia|Jornal Opção|26/07/2020|Chegou a hora de tirar a máscara da Petrobrás  https://www.jornalopcao.com.br/bastidores/chegou-a-hora-de-tirar-a-mascara-da-petrobras-406451/  …
De Beers repensa negócio em meio a colapso do setor de diamantes|Money Times|26/07/2020|... Proteção e dividendos: 13 ações para encarar o segundo semestre,  segundo o JPMorgan · A alternativa ao papel da Petrobras (PETR4) que pode  disparar 183%.
Presidente do STJ, ministro João Otávio de Noronha testa positivo para Covid-19|Diário do Poder|26/07/2020|Bolsonaro afirma que Petrobras tem que cumprir função social · Diário do  Poder ... Bolsonaro afirma que Petrobras tem que cumprir função social.
Caio Mesquita: A última gota|Money Times|26/07/2020|Pagar o justo por orientação é o melhor antídoto contra o barato que sai  caro. Leia também: Petrobras. Economia · Petrobras e crise no MEC: veja...
Fundos de pensão: governo pode permitir saque parcial antecipado|Gazeta do Povo|26/07/2020|Alguns exemplos conhecidos são o Funcef, da Caixa Econômica Federal, o  Petros, da Petrobras e o Previ, do Banco do Brasil. Como o próprio nome  diz,...
Economia circular: por que importa? E onde nos levará?|Money Times|26/07/2020|E, certamente, estarão aí incontáveis oportunidades de investimentos na  economia real. Leia também: Petrobras · Empresas · Comitê da Petrobras  (PETR3;PETR4)...
Pernambuco perde Vinicio Tavares de Melo, empresário do Grupo Tavares de Melo|Folha PE|26/07/2020|Programa Brasil Mais quer aumentar digitalização de pequenos negócios ·  Petrobras reabre processo de venda de três refinarias. ESTATAL...
Além de postos no governo, militares ocupam cargos em conselhos de administração de estatais|O Globo|26/07/2020|Outro militar integrante do conselho da Petrobras é Ruy Schneider, também  da reserva da Marinha. Schneider está ainda no conselho da Eletrobras,  recebendo jeton...
Petrobras é condenada a pagar mais de R$ 700 mil por danos ambientais em SE|UOL Economia|27/07/2020|Petrobras é condenada a pagar mais de R$ 700 mil por danos ambientais em  SE. Estatal é responsável pelo vazamento de óleo que contaminou três  praias...
Pré-sal – Petrobras avança na exploração do maior campo do mundo, o campo de Búzios, na Bacia de Santos|Click Petróleo e Gás|27/07/2020|O que se espera é que, até 2030, o campo de Búzios produza 2 milhões de  barris de óleo por dia. A Petrobras aprovou na última semana, a contratação  de três...
Sílvio Pereira é condenado ao semiaberto por caso da Land ...|Consultor Jurídico|27/07/2020|No mesmo processo, também foram condenados por corrupção o ex-diretor da  Petrobras Renato Duque e César Roberto Oliveira, sócio-administrador da  GDK. Na...
TBG lança contratação de curto prazo no transporte de gás natural|Correio Braziliense|27/07/2020|A Transportadora Brasileira Gasoduto Bolívia-Brasil (TBG), controlada pela  Petrobras, lançou nesta segunda-feira, 27, uma nova modalidade de  contratação de...
Apesar do anúncio de venda, Usina Quixadá tem futuro incerto|BiodieselBR.com|27/07/2020|Inaugurada em 2008 com a proposta de elevar o patamar da Petrobras no  segmento de combustíveis verdes, a usina de biodiesel em Quixadá (CE) pouco  atingiu...
Auditoria da Prefeitura de Vitória sobre obra da sede da ...|A Gazeta|27/07/2020|Auditoria da Prefeitura de Vitória sobre obra da sede da Petrobras não  encontrou irregularidades · Investigação feita só sobre os procedimentos  realizados junto...
Entenda as novas especificações da gasolina|SpaceMoney|27/07/2020|Além disso, vale lembrar que a Petrobras é responsável por apenas 28% do  preço final da gasolina nos postos de serviço. As demais parcelas são  compostas por...
BR Malls tem 24 shoppings reabertos; Marisa informa posição ...|Eu Quero Investir|27/07/2020|Radar traz Petrobras (PETR4), Embraer (EMBR3) e Braskem (BRKM5) · Futuros  de NY sobem e demais mercados operam em terreno positivo; tendência se  mostra de...
Pesca ilegal próxima à plataformas da Petrobras: IBAMA apreende embarcação devido ao risco de acidentes|CPG Click Petroleo e Gas|27/07/2020|Ibama flagra pesca proibida ao redor de plataformas de petróleo da  Petrobras na Bacia de Santos e apreende embarcação para prevenir acidentes.
FII de CRIs: conheça esse tipo de fundo imobiliário|Eu Quero Investir|27/07/2020|Radar traz Petrobras (PETR4), Embraer (EMBR3) e Braskem (BRKM5) · Futuros  de NY sobem e demais mercados operam em terreno positivo; tendência se  mostra de...
Petrobras divulga panorama de ativos relacionados ao pré-sal na Colômbia|Money Times|28/07/2020|Sobre o Bloco Tayrona. Petrobras PETR4 Pré-Sal Colômbia A Petrobras, que é  operadora da área, detém 44,44% de participação (Imagem: Divulgação...
Polícia Federal de São Paulo abre inquérito para apurar suspeita de contaminação de gasolina de aviação|G1|28/07/2020|Petrobras decidiu interromper 'preventivamente' o fornecimento de um lote  de gasolina de aviação importada após testes. Por Isabela Leite, GloboNews  — São Paulo.
Ex-secretário-geral do PT, Silvinho 'Land Rover' é condenado pela Lava-Jato|O Globo|28/07/2020|Além de Silvio Pereira, foram condenados também o ex-diretor de Serviços da  Petrobras, Renato Duque, e o administrador da GDK, César Roberto Santos  de...
McLaren reedita parceria e anuncia acordo de patrocínio com petrolífera Gulf Oil na F1|Grande Prêmio|28/07/2020|Agora, as duas companhias voltam a se unir nove meses depois de a equipe de  Woking anunciar o rompimento do contrato de patrocínio com a Petrobras.
Com nova regulação, Piauí pode dobrar produção de gás ...|Piauí Hoje|28/07/2020|“O mercado atual está extremamente fechado e cartelizado, com praticamente  100% sobre o controle da Petrobras e de outras estatais. Não há  investimentos para...
Ei, jovens: começar a investir não é sobre ficar rico amanhã|SpaceMoney|28/07/2020|Ibovespa sobe 2,1%, aos 100 mil pts. com Petrobras (PETR4) e Vale (VALE3);  dólar cai 0,3%, a R$ 5,23. 17h16 - 27 Jun 2022 · [OGF - VIP - SPACENOW  DESKTOP]...
Vale anuncia desenvolvimento de locomotiva 100% elétrica e projeta fase de testes|Money Times|28/07/2020|Gasolina e etanol têm primeira queda de preço depois de três meses de altas  · Se havia dúvida de que a Petrobras (PETR4) amarrava preço do etanol nas  usinas...
Centro de Jaraguá recebe novos contentores de resíduos - JDV|Jornal do Vale do Itapocu|28/07/2020|Simpósio mostra que é possível o uso sustentável de água e energia ·  Petrobras nomeia Fernando Borges como presidente interino.
Lucro da Visa cai 23%, mas fica acima das estimativas|Money Times|28/07/2020|Efeito Petrobras (PETR4): Banco do Brasil (BBAS3) acumula perdas de 10% no  mês; oportunidade de compra? Leia mais sobre: Empresas, Internacional,  Resultados,...
Fundo soberano de Cingapura alerta para volatilidade de mercados|Money Times|28/07/2020|... Se havia dúvida de que a Petrobras (PETR4) amarrava preço do etanol nas  usinas, ... Petrobras (PETR4), dividendos e mais: Veja os destaques da  semana no...
Petrobras admite 'erro', manda suspender anúncios em sites de investigados pelo STF, e TCU arquiva denúncia|Blogs|29/07/2020|Leandro Prazeres. O Tribunal de Contas da União (TCU) arquivou uma denúncia  contra a Petrobras por anúncios pagos pela estatal em sites e canais do  YouTube...
Conselho da Petrobras aprova acordo com Petros para encerrar arbitragem sobre Sete Brasil|Valor Investe|29/07/2020|O conselho de administração da Petrobras aprovou hoje o acordo com a Petros  — fundo de pensão dos funcionários da estatal — para encerrar o litígio  arbitral...
Petrobras informa avanço na venda da Unidade de Processamento de Gás Natural e de sete campos de petróleo no estado de Alagoas|CPG Click Petroleo e Gas|29/07/2020|Segundo a Petrobras, além dos campos de petróleo e suas instalações de  produção, está incluída na transação a Unidade de Processamento de Gás  Natural (UPGN)...
Petrobras utiliza game para treinar equipes do Polo de Urucu ...|Amazonas Atual|29/07/2020|MANAUS – A Petrobras desenvolveu, em parceria com o Sidia Instituto de  Ciência e Tecnologia, um game com uso de realidade virtual para treinamento  de sua...
Nova gasolina brasileira: o que vai mudar para o consumidor?|AutoPapo|29/07/2020|Diante dos recursos existente na tão badalada Petrobrás esse custo não  ultrapassaria os $2,50 por litro. Acrescenta-se mais $0,50 por litro para...
ConJur - Luiz Edson Fachin: A opção pela democracia|Consultor Jurídico|29/07/2020|No Brasil mais recente, atos contra bens jurídicos de interesse público e a  Petrobras desvelaram múltiplos delitos, como corrupção, lavagem de  dinheiro,...
8 dos 10 supercomputadores mais rápidos do mundo usam GPU 'queridinha' dos mineradores de Ethereum|Cointelegraph|29/07/2020|Com a atualização do ranking TOP500, os supercomputadores Atlas e Fênix,  ambos pertencentes a Petrobrás e montados pela Atos, líder mundial em  transformação...
Câmara aprova urgência na Nova Lei do Gás e acelera tramitação|VEJA|29/07/2020|Estação de Compressão de Gases do Gasoduto Brasil-Bolívia da Petrobras  DESCENTRALIZAÇÃO - Nova lei do gás prevê que empresas operem após  autorização e não...
BC não sabe até quando entesouramento pela população perdurará, diz diretora de Administração|Money Times|29/07/2020|... Se havia dúvida de que a Petrobras (PETR4) amarrava preço do etanol nas  usinas, ... Petrobras (PETR4), dividendos e mais: Veja os destaques da  semana no...
Banco Central adota nova nomenclatura para circulares e cartas circulares|Money Times|29/07/2020|Gasolina e etanol têm primeira queda de preço depois de três meses de altas  · Se havia dúvida de que a Petrobras (PETR4) amarrava preço do etanol nas  usinas...
PIB dos EUA e balanços de Vale e Petrobras são foco do mercado nesta quinta|Valor Investe|30/07/2020|Bradesco, Ambev e Usiminas já divulgaram seus resultados, enquanto o  balanço da Petrobras sai hoje à noite. O Bradesco informou que teve lucro  recorrente de R$...
Contrato milionário beneficiou amigo de Moro durante a Lava ...|Brasil de Fato|30/07/2020|Dotti nunca informou à Petrobras que atuou nas causas de Carlos Zucolotto  bem como sobre sua amizade com o ex-ministro de Justiça e Segurança  Pública...
Petrobras: três vídeos para você entender como foi enganado ...|Revista Forum|30/07/2020|Três vídeos para você entender que a Petrobras é super lucrativa, que os  petroleiros têm compromisso com a soberania nacional e que a lava-jato  esteve e...
Navio-tanque fretado pela Petrobras é entregue pela AET e já está rumo ao Rio de Janeiro para iniciar suas operações|CPG Click Petroleo e Gas|30/07/2020|O navio-tanque Eagle Paulinia se junta à frota da AET para afretamento pela  Petrobras e já está a caminho do Rio de Janeiro para atividades.
Diário de Petrópolis|Diário de Petrópolis|30/07/2020|Assim, vai gerar mais emprego e renda”, defende o parlamentar. A abertura  do mercado de gás, hoje sob o monopólio da Petrobras, é apontado como um  dos motores...
Compass Gás e Energia, da Cosan, pretende pedir registro para oferta de ações|Época Negócios|30/07/2020|Petrobras reduz gasolina em 4%, na 1ª queda desde abril; mantém diesel. A  Compass concentra os negócios Cosan em gás, incluindo a distribuidora  Comgás,...
ANP aprova distribuição de royalties para educação e saúde|Agência Brasil|30/07/2020|Economia. Petrobras avança no desenvolvimento do campo de Búzios, no  pré-sal · Geral. ANP: redução de conteúdo local chegou a 70% dos contratos  elegíveis...
Vagas offshore Macaé: 13 oportunidades de empregos para Técnicos em diversas especializações para atuação em contratos Petrobras|Click Petróleo e Gás|30/07/2020|... Técnicos em diversas especializações para atuação em contratos  Petrobras ... ( Pessoas com Deficiência) para atuar em campanhas e  contratos Petrobras.
Lucro da Ambev cai 51%, mas resultado anima; Usiminas tem prejuízo de R$ 395 mi, balanços de Pão de Açúcar, TIM, Localiza e mais notícias|InfoMoney|30/07/2020|Já a Petrobras informou que as demonstrações financeiras do segundo  trimestre contarão com o R$ 16,9 bilhões em créditos tributários e o  desembolso de R$...
Lucro da Mastercard mingua 31% no 2° tri, a US$ 1,42 bilhão, mas bate expectativas|Money Times|30/07/2020|Se havia dúvida de que a Petrobras (PETR4) amarrava preço do etanol nas ...  Dividendos, Petrobras (PETR4), Vale (VALE3) e outros destaques em Comprar  ou...
Petrobras: petróleo em baixa e efeitos da covid-19 explicam prejuízo|Agência Brasil|31/07/2020|“Tivemos um segundo trimestre muito desafiador para a economia global e a  indústria do petróleo”, disse hoje (31), o presidente da Petrobras, Roberto  Castello...
Petroleiros começam vigília contra venda de unidades da ...|Brasil de Fato|31/07/2020|O Sindicato dos Petroleiros da Bahia (Sindipetro Bahia) deu início nessa  sexta-feira (31) à “Vigília Itinerante em defesa da Petrobras e da Bahia”.
Preços da gasolina e do diesel sobem pela 10ª semana seguida|Correio do Povo|31/07/2020|A elevação dos valores praticados nas bombas tem acompanhado uma série de  aumentos praticados pela Petrobras nas refinarias desde meados de abril,...
Petrobras utiliza Realidade Virtual para treinar equipes do ...|InforChannel|31/07/2020|A Petrobras desenvolveu, em parceria com o Sidia Instituto de Ciência e  Tecnologia, uma experiência em Realidade Virtual (RV) para o treinamento de  sua...
Petrobras e WEG fecham contrato: Centenas de motores, turbogeradores e inversores de frequência para 2 pla ...|Click Petróleo e Gás|31/07/2020|Petrobras e WEG fecham contrato: Centenas de motores, turbogeradores e  inversores de frequência para 2 plataformas no pré-sal.
Resultado Petrobras (PETR4) 2020: Prejuízo de R$ 2,7 B no 2t20|The Capital Advisor|31/07/2020|Petrobras divulgou seus resultados referentes ao 2t20, confira os destaques  e se vale a pena investir na PETR4. imagem. Marcelo-photo...
Em Macaé, Porto de Imbetiba tem proposta aprovada pela Petrobras para apoio logístico e portuário|Click Petróleo e Gás|31/07/2020|A Petrobras habilitou uma oferta da empresa Top-TPAR Operadora Portuária,  que concorria em disputa de licitação desde dezembro de 2019, para serviços  de...
Participação do pré-sal na produção de petróleo e gás natural ...|Poder360|31/07/2020|Divulgação/Petrobras. P-66, unidade flutuante de armazenamento e  transferência da Petrobras, no campo Lula Ludmylla Rocha 31.jul.2020  (sexta-feira) - 16h36.
Sergipe importará gás natural para distribuir com caminhões ...|Poder360|31/07/2020|A Petrobras segue essa linha. ... planeja a competição do gás em exploração  pela Petrobras (que resulta em royalties para Sergipe) com o do GNL  importado.
Quais são as ações mais baratas do Ibovespa ao final de julho de 2020?|SpaceMoney|31/07/2020|Ibovespa sobe 2,1%, aos 100 mil pts. com Petrobras (PETR4) e Vale (VALE3);  dólar cai 0,3%, a R$ 5,23. 17h16 - 27 Jun 2022 · [OGF - VIP - SPACENOW  DESKTOP]...
