title|media|date|desc
Petrobras reajusta preço da gasolina pela quinta vez no ano, em meio a troca de comando|O Globo|02/03/2021|RIO — A Petrobras vai reajustar os preços da gasolina novamente nesta  terça-feira. Será o quinto aumento no ano, levando a uma alta acumulada  desde janeiro...
Petrobras anuncia reajuste nas refinarias de 4,8% na gasolina e 5% no diesel|CNN Brasil|02/03/2021|A Petrobras anunciou, nesta segunda-feira (1º de março), novo reajuste nas  refinarias de 4,8% na gasolina e 5% no diesel. Isso significa uma alta de  R$ 0,12...
GLP: Petrobras aumenta preço do gás de cozinha nas refinarias|UOL Economia|02/03/2021|A Petrobras informou hoje que aumentou o GLP (Gás Liquefeito de Petróleo),  o terceiro reajuste do ano, em R$ 0,15 por quilo, o equivalente a um  impacto de...
Agência Brasil explica: como é a composição do preço dos combustíveis|Agência Brasil|02/03/2021|Ao sair da Petrobras, o combustível sai com o valor do produto mais os  tributos federais: a Contribuição de Intervenção no Domínio Econômico  (Cide), partilhada...
Castello Branco deixa Petrobras mais enxuta|Valor Econômico|02/03/2021|O atual presidente assumiu a empresa respaldado pelo ministro da Economia,  Paulo Guedes. A missão do executivo, na Petrobras, era acelerar a execução  do plano...
Petrobras fecha venda de usina eólica ao fundo de investimento PirineusTurbina|CNN Brasil|02/03/2021|A Petrobras assinou contrato para a venda de sua participação majoritária  no parque eólico Mangue Seco 2 ao fundo de investimento em participações  FIP...
Usina térmica de meio bilhão da Petrobras vira 'elefante ...|A Gazeta|02/03/2021|"Usina térmica de meio bilhão da Petrobras vira ""elefante branco"" na Bahia.  A estatal já pediu o encerramento formal das operações da usina,  simplesmente porque..."
Especialistas temem que interferência na Petrobras prejudique economia|iG Economia|02/03/2021|Após mais um reajustes nos preços do combustíveis, mercado financeiro teme  mais interferências do Governo Federal na Petrobras...
Após três prósperas gerações, Petrobras já não assegura mais trabalho para a família Reis|El País|02/03/2021|A família do petroleiro aposentado Wilson Reis é um retrato da decadência  econômica do Norte Fluminense provocada pela redução das atividades da  Petrobras...
Você tem FGTS na Petrobras ou fundo dedicado à empresa? Saiba o que fazer|Valor Investe|02/03/2021|Com a forte queda dos papéis da Petrobras na última semana e a insegurança  jurídica que se formou em cima da empresa, quem investe em fundos que têm  apenas...
Guedes: Vamos pegar os dividendos da Petrobras e entregar uma parte ao povo|Valor Econômico|03/03/2021|"Guedes: Vamos pegar os dividendos da Petrobras e entregar uma parte ao  povo. Ideia é criar fundo com ativos: ""se [o petróleo] é nosso, dá para a  gente,..."
Guedes diz que privatizaria tudo, mas Bolsonaro barra Petrobras, BB e Caixa|UOL Economia|03/03/2021|"Guedes diz que privatizaria tudo, mas Bolsonaro barra Petrobras, BB e  Caixa. ""Estatal boa é a que foi privatizada"", disse Guedes, em entrevista à."
Guedes diz que há ideia de criar fundo pra pagar dividendos da Petrobras para os “mais pobres”|InfoMoney|03/03/2021|O ministro da Economia, Paulo Guedes, disse que o governo quer criar um  fundo com ativos da Petrobras para pagar dividendos “principalmente a  pessoas mais...
A Petrobras é do Brasil e do povo brasileiro|Carta Capital|03/03/2021|Por Deyvid Bacelar. O presidente Jair Bolsonaro, enfim, demitiu o  presidente da Petrobras, Roberto Castello Branco, que há dois anos ocupava  a direção da...
Após reajuste da gasolina, Bolsonaro critica Castello Branco e diz que vai combater 'preço abusivo' de combustíveis|O Globo|03/03/2021|Receba notícias em tempo real no app. Baixar. BRASÍLIA - O presidente Jair  Bolsonaro criticou na noite desta segunda-feira o presidente da Petrobras,  Roberto...
Após reajuste da Petrobras, gasolina, diesel e gás ficam mais caros no DF|G1|03/03/2021|A Petrobrás também anunciou o aumento do preço do gás de cozinha. O botijão  de 13kg vai subir R$ 1,90.
Quatro integrantes do Conselho da Petrobras pedem para deixar o cargo|Correio Braziliense|03/03/2021|Quatro integrantes do Conselho da Petrobras pedem para deixar o cargo.  Decisão é uma resposta à mudança na presidência da estatal. O presidente  Jair Bolsonaro...
CVM vai investigar operação suspeita com ações da Petrobras|iG Economia|03/03/2021|"No mesmo dia, o presidente Jair Bolsonaro realizou a tradicional live das  quintas-feiras, quando afirmou que ""o presidente da Petrobras falou que..."
Currículo atrapalha general indicado por Bolsonaro para a Petrobras|Estado de Minas|03/03/2021|General Joaquim Silva e Luna está encontrando obstáculos para assumir a  presidência da Petrobras por indicação do presidente Jair Bolsonaro  (foto:...
Polícia combate furto de combustível de dutos da Petrobras|Agência Brasil|03/03/2021|... Rio de Janeiro (MPRJ) cumprem hoje (2) cinco mandados de prisão e 14 de  busca e apreensão contra suspeitos de furtar combustível de dutos da  Petrobras.
Suspeita de insider trading da Petrobras já estava no radar da B3|InfoMoney|05/03/2021|As operações atípicas com ações da Petrobras (PETR3;PETR4) já haviam  chamado a atenção dentro da B3, a bolsa paulista, nos dias que se seguiram  à...
Risco de processo faz conselheiros da Petrobras desistirem de novo mandato|CNN Brasil|05/03/2021|Risco de processo faz conselheiros da Petrobras desistirem de novo mandato.  Os acionistas da estatal ameaçam ir à justiça após o presidente Jair  Bolsonaro...
Os dois problemas do caso Petrobras seguem sem solução|Valor Investe|05/03/2021|Os dois problemas do caso Petrobras seguem sem solução. Um desses percalços  é a governança corporativa das empresas de capital misto e o outro é  referente aos...
CVM pode investigar insider na Petrobras; operação já estava no radar da bolsa|CNN Brasil|05/03/2021|As operações atípicas com ações da Petrobras já haviam chamado a atenção  dentro da B3, a bolsa paulista, nos dias que se seguiram à sinalização dada  pelo...
Crime de 'insider trading', como o da Petrobras, teve só uma ...|UOL Economia|05/03/2021|Na recente crise da Petrobras, tudo indica que a investigação da CVM terá  como principal alvo uma operação atípica com opções de venda de ações da  estatal no...
Litro da gasolina sobe pelo 9º mês e supera R$ 5; diesel bate R$ 4, diz ValeCard|CNN Brasil|05/03/2021|A Petrobras elevou os preços de diesel e gasolina nas refinarias em duas  ocasiões ao longo de fevereiro, e no início de março voltou a reajustá-los  para cima.
Saída de diretor Gustavo Gonzalez da CVM não tem relação com caso Petrobras|JOTA|05/03/2021|... de Valores Mobiliários (CVM) não tem nenhuma relação com o episódio  envolvendo um possível crime de insider trading na operação de ações da  Petrobras.
Gasolina a preço justo para entregadores no Dia Nacional de ...|Revista Forum|05/03/2021|Ao fazer isso, a Petrobras, uma empresa dos brasileiros, atende apenas aos  ... de importação, que a gestão da Petrobrás implementou há quase cinco  anos.
Petroleiros fazem venda de combustíveis 'a preço justo' nesta ...|Rede Brasil Atual|05/03/2021|Esses cálculos levam em consideração os preços e custos da Petrobras, além  da garantia de lucratividade das empresas produtoras, distribuidoras e  revendedores.
Governo avalia colchão tributário e fundo para baixar preço ...|A Gazeta|05/03/2021|... tem sido criticada constantemente pelo presidente e foi apontada como  possível estopim para a queda do presidente da Petrobras, Roberto Castello  Branco.
CVM abre investigação por uso de informação privilegiada com ações da Petrobras|G1|06/03/2021|"CVM abre investigação por uso de informação privilegiada com ações da  Petrobras. Conhecida no jargão do mercado como ""insider trading"", operação  busca a..."
CVM abre investigação sobre uso de informação privilegiada ...|Poder360|06/03/2021|2021) que abriu um processo para investigar o uso de informação  privilegiada nos negócios com ações da Petrobras. O processo administrativo  está sob sigilo. A...
CVM afirma que investiga Petrobras por uso de informação privilegiada com ações|CNN Brasil|06/03/2021|... para investigar uso de informação privilegiada nos negócios com ações  da Petrobras, no episódio envolvendo anúncio de troca no comando da  companhia.
CVM confirma processo para investigar suposta informação privilegiada sobre mudanças na Petrobras|GZH|06/03/2021|... administrativo para investigar o suposto uso de informação privilegiada  (insider trading, no jargão do mercado) na negociação de papéis da  Petrobras.
Diesel avança pela 6ª semana nos postos do Brasil; gasolina e etanol também sobe|CNN Brasil|06/03/2021|Além do corte de impostos, o presidente Jair Bolsonaro também decidiu no  mês passado indicar um novo presidente para a Petrobras, em meio a  constantes...
Petrobras reduz em 80% etapa da modelagem de reservatórios com uso de Inteligência Artificial|Notícias Agrícolas|06/03/2021|Ferramenta permitirá reduzir custos e antecipar projetos, trazendo ganhos  para o programa estratégico PROD1000. A Petrobras desenvolveu uma  plataforma...
CVM confirma investigação de 'insider trading' na Petrobras|ES Brasil|06/03/2021|Alguém pode ter lucrado R$ 18 milhões com o vazamento de informações sobre  a mudança de comando da Petrobras. A Comissão de Valores Mobiliários  (CVM)...
CVM vai investigar suspeita de informação privilegiada sobre Petrobras; entenda|iG Economia|06/03/2021|Na sexta, após o fechamento do mercado, Bolsonaro anunciou a troca de  comando da Petrobras, substituindo Roberto Castello Branco pelo general  Joaquim Silva e...
Anfavea sugere injeção de recursos da Petrobras na ...|Automotive Business|06/03/2021|Por esse motivo, a entidade sugere que a própria Petrobras deveria injetar  recursos para viabilizar a renovação de frota com a compra e sucateamento  dos...
Entre Arábia Saudita e Noruega, Brasil precisa de um rumo ...|EPBR|06/03/2021|Algumas delas defendem que a Petrobras deve ser utilizada para oferecer  combustíveis mais baratos, uma vez que a Cia é estatal, grande produtora de  petróleo...
O desafio de conciliar a função social e a lucratividade na ...|Poder360|07/03/2021|A função social e a lucratividade das empresas estatais de economia mista,  cujo exemplo mais eloquente é a Petrobras dada sua inegável importância e...
Bolsonaro multiplica por 10 número de militares no comando de estatais|Folha|07/03/2021|Com general na Petrobras, serão 92 cargos de chefia com as Forças Armadas;  eram 9 no fim do governo Temer · O presidente Jair Bolsonaro em 2021 ·  Conheça os...
Fundo para estabilizar preço do combustível: entenda o mecanismo|Gazeta do Povo|07/03/2021|A discussão voltou à tona com os consecutivos reajustes no preço da  gasolina e do óleo diesel nas refinarias da Petrobras, que pratica a  paridade...
Preço médio do litro da gasolina já beira os R$ 6 em cidade ...|A Gazeta|07/03/2021|Segundo a Petrobras, os preços repassados às distribuidoras são baseados no  valor do produto no mercado internacional e na taxa de câmbio. Na  sexta-feira, o...
Só hoje: AME oferece 15% de volta nos postos BR|Tudo em Tecnologia|07/03/2021|Após esse processo, para conseguir o cashback nos postos Petrobrás basta  seguir apenas alguns passos. Primeiro, procure no aplicativo quais postos  estão...
STF decide que Petrobras não precisa se submeter à Lei das Licitações|Agência Brasil|08/03/2021|Por 6 votos a 4, o Supremo Tribunal Federal (STF) decidiu que a Petrobras  não precisa se submeter aos procedimentos de contratação na administração  pública...
Estrangeiros saem da Bolsa brasileira após intervenção de Bolsonaro na Petrobras|Folha|08/03/2021|A intervenção do presidente Jair Bolsonaro (sem partido) na Petrobras  impulsionou a saída de R$ 6,784 bilhões em investimento estrangeiro da  Bolsa...
Como seria o Brasil de Guedes, sem BNDES, Petrobras, Caixa e BB|Carta Capital|08/03/2021|Como seria o Brasil de Guedes, sem BNDES, Petrobras, Caixa e BB. Sem  estatais estratégicas, retomar um projeto de nação é mais difícil, escreve  Carlos Drummond.
Brasil vende litro de gasolina para a Bolívia por R$ 1,59 ...|Focus.jor|08/03/2021|De acordo com a Petrobras, o preço para a empresa boliviana Yacimientos  Petrolíferos Fiscales Bolivianos (YPBF) acontece devido à tributação que a  gasolina...
Bolsonaro multiplica por 10 número de militares no comando de estatais|Yahoo Finanças|08/03/2021|RIO DE JANEIRO, RJ (FOLHAPRESS) - Quando o general Joaquim Silva e Luna  assumir a presidência da Petrobras, o número de militares na cúpula das  maiores...
ConJur - André Rocha: Os incentivos adequados ao ...|Consultor Jurídico|08/03/2021|... sediada em Mônaco e que fornece plataformas de petróleo à Petrobrás.  ... propina a executivos da Petrobras em troca de contratos com a  petroleira.
Família de morador morto no Morro dos Macacos pede justiça|Band|08/03/2021|Valmir Pereira Cândido era funcionário de uma empresa que presta serviços  para a Petrobras, e estava de folga quando foi atingido, neste sábado  (6),...
3R Petroleum fecha parceria com DBO para aquisições de ...|ISTOÉ DINHEIRO|08/03/2021|Especializada em ativos de petróleo maduros, que demandam recuperação de  produção, a 3R tem competido por ativos colocados à venda pela Petrobras.
Potencial de voto de Lula é 12% maior do que de Bolsonaro ...|Brasil de Fato|08/03/2021|Petroleiros entram no segundo dia de greve por melhores condições na  Petrobras :: A pesquisa também avalia os segmentos em que os candidatos têm  mais apoio.
Governo Bolsonaro rejeitou 70 milhões de doses da Pfizer ...|ISTOÉ Independente|08/03/2021|Ministro de Minas e Energia quer mudar toda a Petrobras, diz Bolsonaro ...  Privatizar Petrobras levaria ao menos 4 anos, diz Bolsonaro.
Sonia Villalobos quer reaproximar estatal e mercado|Valor Econômico|10/03/2021|Sonia foi conselheira da Petrobras de maio de 2018 até julho de 2020,  eleita por acionistas detentores de ações preferenciais.
Preço da gasolina tem aumento pela 6ª vez no ano: R$ 6 o litro já é realidade?|Autoesporte|10/03/2021|A Petrobras informou na última segunda-feira (08) que realizará um novo  reajuste de 8,8% no valor da gasolina e 5,5% no valor do diesel pago  pelos...
Gasolina deve ficar mais cara em postos do DF; é o 6° reajuste da Petrobras em 2021|G1|10/03/2021|Com novo reajuste aplicado pela Petrobras nas refinarias, a gasolina deve  ficar ainda mais cara em postos do Distrito Federal. O preço médio de venda  do...
Com novo aumento, preço da gasolina passa de R$ 5,20 em São Carlos|ACidadeON|10/03/2021|Segundo a Petrobras, o alinhamento do preço das refinarias aos do mercado  internacional, o que também torna o preço sensível valor do real perante o  dólar,...
Deltan queria que dinheiro da Petrobras fosse para os EUA ...|Consultor Jurídico|10/03/2021|Um dos áudios (escute no final do texto) mostra o procurador Deltan  Dallagnol defendendo que recursos da Petrobras, empresa investigada no  Brasil e nos...
STF decide que a Lei de Licitações não se aplica à Petrobras|Diário do Poder|10/03/2021|Por maioria de votos, o Plenário do Supremo Tribunal Federal (STF), decidiu  que a Petrobras não está sujeita às normas para licitações previstas na  Lei...
Petrobras: não precisava ser insider para ganhar com queda da ação|InfoMoney|10/03/2021|Petrobras: não precisava ser insider para ganhar com queda da ação.  Estratégias de derivativos permitem apostar na queda e na alta ao mesmo  tempo, sem arriscar...
Fundos do Banco Clássico indicam Leonardo Antonelli para ...|CanalEnergia|10/03/2021|A Petrobras informou em comunicado ao mercado que recebeu carta do Fundo de  Investimento em Ações Dinâmica Energia e Banclass Fundo de Investimento em  Ações...
Gasolina sobe 8,65% no ano, e litro do combustível já supera R$ 5 em 20 estados|CNN Brasil|10/03/2021|Um avanço que está relacionado aos anúncios de aumento dos preços feitos  pela Petrobras no período, que por sua vez segue uma política baseada no  mercado...
Petrobras realiza parada programada de refinaria em Cubatão até abril|Noticias R7|10/03/2021|RIO DE JANEIRO (Reuters) - A Petrobras iniciou parada programada da  Refinaria Presidente Bernardes (RPBC), em Cubatão (SP), até abril, mas as  entregas de...
Governo indica duas mulheres para Conselho de Administração da Petrobras|O Globo|11/03/2021|RIO — A Petrobras disse em comunicado nesta quarta-feira que recebeu ofício  do Ministério de Minas e Energia com mais duas indicações para seu Conselho  de...
Quem estiver comprando “coisas da Petrobras” é melhor ter medo, diz Lula|InfoMoney|11/03/2021|Quem estiver comprando “coisas da Petrobras” é melhor ter medo, diz Lula. O  ex-presidente, porém, minimizou as preocupações levantadas pelo mercado  financeiro...
A Petrobras, a governança e o Estado de Direito|Consultor Jurídico|11/03/2021|A Petrobras e sua governança corporativa motivaram a publicação de diversos  artigos por mim redigidos e publicados neste espaço ao longo dos últimos  anos.
Isenção de tributos no gás ainda não chegou aos consumidores; distribuidoras apontam falta de repasse da Petrobras|G1|11/03/2021|Repasse não ocorre porque, ao emitir a nota fiscal, Petrobras não sabe qual  volume de gás será envasado – apenas botijões de 13 kg são isentos. Por G1.  10/03/...
Lula ataca privatizações e Guedes e defende Petrobras e investimentos públicos|iG Economia|11/03/2021|Lula ataca privatizações e Guedes e defende Petrobras e investimentos  públicos. Ex-presidente discursou hoje em São Bernardo do Campo, no  Sindicato dos...
Mudança na política de biodiesel opõe indústria de óleos vegetais e Petrobras|Revista Globo Rural|11/03/2021|Uma consulta pública de interesse da Petrobrás aberta no ano passado pela  Agência ... Segundo Amaral, a inclusão da tecnologia da Petrobras no  mandato de...
Região Sul de BH já paga R$ 6,24 pelo litro da gasolina comum; veja vídeo|Estado de Minas|11/03/2021|Após a Petrobras anunciar mais um reajuste nas refinarias, o sexto aumento  em 2021, o preço da gasolina disparou nos postos de combustível de Belo  Horizonte...
iNFRADebate: Nova Lei do Gás – um mercado de gás, finalmente?|Agência Infra|11/03/2021|Ela é a monopolista de fato que, historicamente, deteve os ativos de  produção, escoamento, refino e transporte. Hoje, a Petrobras responde pela  produção de...
ENTREVISTA-Reorganizada, Cosan foca subsidiárias e não descarta IPOs em 2021, diz CEO|UOL Notícias|11/03/2021|O grupo também tem interesse em ativos de refino que a Petrobras colocou à  venda, assim como comercializa produtos como o etanol cujos preços dependem  das...
‘Fundo de amortecimento’ pode reduzir em R$ 0,08 o litro da gasolina e do diesel|CNN Brasil|11/03/2021|Na última segunda feira, a Petrobrás anunciou mais um reajuste de  combustíveis em suas refinarias, o sexto no ano. A partir de ontem, a  gasolina ficou 9,2%...
Petrobras marca para 12 de abril assembleia que vai avaliar ...|Poder360|12/03/2021|A Petrobras informou, nesta 5ª feira (11.mar.2021), que a Assembleia Geral  Extraordinária que vai avaliar as trocas na presidência e no Conselho de...
Miriam Leitão defende Lula, desde que não mexa na política de preços da Petrobrás|Brasil 247|12/03/2021|A Petrobras investiu, cresceu e encontrou o pré-sal —os investimentos  começaram antes do governo petista — mas ao mesmo tempo foi no governo do  Partido dos...
Mudança na política de biodiesel opõe indústria de óleos ...|BiodieselBR.com|12/03/2021|Uma consulta pública de interesse da Petrobrás aberta no ano passado pela  Agência ... Segundo Amaral, a inclusão da tecnologia da Petrobras no  mandato de...
Preço da gasolina sobe pela sexta vez em 2021 - Revista ...|iCarros|12/03/2021|Petrobrás também anuncia quinto aumento do diesel no ano; alterações nos  preços já estão valendo nas refinarias e postos.
'Quanto mais livre for o mercado, melhor', afirma Rodolfo Saboia|ISTOÉ DINHEIRO|12/03/2021|Segundo ele, o fato de o presidente indicado para a Petrobras ser um  militar não é motivo para mudar a relação da agência com a estatal.
Dividendos das estatais também são receitas públicas|JOTA|12/03/2021|... economia em decorrência de fatos de gestão que envolveram importantes  empresas estatais brasileiras, como a Petrobras, Eletrobras e o Banco do  Brasil.
Ocyan obtém contrato de manutenção e serviços para as ...|Portos e Navios|12/03/2021|A Ocyan conquistou um novo contrato com a Petrobras para atividades de  manutenção e serviços offshore nas plataformas de Merluza e Mexilhão, na  Bacia de...
Lançado Programa de Revitalização e Incentivo à Produção ...|Governo Federal|12/03/2021|Foto: Petrobras. O Programa de Revitalização e Incentivo à Produção de  Campos Marítimos (Promar), do Ministério de Minas e Energia, foi lançado  nesta...
Eneva avalia projetos para concorrer em futuros leilões de energia|Valor Econômico|12/03/2021|Além disso, a companhia também está em negociações com a Petrobras para a  compra do campo de Urucu, na mesma bacia. “Com a possível conclusão da  aquisição,...
Preço do etanol chega a R$ 4,19 em postos de Ribeirão Preto|ACidadeON|12/03/2021|"Reajuste foi feito após a Petrobras anunciar o 6º aumento da gasolina em  2021. Da reportagem | ACidadeON/Ribeirao - 11/3/2021 09:49..."
Doria pretende convidar Castello Branco, da Petrobras, para ser CEO da Sabesp|CNN Brasil|13/03/2021|Doria pretende convidar Castello Branco, da Petrobras, para ser CEO da  Sabesp. Governador de São Paulo estuda nome do executivo substituído pelo  presidente Jair...
Petrobras eleva teto para salários do alto escalão para R$ 47 milhões|Exame|13/03/2021|"A política salarial da estatal foi criticada pelo presidente Jair Bolsonaro  no dia 22 de fevereiro: ""Alguém sabe quanto ganha o presidente da  Petrobras? Alguém..."
Gasolina bate R$ 8,20 em cidade no Acre após sexto aumento da Petrobras|iG Economia|13/03/2021|Gasolina bate R$ 8,20 em cidade no Acre após sexto aumento da Petrobras.  Marechal Thaumaturgo (AC), perto da fronteira com o Peru, registrou esse  preço no dia...
Ação da PetroRio se destaca cada vez mais em meio à turbulência na Petrobras, mas ela tem espaço para novas altas?|InfoMoney|13/03/2021|Isso depois da forte fuga dos investidores da Petrobras (PETR3;PETR4) em  meio à mudança repentina no comando da companhia, decorrente da  insatisfação do...
Dolarização é a vilã dos combustíveis|GZH|13/03/2021|Embora Bolsonaro tenha anunciado a troca na presidência da Petrobras,  substituindo Castello Branco pelo general Joaquim Silva e Luna, a simples  dança das...
Ações da Copel sobem com reforma de estatuto; varejistas caem até 5% com dados de varejo e Vale e Petrobras recuam|InfoMoney|13/03/2021|Os papéis da Petrobras (PETR3, R$ 22,70, -1,09%; PETR4, R$ 23,17, -0,52%),  que tiveram um alívio nas últimas três sessões com boas indicações ao  Conselho e...
Lobo-marinho vai de avião do Rio para Santa Catarina|Agência Brasil|13/03/2021|Os projetos de monitoramento de praias são estruturados e executados pela  Petrobras. O objetivo é o atendimento de condicionante do licenciamento  ambiental...
Pessoas dormem na fila para comprar gás com desconto em ...|A Gazeta|13/03/2021|O preço médio de venda de GLP da Petrobras para as distribuidoras é de R$  3,05...
PGR recorre de decisão de Fachin que anulou condenações de Lula|Agência Brasil|13/03/2021|Na decisão, Fachin afirmou que as acusações da força-tarefa da Lava Jato  contra Lula não estão relacionadas diretamente com os desvios na  Petrobras,...
Crime organizado drena bilhões de postos de combustíveis no Brasil|Exame|13/03/2021|O clássico logotipo verde e amarelo da companhia que remete à Petrobras é  presença constante nas pequenas e grandes cidades do país.
Petrobras: Mandatos de diretores serão estendidos até eleição de novo presidente|CNN Brasil|14/03/2021|A Petrobras informou na noite de sexta-feira (12), que o mandato da  diretoria executiva será estendido automaticamente até que o conselho de  administração...
Preço do gás de cozinha sobe 2,3% em uma semana chega a R$ 113 na região Norte|CNN Brasil|14/03/2021|A alta do preço do gás de cozinha no início de março nas refinarias da  Petrobras fez o produto ficar em média 2,3% mais caro para o consumidor  final (R$ 83...
PGR recorre da decisão de Fachin que anulou condenações ...|Canal Ciências Criminais|14/03/2021|... de recursos da Petrobras ou de demais órgãos da administração pública.  ... uma vez que possuem vínculos com os delitos praticados contra a  Petrobras:.
"Coluna | Nosso destino era o petróleo e se acabou"|O Globo|14/03/2021|A Petrobrás se defendia dizendo que, apesar do crescimento absoluto, havia  uma queda ... Passada uma década, a Petrobras de fato se tornou a segunda  maior...
Sem petrolão, não há crimes de Lula em tríplex e sítio, e sim possível improbidade, dizem especialistas|Folha|14/03/2021|Na decisão, Fachin argumentou que os delitos imputados ao ex-presidente não  correspondem a atos que envolveram diretamente a Petrobras e, por isso, a  Justiça...
MME informa que produção de petróleo diminuiu nos campos de Tupi e de Búzios, no mês de fevereiro|CPG Click Petroleo e Gas|14/03/2021|De acordo com o relatório de monitoramento semanal Covid-19 divulgado pelo  MME, as refinarias da Petrobras apresentaram queda no fator de utilização  no...
