title|media|date|desc
STF decide que ICMS não deve ser cobrado na extração do petróleo|O Globo|27/03/2021|Foto de arquivo de trabalhadores nas plataformas da Petrobras. Foto:  Steferson Faria/ 26/08/2008 / Divulgação. Receba notícias em tempo real no  app.
Canal de Suez pode ficar bloqueado até quarta-feira e ...|Seu Dinheiro|27/03/2021|Esqueça a Petrobras (PETR4): veja como lucrar com o último ciclo de alta do  Petróleo sem esbarrar em ruídos do risco-Brasil; entenda. Economia global.  De acordo...
SisGAAz - Navio-Patrulha “Guajará” apreende mais duas ...|DefesaNet|27/03/2021|Navio-Patrulha “Guajará” apreende mais duas embarcações pesqueiras nas  proximidades de Plataforma da Petrobras · Aviso de Patrulha “Anequim”  realiza Inspeção...
Ibovespa sobe 1%, mas fica abaixo dos 115 mil pontos; dólar avança quase 1%, a R$ 5,72|SpaceMoney|27/03/2021|Ibovespa avança 0,3%, com Petrobras (PETR4) e exterior no radar; dólar fica  estável, a R$ 4,75. 17h19 - 31 Mai 2022 · SpaceNow _deskTop.  Spacenow_mobile...
‘Em 2020, ano da pandemia da covid-19, ganhei R$ 45.000 com as operações indicadas’; veja como Bruno lucrou com a queda nos mercados|Money Times|27/03/2021|Uma operação do especialista em opções da Empiricus envolvendo a Petrobras  ficou bastante conhecida no mercado. (Imagem: Empiricus). (Imagem: Seu  Dinheiro)O que...
Valor do litro da gasolina comum mais barata cai para R$ 5 ...|Correio do Cidadão|27/03/2021|Assim, o custo médio para o guarapuavano girava em R$ 5,46, repetindo o  cenário de quarta (24), antes da nova redução praticada pela Petrobras.
Alvos de interferência do governo, três maiores estatais já perderam quase R$ 100 bilhões em valor de mercado neste ano|G1|28/03/2021|Petrobras, Eletrobras e Banco do Brasil amargam quedas na Bolsa em meio a  trocas de presidente e incertezas sobre o futuro dos negócios. Por Bianca  Lima e Luiz...
Suspeição de Moro abre brecha para o Estado ter de devolver ...|Gazeta do Povo|28/03/2021|Já Petrobras recuperou R$ 5,3 bilhões. Deste valor, o STF destinou R$ 1,6  bilhão para o combate à pandemia de coronavírus. Mais R$ 1 bilhão foi  designado...
Paulo Guedes toma primeira dose de vacina contra Covid-19|O Globo|28/03/2021|Quatro de oito diretores da Petrobras pedem para deixar estatal ·  Edifício-sede da Petrobras, no Centro do Rio Foto: Ricardo Moraes /  Reuters. Economia...
Lucro da Cemig mais que dobra no 4° trimestre com reversão de perdas por Light|Money Times|28/03/2021|Ibovespa: Por que Méliuz (CASH3) despencou 6,74% e Petrobras (PETR3) subiu  2,5% nesta sexta? ... Quer ficar por dentro de tudo que acontece no mercado  financeiro?
CVC reverte prejuízo e apresenta lucro ajustado de R$ 82,3 milhões no 4º trimestre|Money Times|28/03/2021|Últimas Notícias Cotações Comprar ou Vender FGTS Eletrobras Petrobras ·  Instagram · YouTube · Linkedin Facebook · Google Facebook Twitter.
Multinacional Sodexo com vagas de emprego de nível fundamental, técnico e superior para trabalhar no Rio de Janeiro, São Paulo, Macaé e mais, neste dia 27|CPG Click Petroleo e Gas|28/03/2021|querosene, petrobras, petróleo · Preço do querosene de aviação é elevado em  11% pela Petrobras por conta da alta no valor do petróleo.
Uma grande vitória da ciência|VEJA|28/03/2021|Deputado questiona ministério sobre currículo de indicado para a Petrobras.  Mais lidas. 1. Brasil. Nova pesquisa mostra Lula e Bolsonaro colados na  disputa...
Um ensaio sobre refino, combustíveis e a falácia da ...|Poder360|29/03/2021|A atual gestão da Petrobras anunciou a venda da Refinaria Landulpho Alves  (RLAM), na Bahia, para o Fundo Mubadala, de Abu Dhabi, faltando cerca de 20  dias...
Pandemia derruba lucro de estatais e compromete dividendos da União|Folha|29/03/2021|Petrobras, Banco do Brasil, Caixa, Eletrobras e BNDES —que respondem por  mais de 90% dos dividendos pagos à União— terminaram a publicação de seus  balanços...
Gasolina acumula aumento de 23,5% entre janeiro e março no RS|GZH|29/03/2021|A alta acumulada em 2021 pode ser atribuída a um conjunto de fatores. Na  hora de definir os valores dos combustíveis nas refinarias, a Petrobras  leva em...
Prefeitura de Tibau do Sul vacina comunidade quilombola de ...|Agora RN|29/03/2021|Conselho do PPI aprova incluir Petrobras em estudos para privatização  Petrobras eleva em 11,4% preço médio da querosene de aviação Mãe de  Michael,...
Setor de tecnologia terá 'crescimento exponencial' nos próximos 5 anos, diz consultoria|Suno|29/03/2021|Ibovespa fecha em queda e perde 0,75% na semana; Petrobras (PETR4) sobe  1,75% no dia · Petrobras (PETR4) e Eletrobras (ELET3) são destaques do  mercado.
Motor 1.0 rende o mesmo que um 1.8! É possível?|AutoPapo|29/03/2021|Bom dia..eexatamente isso porque a Estatal Petrobras quer ser Única e  alguns Políticos Roubam. E o Povo paga … outra coisa cadê a nova gasolina  com mais...
Petrobras demite gerente de RH por negociações às vésperas do balanço|Exame|30/03/2021|Homem de confiança do presidente da Petrobras, Roberto Castello Branco, o  gerente executivo de Recursos Humanos da empresa, Claudio Costa, foi  demitido...
Crise de confiança gera descompasso entre ações da Petrobras e petróleo|Valor Econômico|30/03/2021|O desgaste em torno da Petrobras começou na virada entre janeiro e  fevereiro com críticas de parte do mercado sobre a defasagem entre os  preços de combustíveis...
Petrobras volta a ter militar no comando depois de 30 anos|O TEMPO|30/03/2021|Após três décadas, a Petrobras voltará a ser comandada por um militar.  Indicado pelo presidente Jair Bolsonaro, o general da reserva do Exército  Joaquim...
Incêndio atinge dois vagões com combustível perto da Replan, a refinaria da Petrobras em Paulínia|G1|30/03/2021|Chamas foram controladas e Petrobras informou que produção não foi afetada.  Por G1 Campinas e Região. 29/03/2021 11h56 Atualizado há um ano...
Notícias da UFSC|Notícias da UFSC|30/03/2021|... ministrada por Leila Valladares Heitich, engenheira de  equipamentos/inspeção do Departamento de Área Submarina – Sistemas de  Ancoragem da Petrobras.
Gás de cozinha chega a R$ 120 no Centro-Oeste mesmo sem imposto federal|CNN Brasil|30/03/2021|Segundo a Petrobras, os impostos do gás de cozinha e do diesel já estão  sendo zerados na hora da compra nas refinarias. No caso do gás de cozinha,  a...
Preço do etanol cai nos postos da maior parte dos Estados em uma semana, diz ANP|Valor Investe|30/03/2021|O movimento acompanhou os preços da gasolina nas bombas, que começaram a  sentir o repasse feito pela Petrobras. Por Camila Souza Ramos, Valor — São  Paulo.
Projeto amplia pena para roubo de combustível em dutos e ...|Câmara dos Deputados|30/03/2021|A Petrobras, por exemplo, relatou que em 2018 foram registradas 261  ocorrências de desvios clandestinos nos dutos da Transpetro, subsidiária da  companhia.
Raízen escolhe BTG, Bank of America, Citi e Credit Suisse para liderar IPO|Money Times|30/03/2021|Fica atrás apenas de Petrobras (PETR4), Vale(VALE3) e JBS (JBSS3).  Procurados pela Reuters, a Raízen e os bancos não comentaram o assunto.
Secretária de Educação Básica do MEC pede demissão|Exame|30/03/2021|Petrobras gasta R$ 1,3 milhão cada vez que governo troca seu presidente.  Petrobras recebe documentos e já analisa nome de Paes de Andrade. Economia.
Petrobras (PETR4) confirma demissão por suposto insider trading|Suno|31/03/2021|A Petrobras (PETR4) confirmou na noite desta segunda-feira (29) a demissão  do seu gerente-executivo de recursos humanos, Cláudio da Costa, por  utilização de...
Com piora da pandemia, Petrobras adia manutenção de ...|A Gazeta|31/03/2021|Com piora da pandemia, Petrobras adia manutenção de plataforma no ES.  Empresa vai postergar a parada programada da P-58, atividade que exigiria  aumentar o...
Produção de petróleo na Bacia de Campos cai ao menor volume do século, diz Ineep|CNN Brasil|31/03/2021|Deste total, 607 mil bpd foram extraídos pela Petrobras, segundo dados  divulgados pela empresa e compilados pelo Instituto de Estudos Estratégicos  de...
Covid Petrobras: petroleiros denuncia surto em plataforma no ...|UOL Economia|31/03/2021|A causa da redução drástica de pessoal seria o surto de covid-19 registrado  na plataforma no fim da semana passada. Em resposta, a Petrobras diz que  ocorreram...
Abicom vê defasagem média de 8% no preço da gasolina e cobra aumento da Petrobras|Mercado e Consumo|31/03/2021|... que espera que a Petrobras anuncie em breve um novo aumento. Em portos  como o de Itaqui, no Maranhão, a defasagem chega a 10%, segundo o executivo.
Vagões carregados com combustível incendiaram ontem (29) perto da Replan, a refinaria da Petrobras em Paulínia|CPG Click Petroleo e Gas|31/03/2021|Os vagões estão no sentido de Paulínia para Campinas, enquanto que a  refinaria da Petrobras fica no lado oposto. A Rumo Logística disse que as  chamas começaram...
Gasolina a 'preço justo' ao consumidor seria de R$ 3,60 ...|Amazonas Atual|31/03/2021|MANAUS – O litro da gasolina no Brasil pode ser vendido a R$ 3,60, se  houver mudança na política de precificação da Petrobrás, aponta estudo  elaborado pelo...
Após a zeragem dos impostos federais PIS e Cofins, preço do gás de cozinha atinge 120 reais|CPG Click Petroleo e Gas|31/03/2021|Petrobras informa que os impostos PIS e Cofins do gás de cozinha e do  diesel já estão sendo zerados na hora da compra nas refinarias. No caso do  gás de...
Agora vai? Secretário promete privatizações e bilhões em imóveis ainda em 2021|CNN Brasil|31/03/2021|Segundo ele, nem mesmo as interferências do governo em estatais como a  Petrobras e o Banco do Brasil tiraram o apetite dos investidores.
Fundos da Petros voltam a superávit após nove anos|Valor Econômico|31/03/2021|Segundo maior fundo de pensão do país, a fundação Petros, dos funcionários  da Petrobras, fechou ontem o primeiro resultado positivo em nove anos para  os...
