title|media|date|desc
Reconhecimento facial deve ser banido, diz regulador de ...|ISTOÉ DINHEIRO|24/04/2021|PPI aprova inclusão de Petrobras na carteira para de estudos de  privatização ... PPI aprova inclusão de Petrobras na carteira para de  estudos de...
Yara visa mais retorno aos acionistas apesar de lucro menor que o esperado|Money Times|24/04/2021|Últimas Notícias Cotações Comprar ou Vender FGTS Eletrobras Petrobras ·  Instagram · YouTube · Linkedin Facebook · Google Facebook Twitter.
Confaz indica projeção do preço da gasolina em até R$ 6,23, o litro|Metrópoles|24/04/2021|... Mercadoria e Serviços (ICMS) retido pela Petrobras no ato da venda dos  combustíveis aos postos de gasolina, o que impacta no valor praticado na  bomba.
Silva e Luna diz a conselho da Petrobras que vai manter venda de ativos|CNN Brasil|25/04/2021|Ao oficializar a sua entrada na presidência da Petrobras, há uma semana, o  general da reserva Joaquim Silva e Luna fez um discurso para o conselho  de...
Acordo pode direcionar verba de multas do Ibama para a Força Nacional|O Globo|25/04/2021|RIO — O Ibama e a Petrobras negociam um acordo para que o pagamento de nove  multas impostas à empresa, cujo valor supera R$ 58,3 milhões, seja  integralmente...
'Não vejo problema em aliança fora do nosso campo', diz Gleisi Hoffmann, presidente do PT|O Globo|25/04/2021|Em entrevista ao GLOBO, Gleisi nega que tenha havido corrupção do PT na  Petrobras e diz que meio ambiente deve entrar em programa à Presidência em  2022...
Pedro Parente, da EB Capital: “Precisamos de um capitalismo ...|Exame|25/04/2021|Ex-presidente da Petrobras e da BRF afirma que é possível conciliar a  realização de lucros com a eliminação de lacunas sociais no país. Só falta  vontade.
IPO: a onda gigante que cresce no mundo dos investimentos|Os Divergentes|25/04/2021|A cifra supera o recorde de 2019, quando o volume de emissões foi de R$ 90  bilhões e perde apenas para 2010, quando houve a megacapitalização da  Petrobras.
Grão de ouro, produtores enfrentam uma época de grandes desafios para o milho|Money Times|25/04/2021|Últimas Notícias Cotações Comprar ou Vender FGTS Eletrobras Petrobras ·  Instagram · YouTube · Linkedin Facebook · Google Facebook Twitter.
Salles pede recomposição de R$ 270 milhões no orçamento do Meio Ambiente|Exame|25/04/2021|Sem documentação, Petrobras ainda não analisou indicação de novo CEO.  Bolsonaro nega interferência na Petrobras mesmo após demissões seguidas.  Brasil.
Alívio fiscal para combustíveis favorece inovação e reduz corrupção|Exame|25/04/2021|Petrobras lança site sobre preço do combustível e diz ser responsável  apenas por uma parte do. Minhas Finanças. Há 5 horas • 3 min de leitura...
YouTube bloqueia acesso a canais de TV ucranianos ligados a aliado do Kremlin, diz governo da Ucrânia|Money Times|25/04/2021|Ibovespa: Por que Méliuz (CASH3) despencou 6,74% e Petrobras (PETR3) subiu  2,5% nesta sexta? Leia mais sobre: Empresas, EUA, Otan, Redes Sociais,  Reuters,...
ETFs de ESG são mais rentáveis e demanda deve continuar a crescer|Suno|25/04/2021|Ibovespa fecha em queda e perde 0,75% na semana; Petrobras (PETR4) sobe  1,75% no dia · Petrobras (PETR4) e Eletrobras (ELET3) são destaques do  mercado.
Lula será julgado em foro no qual já foi duas vezes absolvido|CNN Brasil|26/04/2021|... nos processos vinculados ao esquema de desvios na Petrobras. Ao anular  duas condenações de Lula, Fachin evitou a nulidade total dos processos,...
Praias do RN são tomadas por lixo com seringas e ampolas com sangue|Diário do Poder|26/04/2021|Moro acha 'risível' PT culpar juiz e não o ladrão por prejuízo na Petrobras  ... Ministro Sachsida substitui presidente da Petrobras a pedido de  Bolsonaro.
Privatizações: um argumento esquecido|Economia & Negócios|26/04/2021|Um exemplo extremo é o do escândalo de corrupção na Petrobrás, no qual o  “principal” buscava recursos para “retribuir” o apoio dado pelos partidos  aliados...
Maior trading de café vê demanda mais fraca por novos lockdowns|Money Times|26/04/2021|Últimas Notícias Cotações Comprar ou Vender FGTS Eletrobras Petrobras ·  Instagram · YouTube · Linkedin Facebook · Google Facebook Twitter.
Banco Safra compra braço de gestão de recursos do Crédit Agricole no Brasil|Money Times|26/04/2021|Ibovespa: Por que Méliuz (CASH3) despencou 6,74% e Petrobras (PETR3) subiu  2,5% nesta sexta? Leia mais sobre: Banco Safra, Bancos, Empresas, Reuters.  Última...
Máscaras do Japão: os enigmas de uma sociedade do outro lado do mundo|Money Times|26/04/2021|Últimas Notícias Cotações Comprar ou Vender FGTS Eletrobras Petrobras ·  Instagram · YouTube · Linkedin Facebook · Google Facebook Twitter.
Novo marco para ferrovias promete destravar R$ 25 bi em investimentos|Correio Braziliense|26/04/2021|Petrobras manterá preços de mercado, garante presidente da estatal. 11:32 -  06/05/2022 - Compartilhe. Cookie Policy. Utilizamos cookies essenciais e...
Café Apuí criou um site próprio para ampliar negócio|Economia & Negócios|26/04/2021|Bolsonaro demite o terceiro presidente da Petrobras com pouco mais de 40  dias no cargo · Petrobras: Demissão de Coelho vai levar a mudanças no  conselho e na...
Petrobras pagará dividendos em 29 de abril|Valor Investe|27/04/2021|A Petrobras comunicou ao mercado que pagará em 29 de abril os dividendos  relativos a 2020. O valor será corrigido pela taxa Selic no período entre  31 de...
Na 13ª condenação na Lava Jato, Renato Duque recebe pena de 30 anos de prisão por corrupção|G1|27/04/2021|Ex-diretor de Serviços da Petrobras, que deixou a cadeia há mais de um ano,  deverá cumprir pena em regime fechado. Justiça Federal determinou reparação  de...
Keppel está na fase final das negociações com a Petrobras para construir FPSO P-78 no campo de Búzios, no pré-sal da Bacia de Santos|CPG Click Petroleo e Gas|27/04/2021|A Keppel Corporation, de Cingapura, afirmou em uma atualização de negócios  que está negociando com a Petrobras para a construção da plataforma FPSO  P-78 no...
"Vale divulga balanço em meio a mudanças no conselho e ""boom"" do ferro"|Exame|27/04/2021|Assim como a Petrobras, as ações da companhia têm um forte peso no  Ibovespa. A Vale está avaliada atualmente em 500 bilhões de reais.
Herdeiro tenta barrar, na Justiça, IPO da Boa Safra Sementes|Monitor do Mercado|27/04/2021|Conselho do PPI aprova incluir Petrobras em estudos para privatização ·  Petrobras eleva em 11,4% preço médio da querosene de aviação.
Cada um com sua agonia: em SP, governador Doria encara duas CPIs|Diário do Poder|27/04/2021|Moro acha 'risível' PT culpar juiz e não o ladrão por prejuízo na Petrobras  ... Ministro Sachsida substitui presidente da Petrobras a pedido de  Bolsonaro.
Lira diz que não há razão para 95% dos pedidos de impeachment de Bolsonaro|Exame|27/04/2021|Comissão da Câmara convoca ministro da Justiça para explicar morte de  Genivaldo. Petrobras gasta R$ 1,3 milhão cada vez que governo troca seu  presidente.
Ações do Banco Inter renovam máxima histórica na B3|SpaceMoney|27/04/2021|Petrobras (PETR4) sai, Weg (WEGE3) entra: veja as 10 ações recomendadas  pela ... Petrobras (PETR4): conselho do PPI aprova incluir companhia em  estudos para...
Mistura de hidrogênio ao etanol promete revolucionar rendimento e reduzir o consumo de combustível nos motores flex|CPG Click Petroleo e Gas|27/04/2021|... Preço do etanol e da gasolina disparam, Petrobras aumenta GNV em 39% e  reajuste pode impactar ainda mais o bolso dos brasileiros nas próximas  semanas.
HASH11, primeiro ETF de criptomoedas do Brasil, fecha em alta de 12,93% em estreia na B3|Suno|27/04/2021|Ibovespa fecha em queda e perde 0,75% na semana; Petrobras (PETR4) sobe  1,75% no dia · Petrobras (PETR4) e Eletrobras (ELET3) são destaques do  mercado.
Petrobras deve voltar ao lucro no 1º trimestre de 2021 e ter receita de US$ 17,7 bi|Money Times|28/04/2021|A Petrobras (PETR4) deverá registrar um aumento nas receitas trimestrais  quando publicar seu balanço financeiro, em 13 de maio.
Ações da Petrobras caem mais de 2% e Soma recua 15% em dois dias; Vale sobe e Smiles tem queda após balanços|InfoMoney|28/04/2021|Ações da Petrobras caem mais de 2% e Soma recua 15% em dois dias; Vale sobe  e Smiles tem queda após balanços. Confira os destaques da B3 na sessão  desta terça-...
Vale é a empresa mais valiosa da América Latina e deixa Mercado Livre para trás|Valor Investe|28/04/2021|... considerando o universo das ações da bolsa brasileira, o valor de  mercado da Vale supera a marca de R$ 580 bilhões - quase o dobro da  Petrobras,...
Inmetro diz que orçamento para 2021 não permite fiscalizar combustíveis como quer Bolsonaro|O Globo|28/04/2021|Presidente cobrou fiscalização. Em fevereiro, um dia após anunciar a troca  de comando na Petrobras, Bolsonaro cobrou uma maior atuação do Inmetro e de  outros...
Com ação a R$ 110, Vale é a empresa mais valiosa da B3|Valor Econômico|28/04/2021|Valor supera a marca de R$ 580 bilhões, quase o dobro da Petrobras, segunda  maior empresa brasileira na bolsa. Por Lucas Hirata e Olívia Bulla, Valor —  São...
Gleisi Hoffmann nega que houve corrupção do PT na Petrobras|Pleno.News|28/04/2021|Gleisi Hoffmann, deputada federal e presidente do PT, afirmou não concordar  que houve corrupção na Petrobras durante os governos do PT.
Copel doa 217 cilindros de oxigênio para tratamento da Covid ...|Correio do Cidadão|28/04/2021|Além dos cilindros da Copel, a Secretaria da Saúde também recebeu a doação  de 100 novos cilindros adquiridos pela Petrobras. Cada unidade tem  capacidade de...
Equinor contrata sonda da Seadrill para desenvolver ...|EPBR|28/04/2021|Mais mercado offshore: Suspensa pela Petrobras, MODEC foi líder isolada do  mercado de FPSOs. Em novembro do ano passado, a Equinor contratou Baker  Hughes,...
Orquestra Petrobras Sinfônica apresenta 1ª Edição do Festival Música que Transforma|O Dia|28/04/2021|Orquestra Petrobras Sinfônica apresenta 1ª Edição do Festival Música que  Transforma. Festival conta com workshops, masterclasses, palestras e  mesas-redondas...
Venda de gasolina cai 16,4% com avanço da pandemia|UOL Economia|28/04/2021|Com paradas de manutenção em algumas refinarias da Petrobras, e a queda de  consumo de gasolina pelo isolamento social, as refinarias da estatal  estão...
Cade prorroga prazos para venda de refinarias e empresas ...|EPBR|29/04/2021|RIO — O Conselho Administrativo de Defesa Econômica (Cade) prorrogou pela  segunda vez, nesta quarta (28), os prazos para a Petrobras vender as suas...
Petrobras ganha mais tempo para vender refinarias, decide Cade|VEJA|29/04/2021|A Petrobras acaba de ganhar mais tempo para vender refinarias e ativos no  mercado de gás natural. O Tribunal do Cade, Conselho Administrativo de  Defesa...
Petrobras ganha mais prazo do Cade para vender ativos de ...|Poder360|29/04/2021|Petrobras ganha mais prazo do Cade para vender ativos de refino e gás · Até  30.abr.2021 para a venda da transportadora de gás Nova Transportadora do  Sudeste (NTS)...
Petrobras (PETR4) conclui venda da NTS por R$ 1,8 bilhão|Eu Quero Investir|29/04/2021|A Petrobras (PETR4) informou nesta quarta (28) que o Conselho de  Administração aprovou a venda de sua participação remanescente de 10% na  Nova...
Petrobras refuta rota única para biodiesel, quer lançar 'diesel ...|ISTOÉ DINHEIRO|29/04/2021|Por Marta Nogueira. RIO DE JANEIRO (Reuters) – A Petrobras refuta a ideia  de que há apenas uma forma de se produzir biodiesel, afirmou nesta  quarta-feira o...
Queda nas vendas pode pesar no balanço da Petrobras, diz Credit Suisse|Valor Investe|29/04/2021|Queda nas vendas pode pesar no balanço da Petrobras, diz Credit Suisse. O  banco deu como destaque negativo a queda sequencial de 6% das vendas de  derivados no...
Juíza suspende decisão arbitral que poderia custar R$ 166 bi ...|Consultor Jurídico|29/04/2021|O Estatuto da Petrobras não tem dispositivo amplo o suficiente para  permitir que o ente público se sujeite a arbitragem em quaisquer situações  e sem seu...
Petrobras escolhe start-up para acompanhar saúde dos funcionários em home office|Blogs|29/04/2021|Em meio à mudança de gestão na Petrobras, com a chegada do general Joaquim  Silva e Luna, que pretende reavaliar o modelo de home office em maio, a  start-up...
Mineradora Vale é a empresa mais valiosa da América Latina e equivale a quase 2 Petrobras|InfoMoney|29/04/2021|Entre o “top 10” da região, o Brasil lidera com cinco empresas. Completam a  participação nacional nesse ranking a Petrobras (PETR4; US$ 56,9 bilhões),  o Itaú...
Petrobras (PETR3/PETR4) e Alphabet (GOGL34): ações para ...|UOL Economia|29/04/2021|Vamos analisar os resultados corporativos divulgados pela Cielo (CIEL3) e  pela Alphabet, dona da Google (GOGL34), e os números de produção da  Petrobras...
Petrobras garante Atapu e Sépia|EPBR|30/04/2021|— Com isso, a companhia poderá garantir a operação e ao menos 30% dos  contratos de partilha dos campos. — E para o governo, confirmando os lances  da Petrobras,...
"Artigo | Pelo fim da política de paridade com os preços de ..."|Brasil de Fato|30/04/2021|A política foi iniciada, em 2016 por Pedro Parente, ex-presidente da  Petrobras, praticando preços de paridade internacional.
Petrobras fecha venda da NTS para fundo gerido por Brookfield e Itaúsa|InfoMoney|30/04/2021|O conselho de administração da Petrobras (PETR3;PETR4) aprovou nesta  quarta-feira a venda da participação remanescente de 10% que a estatal  possui na Nova...
Realização de lucros sobre bancos e Petrobras faz Ibovespa ...|ISTOÉ DINHEIRO|30/04/2021|Por Aluisio Alves. SÃO PAULO (Reuters) – Um movimento mais abrangente de  realização de lucros alvejou ações de Petrobras e de bancos, praticamente  zerando...
Cade confirma que Innova terá que voltar para Petrobras ou ...|Jornal do Comércio|30/04/2021|Cade confirma que Innova terá que voltar para Petrobras ou ser vendida a  terceiros. Companhia produz resinas termoplásticas em Triunfo.  INNOVA/DIVULGAÇÃO/JC.
Reajuste de 39% do GNV nas distribuidoras é adiado no Rio|O Dia|30/04/2021|Nesta quinta-feira, a Agência Reguladora de Energia e Saneamento Básico do  Estado do Rio (Agenersa) informou ao O DIA que, embora previsto pela  Petrobras,...
Governo de Mato Grosso do Sul suspende a desestatização ...|Portal MS|30/04/2021|A decisão de não privatizar parte da companhia se origina diante de uma  série de incertezas de mercado, como a saída da Petrobras da área de  transporte e...
Vale é única empresa da América Latina avaliada em mais de US$ 100 bi. Veja lista das mais valiosas|O Globo|30/04/2021|Seu valor de mercado é quase o dobro da Petrobras. Itaú Unibanco, Ambev e  Bradesco completam, nessa ordem, as cinco maiores empresas brasileiras em  valor de...
Pintou novidade! Veja a evolução dos patrocinadores na camisa do Flamengo|O Dia|30/04/2021|"A partir de 2006, a Petrobras também passou a estampar outras marcas nas  mangas da camisa do Flamengo. O ""Cartão Petrobras"" ficou um tempo no  espaço..."
PGE apoia evento que discutirá estudos de casos no Direito ...|Portal do Governo de Mato Grosso do Sul -|30/04/2021|A Petrobras retomou ontem (31) por meio de oportunidade de negócio (teaser)  a venda da Unidade de Fertlizantes Nitrogenados III em Três Lagoas (UFN3).  Para a...
