title|media|date|desc
TCU diz que Petrobrás vendeu refinaria a preço abaixo do ...|BiodieselBR.com|02/04/2021|TCU diz que Petrobrás vendeu refinaria a preço abaixo do mercado e avalia  ... da venda da Refinaria Landulpho Alves (Rlam) pela Petrobrás ao  Mubadala,...
TCU avalia barrar venda de refinaria da Petrobras para fundo árabe|Folha|02/04/2021|Demitido da presidência da Petrobras por divergências com Jair Bolsonaro,  Roberto Castello Branco explicou aos funcionários em uma carta de despedida  que o...
Venda de refinaria da Petrobras na Bahia pode ser suspensa, diz TCU|CPG Click Petroleo e Gas|02/04/2021|A Refinaria Landulpho Alves, na Bahia, foi vendida pelo valor de US$ 1,65  bilhão pela Petrobras. Segundo o TCU, esse valor estaria abaixo do preço  de...
Petrobras aumenta gás de cozinha em 5% para as distribuidoras|CNN Brasil|02/04/2021|Petrobras aumenta gás de cozinha em 5% para as distribuidoras. O valor  passará a ser de R$ 3,21 por quilo, com um aumento médio de R$ 0,15 por  quilo; mudança...
Ex-gerente da Petrobras acusado de manipular mercado recorre contra estatal|iG Economia|02/04/2021|O ex-gerente executivo de Recursos Humanos (RH) da Petrobras, Claudio  Costa, protocolou petição na Comissão de Valores Mobiliários ( CVM )...
Balança comercial tem superávit de US$ 1,482 bilhão em março|Agência Brasil|02/04/2021|Até meados da década passada, o Brasil registrava em subsidiárias da  Petrobras no exterior plataformas de petróleo que na prática jamais saíam  do país.
Lucro das empresas de capital aberto dobra no 4º tri, mas despenca 40% no ano|CNN Brasil|02/04/2021|Mas se colocarmos Vale e a Petrobras na lista, a queda de lucratividade em  2020 chega a “apenas” 41,2%. Quando as instituições financeiras são levadas  em conta,...
TCU tem 5 dias para avaliar suspensão da venda de refinaria|Noticias R7|02/04/2021|"""Recebi Ofício do Subprocurador-Geral, Lucas Rocha Furtado, ressaltando a  recente decisão do conselho de administração da Petrobras em vender a  Rlam..."
Ibeps avalia que preço justo da gasolina seria de R$ 3,60|Repórter Diário|02/04/2021|“A gente não daria prejuízo para a Petrobras, ela deixaria de ganhar mais  dinheiro, mas ainda mantendo a empresa com um lucro muito acima do mercado,  fecharia...
Preço médio da gasolina sobe quase 11% em março nos postos do Brasil, diz ValeCard|Money Times|02/04/2021|O cenário de preços em alta nos postos vem com o impulso de reajustes  realizados ao longo do ano pela Petrobras (PETR4) nas refinarias do país,...
Ex-presidente da Petrobras segurou preços até saber de demissão, diz Guedes a site|Valor Investe|03/04/2021|A Petrobras vinha segurando os preços dos combustíveis até que o  ex-presidente da estatal, Roberto Castello Branco, ficou sabendo que seria  demitido.
Petrobras aumenta preço do GLP em quase 5%|G1|03/04/2021|A Petrobras aumentou em quase 5% o preço médio de venda do gás liquefeito  de petróleo (GLP) para as distribuidoras. O novo valor do gás de cozinha  começa a...
Petrobras aumenta gás de cozinha em 5% a partir de hoje|Extra Online|03/04/2021|A Petrobras vai aumentar o preço médio de venda do gás liquefeito de  petróleo (GLP) em 5% para as distribuidoras hoje. O quilo do gás liquefeito  de petróleo...
Petrobras anuncia reajuste no preço do gás de cozinha, 4º aumento do ano|Campo Grande News|03/04/2021|Petrobras anuncia reajuste no preço do gás de cozinha, 4º aumento do ano.  Estatal não informa a variação em porcentual, mas, segundo fontes do setor,  a alta de...
TCU vê preço baixo e ameaça suspender venda de refinaria da Petrobras na Bahia|Correio Braziliense|03/04/2021|Uma semana depois de a Petrobras assinar contrato com o novo dono - o fundo  de investimento Mubadala, dos Emirados Árabes -, o ministro Walton Alencar  pediu...
Açu vai construir parque de estocagem de petróleo de R$ 2,5 bilhões no Norte Fluminense|O Globo|03/04/2021|A Petrobras bateu recorde de exportação de petróleo em 2020, com expansão  de 33% sobre o ano anterior. PUBLICIDADE. A Prumo Logística vem trabalhando  para fazer...
Lula cogita privatização parcial de Furnas, Caixa Econômica e Eletrobras|iG Economia|03/04/2021|O ex-presidente citou Furnas, Caixa Econômica Federal e Eletrobras, como  exemplos de empresas que podem mudar de regime. Também lembrou que  Petrobras e Banco do...
Ernesto Araújo pode disputar vaga de deputado federal, em 2022, pelo DF|Diário do Poder|03/04/2021|Moro acha 'risível' PT culpar juiz e não o ladrão por prejuízo na Petrobras  ... Ministro Sachsida substitui presidente da Petrobras a pedido de  Bolsonaro.
Veja como contestar recebimento de auxílio emergencial 2021, se o benefício foi negado|Extra Online|03/04/2021|Leia também: Petrobras aumenta gás de cozinha em 5% a partir de hoje.  Trabalhadores formais continuam impedidos de solicitar o recurso, assim  como cidadãos...
Petroleiras Exxon, Enauta e Murphy vão perfurar o primeiro poço de petróleo na Bacia de Sergipe-Alagoas no ...|CPG Click Petroleo e Gas|03/04/2021|Os comentários do executivo vêm em um momento em que a Petrobras colocou  diversos campos de exploração e produção de petróleo à venda, enquanto  busca focar na...
Petrobras reajustou combustíveis antes da saída de Castello ...|ISTOÉ DINHEIRO|04/04/2021|A Petrobras informou na sexta (2), em comunicado ao mercado, que preferiu  adotar uma postura “mais cautelosa” em janeiro deste ano em relação aos  reajustes...
TCU manda Petrobras detalhar contratos milionários com ...|Consultor Jurídico|04/04/2021|A Petrobras deverá fornecer a auditores do Tribunal de Contas da União  detalhes de contratos milionários firmados com escritórios de advocacia a  título de...
'Novo pré-sal' na região Norte anima empresas, mas ...|Seu Dinheiro|04/04/2021|Com petróleo em queda, Petrobras reduz preço do diesel e da gasolina em  cerca de 4%. Já a ANP diz que mantém conversas constantes com o Ibama, mas,  até o...
Pregões inesquecíveis: pré-sal e investment grade causam euforia no mercado|Eu Quero Investir|04/04/2021|Isso porque, com o descobrimento, a Petrobras, que acumulava reservas de  13,7 bilhões de barris ao final de 2006, elevaria suas reservas totais em  cerca de 50%.
Preço da gasolina em Manaus dá um salto neste sábado para ...|Amazonas Atual|04/04/2021|MANAUS – Depois de a Petrobras reduzir o preço da gasolina para as  distribuidoras, no final do mês de março, os postos de combustíveis de  Manaus resolveram...
Sem saldão e com pandemia, pessoa física tira o pé da aplicação em bolsa|Exame|04/04/2021|Petrobras e BB derrubam Ibovespa após 7 pregões seguidos de alta. Fundos  imobiliários: com qual valor consigo começar a investir?
Confira a agenda completa de resultados do primeiro ...|Advfn|04/04/2021|PETROBRAS. PETR4. 29/04/2021. Após Pregão. SEQUOIA LOGÍSTICA. SEQL3.  29/04/2021. Após Pregão. GRUPO FLEURY. FLRY3. 29/04/2021. Após Pregão.  PARANAPANEMA.
Páscoa: como conquistar o consumidor que não prioriza a marca?|Exame|04/04/2021|Petrobras lança site sobre preço do combustível e diz ser responsável  apenas por uma parte do. Minhas Finanças. Há 2 dias • 3 min de leitura...
Safra substitui Banco do Brasil e Pão de Açúcar por Itaú e Assaí na carteira de abril|Money Times|04/04/2021|Safra substitui Banco do Brasil e Pão de Açúcar por Itaú e Assaí na  carteira de abril ; Via Varejo · VVAR3, 5 ; Petrobras · PETR4, 14 ; Vale ·  VALE3, 12 ; Gerdau...
Lava Jato no STF: o que aconteceu com os réus com foro privilegiado|Gazeta do Povo|04/04/2021|Também chama atenção no STF o volume de investigações arquivadas,  despachadas a outros ministros por falta de relação com as fraudes da  Petrobras ou...
Troca de comando deve afetar os planos da Petrobras de vender refinarias|Gazeta do Povo|05/04/2021|A troca no comando da Petrobras, determinada pelo presidente Jair Bolsonaro  após insatisfação com reajustes nos preços dos combustíveis,...
A Imunidade Tributária Recíproca e a Jurisprudência|Estratégia Concursos|05/04/2021|O tribunal guardião constitucional entendeu que, da mesma forma que no caso  da Petrobrás demonstrado, a jurisprudência não deve reconhecer a imunidade  recíproca...
Relacionamento vai e volta: Gusttavo Lima revela que está ...|Agora RN|05/04/2021|Conselho do PPI aprova incluir Petrobras em estudos para privatização  Petrobras eleva em 11,4% preço médio da querosene de aviação Mãe de  Michael,...
Com desconto de 30%, aumento de IPTU para imóveis ...|Amazonas Atual|05/04/2021|30 de maio de 2022 · Refinaria Lubnor: Prefeitura de Fortaleza quer  indenização (Foto: Juarez Cavalcanti/Agência Petrobras.
Com colapso, profissionais de saúde dizem que remédios de intubação estão acabando|O Cafezinho|05/04/2021|Novo Presidente da PETROBRAS defende preços altos. Bolsonaro troca  presidente da Petrobras que anuncia manutenção da politica de preço que  encareceu os...
Petrobras anuncia aumento de 39% no gás natural para distribuidoras|Agência Brasil|06/04/2021|Petrobras anuncia aumento de 39% no gás natural para distribuidoras.  Reajuste passa a valer em 1° de maio.
Petrobras anuncia reajuste de 39% no preço do gás natural|Agência Brasil|06/04/2021|A Petrobras anunciou reajuste de 39% no preço do gás natural repassado às  distribuidoras. O novo valor valerá a partir do dia 1º de maio.
Petrobras eleva preço do gás natural em quase 40% para distribuidoras em 1º de maio|Valor Econômico|06/04/2021|A Petrobras informou que irá aumentar, a partir do dia 1º de maio de 2021,  o preço de venda de gás natural para as distribuidoras em 39% em reais por  metro...
Petrobras muda escala de trabalhadores em plataformas para ...|A Gazeta|06/04/2021|O avanço das contaminações por Covid-19 nas plataformas de petróleo fez a  Petrobras alterar temporariamente a escala dos empregados que trabalham  embarcados...
Fundo da Vinci Partners conclui aquisição de parques eólicos da Petrobras|Forbes Brasil|06/04/2021|A transação, que marca a saída da Petrobras dos negócios em energia eólica,  envolveu também fatia detida pela alemã Wobben Windpower nas usinas,...
Suspensa pela Petrobras, MODEC foi líder isolada do ...|EPBR|06/04/2021|A Yinson, com uma unidade para o campo de Marlim, e a Misc Berhard, com o  FPSO Mero 3, ambos projetos da Petrobras, vão estrear no mercado de  construção e...
XP reduz estimativa de valor de venda de refinarias da Petrobras para até US$ 4,77 bi|Valor Investe|06/04/2021|A XP Investimentos acredita que a Petrobras vai levantar entre US$ 3,53  bilhões e US$ 4,77 bilhões com a venda de seis de suas refinarias ainda  em...
Demitido da Petrobras, gerente recorre à CVM sobre caso de informação privilegiada|Valor Investe|06/04/2021|Uma demissão na Petrobras na segunda-feira passada sinalizou que a  companhia tinha matado a charada sobre o misterioso caso de “insider  trading” com opções...
3R capta R$ 820 mi no follow-on mais rápido da história e triplica negócio|Exame|06/04/2021|Campo da 3R, adquirido da Petrobras: no Pólo Macau, produção aumentou 28%  após as primeiras melhorias para reativação de poços (Divulgação/3R).
Empresas privadas avançam no mercado de gás, mas 'choque de energia barata' ainda demora|Folha|06/04/2021|A Unigel compra o gás da Petrobras, mas ela mesma contratou o transporte  pelos dutos da TAG, usando capacidade ociosa da estatal. A TAG, que opera  os gasodutos...
Como aumento de 39% no gás natural pela Petrobras chegará ao seu bolso|BBC|07/04/2021|A Petrobras anunciou nesta segunda-feira (05/04) um reajuste de 39% no  preço do gás natural vendido às distribuidoras, com vigência a partir de 1º  de maio.
Petrobras deve anunciar alta no preço do gás natural em menos de 1 mês|CPG Click Petroleo e Gas|07/04/2021|A cada três meses os contratos terão reajustes. A Petrobras informou na  última segunda-feira (5) que aumentará o preço de venda do gás natural às  distribuidoras...
Gás natural vai subir 39% a partir de maio; como você será afetado?|iG Economia|07/04/2021|Somente em 2021, a Petrobras já aumentou os preços da gasolina em 46,2%; do  diesel em 41,6%; e do gás de botijão em 17%. No Brasil, a grande maioria  das...
Petrobras assumirá fatia da BP em blocos para exploração de petróleo na foz do Rio Amazonas|G1|07/04/2021|A Petrobras assinou acordo com a britânica BP para assumir a integralidade  das participações da empresa em 6 blocos exploratórios de petróleo e gás em  águas...
Petroleiros pedem suspensão de embarques em plataforma ...|EPBR|07/04/2021|Também nesta segunda, a Petrobras alterou a escala dos embarcados em suas  plataformas para embarques seguidos de 21 dias, com folgas de 28 e 35  dias...
Petrobras se compromete a acabar com ‘almoxarifado submarino’ na Bacia de Campos|Valor Econômico|07/04/2021|Petrobras se compromete a acabar com 'almoxarifado submarino' na Bacia de  Campos. Inquérito investigou o armazenamento de equipamentos (como  tubulações...
Acionistas minoritários da Petrobras (PETR4) analisam ação na Justiça|Suno|07/04/2021|O Almeida Advogados é bastante procurado por ser um dos responsáveis pela  class action contra a Petrobras nos Estados Unidos. Em 2018, após a  operação Lava Jato...
Petrobras leiloa 7 andares comerciais em BH, com lance de R$ 11 milhões|Estado de Minas|07/04/2021|A Petrobras vai leiloar sete andares comerciais em um edifício na Rua Barão  de Macaúbas, no Bairro Cidade Jardim, Região Sul de Belo Horizonte.
Após vender a TAG, Petrobras gasta R$ 3 bi ao ano para alugar gasodutos que privatizou|DCM|07/04/2021|A Petrobras está pagando cerca de R$ 3 bilhões ao ano para utilizar os  gasodutos da Transportadora Associada de Gás S.A. (TAG), empresa que a  estatal vendeu...
Gasmig congela preço do gás residencial até 2022|Valor Investe|07/04/2021|A Gasmig, distribuidora de gás da Cemig, anunciou hoje que vai manter  congelado o preço do gás residencial até fevereiro de 2022, mesmo após a  Petrobras ter...
Não vou interferir, mas podemos mudar política de preços da Petrobras, diz Bolsonaro|Valor Investe|08/04/2021|"O presidente Jair Bolsonaro afirmou hoje que é ""inadmissível"" a Petrobras  reajustar o preço do gás em 39%, como anunciado nesta semana."
Bolsonaro diz que 'não vai interferir,' mas que pode mudar política de preços da Petrobras|G1|08/04/2021|Além da troca na Petrobras, a gestão Bolsonaro promoveu mudanças no comando  de importantes estatais. André Brandão renunciou ao cargo de presidente do  Banco do...
Bolsonaro critica aumento de 39% no gás pela Petrobras: 'Não vou interferir. Mas podemos mudar essa política de preços lá'|O Globo|08/04/2021|Bolsonaro, que demitiu o presidente da Petrobras, Roberto Castello Branco,  em fevereiro insatisfeito com a polítida de preços dos combustíveis da  estatal,...
Coordenador da FUP é punido pela Petrobras; entidades e ...|Brasil de Fato|08/04/2021|Diversas entidades sindicais e movimentos sociais protestaram nesta  quarta-feira (7) contra uma punição aplicada pela Petrobras ao  coordenador-geral da...
Petrobras conclui venda de parques eólicos Mangue Seco 3 e 4 no RN|G1|08/04/2021|A Petrobras anunciou que finalizou a venda conjunta com a Wobben Windpower  de todas as suas participações nos parques de produção de energia eólica  Mangue...
Petrobras rechaça acusações sobre novo plano de saúde dos empregados|InfoMoney|08/04/2021|De acordo com a estatal, a transição da operação do plano de saúde AMS para  a Associação Petrobras de Saúde (APS) “foi realizada seguindo todas as  normas de...
MPF denuncia ex-diretor da Petrobras por corrupção e ...|Consultor Jurídico|08/04/2021|O Ministério Público Federal denunciou o ex-diretor de Serviços da  Petrobras Renato Duque, um sócio e ex-administradores do Grupo MPE  Montagens e Projetos...
Petrobras (PETR4) informa resultado de recompra de até US$ 3,5 bi em títulos globais|Eu Quero Investir|08/04/2021|A Petrobras (PETR4) anunciou, nesta quarta (7), o resultado de oferta de  recompra de até ... efetuada pela subsidiária integral Petrobras Global  Finance.
Petrobras posterga previsão de início de produção de Mero 1 ...|ISTOÉ DINHEIRO|08/04/2021|A Petrobras informou que postergou a previsão de início de produção de Mero  1, do 4º trimestre de 2021 para o 1º trimestre de 2022.
Petrobras anuncia aumento de 39% do gás natural|Record TV|08/04/2021|A Petrobras anunciou um aumento de 39% no valor do gás natural a partir do  dia 1º de maio. O reajuste de preço não inclui o botijão de gás,...
Lava Jato: Renato Duque é condenado a 3 anos e meio de prisão por lavagem de dinheiro|G1|09/04/2021|Ex-diretor de Serviços da Petrobras, que deixou a prisão há mais de um ano,  deverá cumprir pena em regime aberto. Justiça determinou confisco de R$  69...
Ações da Petrobras voltam a cair, após declaração de Bolsonaro sobre política de preços na véspera|Yahoo Noticias|09/04/2021|RIO — As ações da Petrobras voltaram a cair nesta quinta-feira, após as  declarações do presidente Jair Bolsonaro, na véspera, sobre a possibilidade  de...
Petrobras assina acordo com Amazonas Energia em ação ...|Amazonas Atual|09/04/2021|MANAUS – A Petrobras informou, na quarta-feira, 7, que assinou junto com  suas controladas indiretas Breitener Tambaqui S.A. e Breitener Jaraqui S.A.  acordo...
Bolsonaro sanciona lei que promete abrir mercado de gás e baratear energia|Folha|09/04/2021|O presidente Jair Bolsonaro (sem partido) sancionou nesta quinta-feira (8),  a Nova Lei do Gás, que põe fim ao monopólio da Petrobras e modifica o  arcabouço...
Petrobras é obrigada a tirar ´almoxarifado submarino` com toneladas de equipamentos e tubulações de plataf ...|CPG Click Petroleo e Gas|09/04/2021|Petrobras se posiciona sobre acumular sem nenhum licenciamento ambiental na  Bacia de Campos, toneladas de materiais de suas plataformas de petróleo.
Refinaria árabe é vendida por mais de 3 vezes valor da ...|Monitor Mercantil|09/04/2021|Em seu estudo, o engenheiro – que se aposentou da Petrobras após 50 anos de  serviços – informa que, nos últimos 15 anos, a estatal brasileira investiu  entre...
Vagas de emprego URGENTES para contratos Petrobras offshore de manutenção e reparo de estruturas, tubulações, elétrica, instrumentação, pintura e mais|CPG Click Petroleo e Gas|09/04/2021|Contratos de manutenção da Ocyan com a Petrobras no Rio de Janeiro demanda  vagas de emprego IMEDIATAS. Cadastre seu currículo. Ocyan convoca com  urgência...
Ex-diretor da Petrobras é denunciado por corrupção e ...|Canal Ciências Criminais|09/04/2021|O ex-diretor de Serviços da Petrobras, Renato Duque, foi denunciado pelo  Ministério Público Federal (MPF) pelos crimes de corrupção e lavagem de  dinheiro.
Odebrecht põe na rua venda da Braskem|Valor Econômico|09/04/2021|A Petrobras, segunda maior acionista, é dona de 36,1% e já anunciou a  intenção de sair do negócio. Ao menos por ora processos caminham em  paralelo - a...
Leilão da Ferrovia de Integração Oeste Leste rende R$ 33 mi ao governo|Metrópoles|09/04/2021|Petrobras - Sede. Economia · Petrobras anuncia leilão de sete andares  comerciais em Belo Horizonte · Economia · Governo arrecada R$ 3,3 bilhões  em leilão de...
Petrobras anuncia redução no preço do diesel a partir de sábado|G1|10/04/2021|A Petrobras vai reduzir o preço do diesel nas refinarias a partir desta  sábado (10), informou a companhia. É a segunda queda no preço do  combustível este...
Petrobras reduz preço do diesel nas refinarias em R$ 0,08|Agência Brasil|10/04/2021|A Petrobras anunciou hoje (9) que o preço do diesel nas refinarias da  estatal será reduzido em R$ 0,08 a partir deste sábado (10). Desse modo, o  litro do...
Petrobras reduz diesel em 3,3% nas refinarias a partir de sábado e mantém preços da gasolina|InfoMoney|10/04/2021|Petrobras reduz diesel em 3,3% nas refinarias a partir de sábado e mantém  preços da gasolina. Esta é a segunda redução consecutiva nos preços do  diesel vendido...
Petrobras quer indenização de US$ 6,4 bilhões no novo leilão ...|EPBR|10/04/2021|A Petrobras permanece com os volumes originais sob o regime da cessão  onerosa. O governo publicou nesta sexta (9), em edição extra do Diário  Oficial da União (...
Petrobras dá adeus aos R$ 30? Falas de Bolsonaro sobre política de preços reforçam cautela com as ações|InfoMoney|10/04/2021|SÃO PAULO – As falas do presidente Jair Bolsonaro sobre a Petrobras (PETR3;  PETR4) nesta semana elevaram as apostas do mercado de que a política de  preços...
Petrobras vende ações na distribuidora de gás do Maranhão ...|EPBR|10/04/2021|A Petrobras chegou a um acordo para transferir as ações da Gaspetro na  Gasmar, distribuidora do Maranhão, para a Termogás. De acordo com  comunicado feito...
Câmara quer saber por que Petrobras vendeu refinaria pela ...|Brasil de Fato|10/04/2021|O presidente da Petrobras, Roberto Castello Branco, foi chamado pela  Comissão de Fiscalização Financeira e Controle (CFFC) da Câmara dos  Deputados para dar...
Bilionário da lista da Forbes quer ser conselheiro da Petrobras|VEJA|10/04/2021|Bilionário da lista da Forbes quer ser conselheiro da Petrobras. Juca  Abdalla se candidatou a uma vaga no Conselho de Administração da estatal  como...
Trabalhadores da Repar preparam greve sanitária a partir do dia 12|Época Negócios|10/04/2021|Trabalhadores da Refinaria Presidente Getúlio Vargas (Repar), da Petrobras,  em Araucária, no Paraná, preparam greve sanitária a partir de  segunda-feira, 12.
Novo Marco Regulatório do Gás Natural é sancionado sem veto|Senado Federal|10/04/2021|A lei foi sancionada dois dias depois de o presidente Jair Bolsonaro ter  reclamado publicamente do reajuste autorizado pela Petrobras de 39% no  preço do gás, a...
Petrobras conclui venda de participação em parque eólico no Nordeste|Agência Brasil|11/04/2021|A Petrobras finalizou a venda da totalidade de sua participação de 49% na  Sociedade Eólica Mangue Seco 1 – Geradora e Comercializadora de Energia  Elétrica...
Bilionário se torna candidato a conselheiro da Petrobras em movimento de minoritários para ganhar espaço|O Globo|11/04/2021|RIO - Os acionistas minoritários da Petrobras articulam propor um aumento  no número de cadeiras no Conselho de Administração da estatal na próxima...
Petrobras: Conselho aprova acordo sobre excedentes nos campos de Sépia e Atapu|InfoMoney|11/04/2021|A conselho de administração da Petrobras aprovou nesta sexta-feira, 9, a  assinatura de acordo com a União, que estabelece as participações em cada  contrato...
Petrobras (PETR4) Comenta Saída da Gaspetro na Gasmar|The Capital Advisor|11/04/2021|A Petrobras está conduzindo processo de desinvestimento de sua participação  na Gaspetro, conforme comunicados ao mercado. imagem. Marcelo-photo...
Opinião: as relações entre Cláudio da Costa e Roberto Castello Branco na Petrobras|Carta Capital|11/04/2021|Já se passaram cerca de dez dias da demissão de Cláudio da Costa,  ex-gerente executivo de Recursos Humanos da Petrobras, por ter utilizado  informações...
Mais competição no gás: quebra de monopólio da Petrobras pode baixar preços|Correio Braziliense|11/04/2021|Ao quebrar o monopólio da Petrobras, nova lei sancionada pelo presidente  Jair Bolsonaro tem tudo para estimular investimentos, aumentar a  concorrência e reduzir...
Ex-gerente da Petrobras demitido por ‘insider trading’ é alvo de ação no TRF-1|Carta Capital|11/04/2021|Demitido da gerência executiva de Recursos Humanos da Petrobras em 29 de  março, Claudio da Costa é alvo de ações que envolvem a terceirização  bilionária do...
Direção da Petrobras persegue e maltrata seus aposentados|Jornal Correio|11/04/2021|Há três meses, a direção da Petrobras vem “sequestrando” os salários dos  seus aposentados e pensionistas, efetuando descontos abusivos e indevidos  na AMS...
PT: solidariedade e apoio à luta de Deyvid Bacelar e da FUP|Partido dos Trabalhadores|11/04/2021|A perseguição ao coordenador da FUP pela direção da Petrobras é mais uma  faceta da politica de desmonte da empresa que, após o golpe de Estado em  2016,...
"Jornal francês mostra como os EUA usaram a ""lava jato"" para ..."|Consultor Jurídico|11/04/2021|A tarefa ficou ainda mais difícil depois que Edward Snowden mostrou que a  NSA (agência de segurança dos EUA) espionava a presidente Dilma Rousseff e  a Petrobras...
Conselho de Administração da Petrobras se reúne sexta para dar posse a novo presidente|O Globo|14/04/2021|RIO - O Conselho de Administração da Petrobras vai se reunir de forma  extraordinária na próxima sexta-feira para eleger o general Joaquim Silva e  Luna como...
Petrobras desenvolve com a SAP solução para economizar ...|InforChannel|14/04/2021|Solução vencedora de hackathon interno otimiza armazenamento da Petrobras e  tem potencial de economia de 37 milhões de reais por ano.
Parada de manutenção em refinarias da Petrobras provoca aglomeração de milhares de trabalhadores em todo o Brasil|CPG Click Petroleo e Gas|14/04/2021|Paradas de manutenção nas refinarias da Petrobras faz com que cresça a taxa  de contaminados pela Covid-19 de trabalhadores da empresa.
Exportação de soja alcançará até 17,15 milhões de toneladas em abril, projeta Anec|Money Times|14/04/2021|Últimas Notícias Cotações Comprar ou Vender FGTS Eletrobras Petrobras ·  Instagram · YouTube · Linkedin Facebook · Google Facebook Twitter.
