title|media|date|desc
Bolsonaro recua de medida que permite suspensão de ...|Jornal Opção|23/03/2020|Chegou a hora de tirar a máscara da Petrobrás  https://www.jornalopcao.com.br/bastidores/chegou-a-hora-de-tirar-a-mascara-da-petrobras-406451/  …
Distanciamento social é luxo que muitos não têm acesso na Índia|Money Times|23/03/2020|Comprar ou vender? Mercado vê riscos políticos que podem afetar ação da  Petrobras. Leia mais sobre: Bloomberg, Coronavírus,...
Carvão é o combustível mais caro do mundo após colapso do petróleo|Money Times|23/03/2020|Comprar ou vender? Mercado vê riscos políticos que podem afetar ação da  Petrobras. Leia mais sobre: Bloomberg, Carvão,...
Banco Clássico passa a deter 10% das ações ordinárias da Cemig|Money Times|23/03/2020|Veja, a seguir, o comunicado da Cemig. Leia também: Exclusivo · Petrobras  (PETR4): CPI...
Petrobras corta preço da gasolina em 15%; diesel não terá ajuste|Folha|24/03/2020|Segundo a Petrobras, o preço de refinaria representa 27% do valor de venda  da gasolina nos postos. O resto são margens de lucro e impostos federais e  estaduais.
Petrobras doa 20 mil equipamentos do Cenpes para hospital ...|ISTOÉ DINHEIRO|24/03/2020|A Petrobras informou nesta quarta-feira, 24, que disponibilizou cerca de 20  mil equipamentos de segurança e produtos de higiene para o Hospital...
Petrobras não divulgará plataformas com eventuais casos ou ...|Portos e Navios|24/03/2020|Procurada pela Portos e Navios, a Petrobras não detalhou quais plataformas  estão com trabalhadores em quarentena ou que tiveram casos de necessidade  de remoção.
Presos confeccionarão 320 mil máscaras de proteção contra coronavírus em SP|Correio Braziliense|24/03/2020|O futuro já começou. O que é a Web 3.0 e como ela vai impactar as nossas  Vidas! Petrobras perde R$ 27,3 bi em valor de mercado em apenas um dia...
Autoridades do G7 prometem manter expansão fiscal e monetária em combate ao coronavírus|Money Times|24/03/2020|... saiba como receber · Petrobras (PETR4): B3 suspende negociações das  ações · Melhor e mais barata que SulAmérica (SULA11): conheça a ação de  seguradora...
China importa 160% a mais em carne de porco nos dois primeiros meses do ano|Money Times|24/03/2020|Gasolina e etanol têm primeira queda de preço depois de três meses de altas  · Se havia dúvida de que a Petrobras (PETR4) amarrava preço do etanol nas  usinas...
Infraestrutura vai atuar com estados para evitar bloqueio de ...|Diário de Uberlândia|24/03/2020|​José Mauro Coelho, presidente da Petrobras, pede demissão. 20/06/2022.  Ministro diz que governo está atuando para reduzir impostos e inflação.  09/06/2022.
IPC-S acelera em todas as 7 capitais pesquisadas na 3ª ...|ISTOÉ DINHEIRO|24/03/2020|Comitê aprova Andrade para presidência da Petrobras; falta respaldo do  conselho. Giro 20:35. Aprovação de Andrade para presidente da Petrobras é  dada como...
Quais ações comprar agora com a queda do Ibovespa?|SpaceMoney|24/03/2020|Petrobras, 0,54. Petrobras, 0,55. Gerdau, 0,60. BR Malls, 0,67. Brasil,  0,68. Cemig, 0,80. CVC Brasil, 0,80. CSN, 0,86. Bradespar, 0,88. Smiles,  0,93.
Desafios de logística e de mão de obra atrasam distribuição de alimentos no mundo|Money Times|24/03/2020|Gasolina e etanol têm primeira queda de preço depois de três meses de altas  · Se havia dúvida de que a Petrobras (PETR4) amarrava preço do etanol nas  usinas...
Refinarias da Petrobras reduzem produção com colapso do petróleo|InfoMoney|25/03/2020|(Bloomberg) — As refinarias da Petrobras começaram a reduzir a produção, já  que a crise do coronavírus causa forte queda do consumo de combustível,...
Supercomputadores da Petrobras vão apoiar pesquisas sobre Covid-19|Tecnoblog|25/03/2020|Além da parceria com a Universidade Stanford, a Petrobras fornecerá  recursos computacionais avançados para pesquisas de universidades  brasileiras destinadas ao...
Ações da Petrobras despencam 57% em 1 mês; o que fazer com elas?|UOL Economia|25/03/2020|Manter as ações na carteira? Os gestores com quem o UOL conversou foram  unânimes em afirmar que quem já tem ações da Petrobras deve manter os  papéis e esperar...
Antonov 225, o maior avião do mundo, volta aos céus após 18 meses parado|AEROIN|25/03/2020|... fevereiro de 2010, o Antonov An-225 Mriya foi contratado pela Chapman  Freeborn Airchartering (empresa britânica de frete aéreo), a serviço da  Petrobrás.
Espírito Santo dribla coronavírus; investimentos privados|Além do Fato|25/03/2020|... instalações de grande grupos de transformação e mineração – Vale,  Petrobras, ArcelorMittal, Samarco, Suzano (celulose), Marcopolo (ônibus) –  e serviços,...
Anfidc pede atuação mais clara e efetiva da CVM na crise|Valor Econômico|25/03/2020|Conselho da Petrobras deve se reunir na 2ª feira para anunciar novo  presidente, dizem fontes. O comitê de elegibilidade (Celeg) da Petrobras se  encontra...
Países começam a estocar alimentos e ameaçam comércio global|Money Times|25/03/2020|... Se havia dúvida de que a Petrobras (PETR4) amarrava preço do etanol nas  usinas, não há mais · Celulose é o novo minério de ferro?
Inadimplência de empresas bate 11º recorde consecutivo em janeiro|Money Times|25/03/2020|Comprar ou vender? Mercado vê riscos políticos que podem afetar ação da  Petrobras. Leia mais sobre: Comércio, Consumo,...
Qual é a ação “queridinha do mercado”? Não é a que você está pensando|Money Times|25/03/2020|Comprar ou vender? Mercado vê riscos políticos que podem afetar ação da  Petrobras. Leia mais sobre: Alpargatas, Comprar ou...
Marubeni estima prejuízo de US$ 1,7 bi com impacto do coronavírus às commodities|Money Times|25/03/2020|Gasolina e etanol têm primeira queda de preço depois de três meses de altas  · Se havia dúvida de que a Petrobras (PETR4) amarrava preço do etanol nas  usinas...
Petrobras reduzirá investimentos, produção e gastos com RH|Agência Brasil|26/03/2020|A Petrobras anunciou hoje (26) uma série de medidas para equilibrar o caixa  da companhia em meio ao choque dos preços do barril petróleo e do impacto  da...
Petrobras cria Diretoria de Logística, que será comandada por ...|EPBR|26/03/2020|André Chiarini ocupava o cargo de assessor da Presidência da Petrobras para  logística desde novembro de 2019. Foi sócio fundador e Diretor Executivo do  Infra...
Gasolina 40,5% mais barata nas refinarias, em 2020, não chega às bombas|Estado de Minas|26/03/2020|Após oito reduções do preço da gasolina nas refinarias anunciadas neste ano  pela Petrobras, o motorista não vê a queda chegar às bombas nos postos de...
Bolsonaro diz esperar que redução de preço do diesel e gasolina chegue às bombas - Bem Paraná|Bem Paraná|26/03/2020|O presidente disse que não irá interferir na política de preços da  Petrobras, mas cobra que o presidente da empresa, Roberto Castello Branco,  siga o preço...
Vale adota câmeras térmicas em prevenção contra coronavírus em suas operações|Época Negócios|26/03/2020|Petrobras doa 600 mil testes de covid-19 ao SUS. A implantação dos  equipamentos, cujas leituras duram cerca de dois segundos e a margem de  erro é de 0,5 grau...
Renda fixa: entenda porque preço dos títulos varia|Eu Quero Investir|26/03/2020|Radar traz Petrobras (PETR3; PETR4), Light (LIGT3) e Caixa Seguridade  (CXSE3) · Futuros de NY operam sem direção definida com S&P perto da  estabilidade e...
Vagas offshore em Rio das Ostras para Operador de Guindaste, Auxiliar e Supervisor de Movimentação na Tech-Insp nesta dia 26 de março|Click Petróleo e Gás|26/03/2020|Através de sua base em Rio das Ostras RJ, as vagas offshore  disponibilizadas hoje são para atividades de movimentação de carga em  contrato Petrobras.
Japoneses começam a usar a tecnologia 5G|Folha PE|26/03/2020|Comitê da Petrobras aprova nome de Caio Andrade para presidência ·  Sociedade Civil lança VI Relatório Luz no dia 30. Desenvolvimento  sustentável...
Areia Movediça ou Bolsão de Ar: O Que Há no Fundo do Poço ...|Investing.com|26/03/2020|Análise gráfica (técnica) do Ibovespa Mini índice, Mini Dólar, Petrobras  (SA:PETR4), Vale (SA:VALE3), Vivara (SA:VIVA3), Banco do Brasil (SA:BBAS3),  Itaúsa (SA:...
Supermercados: veja gráfico com o impacto do coronavírus sobre as vendas em São Paulo|Money Times|26/03/2020|... Se havia dúvida de que a Petrobras (PETR4) amarrava preço do etanol nas  usinas, ... Petrobras (PETR4), dividendos e mais: Veja os destaques da  semana no...
FPSOs encomendados pela Petrobras para o pré-sal da ...|Portos e Navios|27/03/2020|Os FPSOs de Búzios 5 e Itapu que foram encomendados pela Petrobras para  produzir no pré-sal da Bacia de Santos, terão conteúdo local global mínimo  de 25%.
Sérgio Ricardo: Petrobras quer pagar indenização irrisória a pescadores afetados há 20 anos|Diário do Rio|27/03/2020|Estamos diante de um caso clássico de Racismo Ambiental Corporativo onde  uma das maiores petroleiras do mundo (a PETROBRAS) por 20 anos boicotou...
Pandemia de coronavírus fez economia global entrar em ...|TradeMap|27/03/2020|Chaminé de produção de óleo da Petrobras · A crise que pode enfraquecer o  motor de dividendos da Petrobras – veja o que marcou a semana.
Quais medidas foram adotadas pelas maiores empresas do Brasil para combater o coronavírus|Época Negócios|27/03/2020|A companhia determinou que pessoas voltando de viagens ao exterior, mesmo  que por férias, ficarão em quarentena, realizando trabalho remoto. A  Petrobras também...
Recrusul está avaliando interromper contratos de trabalho|Money Times|27/03/2020|... Se havia dúvida de que a Petrobras (PETR4) amarrava preço do etanol nas  usinas, ... Petrobras (PETR4), dividendos e mais: Veja os destaques da  semana no...
Para cada R$ 1 de dívida bruta, há R$ 2,55 no caixa|Valor Econômico|27/03/2020|Petrobras e Vale já sacaram de suas linhas de empréstimo rotativas  bilionárias, espécie de cheque especial mantido nos bancos, assim como  estão fazendo seus...
Coronavírus: três estados flexibilizam medidas de isolamento|Money Times|27/03/2020|Comprar ou vender? Mercado vê riscos políticos que podem afetar ação da  Petrobras. Leia mais sobre: Agência Brasil, Cidades...
Câmara dos EUA aprova pacote de US$ 2,2 trilhões contra coronavírus|Money Times|27/03/2020|... CVC (CVCB3), Petrobras (PETR4) e outras empresas para ficar de olho  hoje · Sanepar (SAPR11) pagará R$ 154 milhões em juros sobre o capital  próprio...
Coronavírus trouxe volatilidade aos mercados; o que isso significa?|UOL Economia|27/03/2020|Se em janeiro o papel da Petrobras variou apenas 6% entre a máxima e a  mínima, em março, a oscilação chegou a 60%. Os títulos Tesouro Selic também  variaram, mas...
Vereadores de SP aprovam R$ 1,5 bi para combate ao coronavírus|Money Times|27/03/2020|Gasolina e etanol têm primeira queda de preço depois de três meses de altas  · Se havia dúvida de que a Petrobras (PETR4) amarrava preço do etanol nas  usinas...
Pequenas empresas que exploram petróleo em terra pedem suspensão do pagamento de royalties|Época Negócios|28/03/2020|Segundo Santos, o desconto de cerca de 20% imposto pela Petrobras sobre a  cotação do barril do tipo Brent na negociação para comprar petróleo das  empresas...
O fim de uma era na prisão da Lava-Jato na República de Curitiba|VEJA|28/03/2020|Nesta semana, o ex-gerente da Petrobras Roberto Gonçalves deixou o Complexo  Médico Penal de Pinhais. Era o último investigado da Lava-Jato preso no...
Confira mais de 80 ideias de atividades em família para ...|Jornal Opção|28/03/2020|Bolsonaro propõe CPI da Petrobras e critica lucros da estatal￼. Presidente  da República afirmou que já existe uma articulação na Câmara dos Deputados  para a...
Duramente afetado pelo coronavírus, dono da Louis Vuitton ganha US$ 11,3 bi na bolsa de NY em apenas um dia|O Globo|28/03/2020|Petrobras adia pagamento de dividendos e corta US$ 3,5 bilhões em  investimentos · Empresas como a Petrobras devem rever planos para lidar com  cenário de...
Abendi disponibiliza e-books e cursos gratuitos online preparatórios na carreira de END|CPG Click Petroleo e Gas|28/03/2020|Além disso a Petrobras anunciou também na manhã de ontem que os FPSOs  encomendados pela companhia para o pré-sal da Bacia de Santos terão 25% de  conteúdo...
A semana encerra com vagas de emprego para trabalhar em obras de construção civil|Click Petróleo e Gás|28/03/2020|Leia também · Senac EAD oferece 20 cursos gratuitos totalmente a distância  com certificado; veja como se inscrever · FPSOs encomendados pela Petrobras  para o pré-...
Contrariando Bolsonaro, Mandetta incentiva pessoas a ficarem em casa|Correio Braziliense|28/03/2020|"""Se a Petrobras decidir enfrentar o Brasil, ela que se prepare"", diz Lira  ... CPI: A ordem é focar nos altos salários da Petrobras..."
O cartucho de prata da educação, escreve Jair Ribeiro|Poder360|28/03/2020|Ações da Petrobras caem mais de 2% com pedido de demissão. publicidade.  publicidade. publicidade. Formulário de cadastro. Poder360 todos os dias no  seu e-...
Abbott lança teste que detecta coronavírus em 5 minutos|ISTOÉ DINHEIRO|28/03/2020|+ Petrobras doa 600 mil testes de covid-19 ao SUS · + Bradesco, Itaú e  Santander vão comprar 5 milhões de testes de covid-19.
Base da Petrobras do ES ganha reforço operacional da Engevale do SP|CPG Click Petroleo e Gas|29/03/2020|Reforço da Engevale para a Petrobras. Com o intuito de ajudar a grande  petroleira – Petrobras, nesse momento de crise a Engevale localizada no  município de...
Veja como bares, restaurantes e boates estão lidando com pandemia|Money Times|29/03/2020|Comprar ou vender? Mercado vê riscos políticos que podem afetar ação da  Petrobras. Leia mais sobre: Agência Brasil, Alimentos...
Compre ao som dos canhões e venda ao som dos violinos|Money Times|29/03/2020|... Se havia dúvida de que a Petrobras (PETR4) amarrava preço do etanol nas  ... Dividendos, Petrobras (PETR4), Vale (VALE3) e outros destaques em  Comprar ou...
Klabin compra unidade de embalagens da International Paper por R$ 330 milhões|Money Times|29/03/2020|Comprar ou vender? Petrobras (PETR4): “Diminuímos bastante a exposição no  último mês”, diz gestor. Leia mais...
Licenciamento ambiental e o liberalismo de Estado máximo ...|Poder360|29/03/2020|Lula volta a indicar revisão de venda de estatais · Petrobras abandonou os  brasileiros, critica Ciro Nogueira · Lira critica Petrobras por possível  aumento...
Top 5: melhores podcasts sobre investimentos|Money Times|29/03/2020|... CVC (CVCB3), Petrobras (PETR4) e outras empresas para ficar de olho  hoje · Sanepar (SAPR11) pagará R$ 154 milhões em juros sobre o capital  próprio...
Conheça as 4 grandes empresas de equipamentos submarinos que atuam no Brasil|CPG Click Petroleo e Gas|29/03/2020|DOF Subsea fecha extensão de contratos com a Petrobras para operação de  navios de apoio nas explorações de petróleo nos campos nacionais.
Quarentena atrasa entrega do Arco da Inovação|SP Rio Mais|29/03/2020|Um dia depois da renúncia de José Mauro Coelho da presidência do da  Petrobras, o ministro … 1 dia atrás...
O que são tarifas bancárias? Definição, tipos, regulamentação|Edital Concursos Brasil|29/03/2020|Petrobras: Novo reajuste da gasolina e do diesel será anunciado hoje · É  oficial: Caixa encerra depósitos de até R$ 1.000, mas milhões ainda podem  sacar.
Justiça: como recorrer ao Judiciário em tempo de coronavírus|Gazeta do Povo|29/03/2020|Qual será a estratégia da oposição em relação ao pedido de CPI da Petrobras  ... CPI da Petrobras: dobradinha Lira e Bolsonaro vai dar certo?
Petrobras faz importação para baratear gás de cozinha|Money Times|30/03/2020|A Petrobras anunciou a importação de três navios carregados com GLP, cada  um com capacidade de 20 milhões de quilos, para reforçar o abastecimento do  país,...
Contrato da Petrobras para um FPSO da BW Offshore expirou hoje|CPG Click Petroleo e Gas|30/03/2020|Referenciando a Petrobras, a BW Offshore disse nesta segunda-feira(30) que  os contratos para o FPSO alcançaram seus termos finais no domingo, 29 de  março.
Preço médio da gasolina cai 20 centavos no Estado em março|GZH|30/03/2020|Na última quinta-feira, a Petrobras anunciou a segunda redução no preço da  gasolina em uma semana. Após ter cortado em 20 centavos o valor na  refinaria, houve...
Sob contrato Petrobras, mais de 300 trabalhadores da terceirizada offshore Elfe serão demitidos esta semana|CPG Click Petroleo e Gas|30/03/2020|Sob contrato Petrobras, mais de 300 trabalhadores da terceirizada offshore  Elfe serão demitidos esta semana. Escrito por Paulo Nogueira em Óleo & Gás.  -. RJ. 30...
Sindipetro denuncia demissões e hibernação no Tecarmo ...|Infonet|30/03/2020|A diretoria do Sindicato dos Petroleiros de Alagoas e Sergipe (Sindipetro  AL/SE) denunciou nesta segunda-feira, 30, que a Petrobras está iniciando  o...
Klabin anuncia compra unidade de papel ondulado e embalagens da IP Brasil por R$ 330 milhões|Seu Dinheiro|30/03/2020|GAME OVER para Petrobras? Clique aqui e descubra 2 ações que 'vencem' a  estatal · Klabin anuncia compra unidade de papel ondulado e embalagens da  IP Brasil...
Cotação do barril do petróleo chega ao menor nível desde 2002|VEJA|30/03/2020|Com o preço da commodity abaixo de 25 dólares por barril, fica praticamente  inviável a exploração do pré-sal por parte da Petrobras  Petrobras/Divulgação.
José Gutman é convocado para assumir diretoria-geral da ANP|EPBR|30/03/2020|Petrobras e governo de Sergipe buscam clientes para viabilizar gasoduto.  ... Petrobras e governo de Sergipe buscam clientes para viabilizar gasoduto.
Como a queda no preço do petróleo afeta os seus ...|E-Investidor|30/03/2020|Para os especialistas ouvidos pelo E-Investidor, a Petrobras poderá  realizar novos cortes nos preços da gasolina e do diesel. No entanto, a  questão é a...
Justiça anula decisão que suspendeu transporte fluvial no Amazonas|Money Times|30/03/2020|Gasolina e etanol têm primeira queda de preço depois de três meses de altas  · Se havia dúvida de que a Petrobras (PETR4) amarrava preço do etanol nas  usinas...
Petrobras reduz preço do gás de cozinha e busca reforçar abastecimento|iG Economia|31/03/2020|A Petrobras informou que está reforçando o abastecimento do gás liquefeito  de petróleo (GLP), através de compras adicionais já efetuadas dentro do  seu...
Petrobras reduz em 10% preço do gás de cozinha e botijão ...|O Imparcial|31/03/2020|A Petrobras diz que conta com as distribuidoras e revendedores para que  essas reduções do preço do botijão de gás cheguem ao consumidor final. A  estatal...
Abastecimento de gás em SP deve se normalizar em até 4 dias|Agência Brasil|31/03/2020|“Com o aumento da demanda, as entregas de gás da Petrobras para as  distribuidoras registram atraso de dois dias, o que causa filas nas plantas  de...
ANP: assinados contratos de partilha de produção de Búzios e Itapu|Agência Brasil|31/03/2020|O bloco de Búzios foi arrematado pelo consórcio formado pelas empresas  Petrobras, CNODC e CNOOC. O contrato terá vigência de 35 anos e representou  uma...
Yinson assina com a Petrobras para o FPSO do projeto de ...|EPBR|31/03/2020|A Yinson anunciou que assinou com a Petrobras carta de intenção para  afretamento e operação do FPSO que será instalado no módulo 2 do projeto  de...
As 17 ações que caíram mais de 50% no pior trimestre da história do Ibovespa|InfoMoney|31/03/2020|As 17 ações que caíram mais de 50% no pior trimestre da história do  Ibovespa. Destas, 2 caíram mais de 70%, a IRB e a CVC; aéreas, Petrobras e  varejistas também...
Preços do petróleo fecham março com maiores quedas mensais e trimestrais da história|G1|31/03/2020|Campo terrestre de exploração de petróleo da Petrobras no Nordeste — Foto:  Divulgação 1 de 1 Campo terrestre de exploração de petróleo da Petrobras  no...
Preço da gasolina cai mais uma vez no DF e chega a R$ 3,77|Metrópoles|31/03/2020|O valor foi encontrado nos seguintes postos: Anões (Asa Sul), Jarjour (Asa  Sul) e Petrobras (406 Sul). Já o etanol pode ser achado a partir de R$  3,25,...
Morning Call: Ibovespa pode ter mais um dia de recuperação|Eu Quero Investir|31/03/2020|Radar traz Petrobras (PETR4), Embraer (EMBR3) e Braskem (BRKM5) · Futuros  de NY sobem e demais mercados operam em terreno positivo; tendência se  mostra de...
O que fazer com a riqueza do petróleo?|UOL Economia|31/03/2020|Petrobras: do protagonismo à verticalização ... Após a descoberta do  pré-sal, os governos petistas tentaram assentar a Petrobras no epicentro de  um projeto...
