title|media|date|desc
Enquanto a Petrobras aprimora sua infraestrutura, Macaé e Caraguatuba escoam o gás pré-sal e o governo federal estuda alternativas de consumo|Click Petróleo e Gás|22/09/2020|A Petrobras está aprimorando seu gasoduto e capacidade de processamento de  gás natural offshore, enquanto o governo federal estuda alternativas para...
Fux retira de pauta ação que aumenta poderes do governo em privatizações|VEJA|22/09/2020|O presidente do Supremo Tribunal Federal, Luiz Fux, retirou da pauta da  Corte a ação que analisa se o governo poderia privatizar refinarias da  Petrobras sem...
Boi/Imea: com menos animais, utilização de frigoríficos cai em ...|ISTOÉ DINHEIRO|22/09/2020|Petrobras aprova Andrade como conselheiro e CEO ... Correção: Conselho da  Petrobras aprova Paes de Andrade presidente da empresa. Economia 13:58...
É possível colocar o Gmail como app de e-mails padrão no iPhone; veja como|Exame|22/09/2020|Corrupção no MEC: veja as evidências levantadas pela PF sobre Milton  Ribeiro e pastores. Petrobras (PETR4) avalia novo CEO, IPCA-15 e o que mais  move.
Ministros do STF votam contra privatização de subsidiárias da Petrobras|Congresso em Foco|23/09/2020|Além deste recuo, mais um ministro do Supremo Tribunal Federal (STF) votou  pela suspensão de processos de venda de refinarias da Petrobras. Um deles é  Edson...
Petrobras descobre petróleo no pré-sal da Bacia de Campos, no litoral do Rio|O Globo|23/09/2020|No entanto, uma descoberta anunciada pela Petrobras nesta quarta-feira  mostra que ainda há chances de aumento da produção na região.
Nova fase da Lava Jato investiga se fornecedora da Petrobras pagou US$ 40 milhões em propina por contrato de US$ 2,7 bilhões|G1|23/09/2020|A atual fase investiga se a empresa de navegação marítima Sapura, no  Brasil, pagou US$ 40 milhões em propina por contrato de US$ 2,7 bilhões com  a Petrobras...
Alvo de nova fase da Lava Jato é CEO de empresa que fechou parceria com BR Distribuidora|O Globo|23/09/2020|Antonello teve seus bens bloqueados e é investigado em um esquema de  pagamento de propina envolvendo a empresa de navegação marítima Sapura e a  Petrobras,...
Investigados na Lava-Jato têm R$ 20 mi bloqueados por propina em contratos de navios|Correio Braziliense|23/09/2020|... fechados com a Petrobras para o fornecimento de três navios lançadores  de ... contratos da Petrobras, também em favor dos interesses do Grupo  Seadrill.
Nasa anuncia programa para levar primeira mulher à Lua em 2024|Diário do Poder|23/09/2020|Lucro abusivo da Petrobras é de meio bilhão por dia · Diário do Poder. Novo  ministro define privatização da Petrobras como prioridade.
São Caitano, no PE, recebe a Gincana do Caminhoneiro|Estradas|23/09/2020|De acordo com os orgqanizadores, a 42ª etapa será realiza no Posto  Progresso, da Rede Siga Bem da Petrobras, no Km 14 da BR 232, principal  rota de acesso à...
Preço da gasolina sobe 4% nas refinarias|ND Mais|23/09/2020|Novo valor do litro da gasolina anunciado pela Petrobras vale a partir  desta quarta-feira (23); o valor final ao motorista dependerá do mercado.
Banco Original antecipa R$ 374 milhões ao JBS, por meio de cessão de recebíveis|Money Times|23/09/2020|... Se havia dúvida de que a Petrobras (PETR4) amarrava preço do etanol nas  ... Dividendos, Petrobras (PETR4), Vale (VALE3) e outros destaques em  Comprar ou...
PIB do agronegócio do Brasil cresce 5,26% no 1º semestre, diz CNA|Money Times|23/09/2020|... Se havia dúvida de que a Petrobras (PETR4) amarrava preço do etanol nas  usinas, ... Petrobras (PETR4), dividendos e mais: Veja os destaques da  semana no...
Cade aprova sociedade entre BR Distribuidora e Golar Power ...|EPBR|24/09/2020|Petrobras prepara saída da BR. A Golar é uma multinational com presença nos  mercados de GNL e energia. No Brasil, tem uma unidade flutuante de  armazenamento e...
A serviço da Petrobras SBM contrata técnicos, engenheiros e mais para 29 vagas offshore em navios FPSO no Rio de Janeiro e São Paulo|Click Petróleo e Gás|24/09/2020|Os profissionais de nível médio e superior convocados pela SBM para as  vagas de emprego irão prestar serviços offshore à Petrobras em navios FPSO.
BTG Pactual prevê queda de 34% no lucro das empresas em 2020 e alta de 67% em 2021|Valor Investe|24/09/2020|A análise desconsidera Vale e Petrobras, que, quando incluídas, apontam  para uma projeção de baixa de 28,8% do lucro neste ano · Siga o Valor  Investe:.
Mais de 200 novos poços offshore de exploração no Rio de ...|EPBR|24/09/2020|Uma eventual decisão do STF proibindo a Petrobras de criar subsidiárias  para vender ativos pode matar a empresa, afirmou o secretário especial de...
Licitação da Petrobras com 55% de conteúdo local é lançado para fornecimento de dutos flexíveis|Click Petróleo e Gás|24/09/2020|A Petrobras vai adquirir mais de 540 quilômetros de umbilicais submarinos  neste certame. Para prosseguir com seus projetos de infraestrutura e  investimento no...
Com volatilidade em LFT, CDB de liquidez diária pode ser ...|Eu Quero Investir|24/09/2020|Radar traz Petrobras (PETR4), Embraer (EMBR3) e Braskem (BRKM5) · Futuros  de NY sobem e demais mercados operam em terreno positivo; tendência se  mostra de...
Ação Bicho Vivo leva alimentos a locais remotos do Alto ...|Abc do Abc|24/09/2020|O apoio da Petrobras na Campanha permite dobrar a expetativa de arrecadação  e atingir R$ 300 mil em prol da fauna impacta com os incêndios no Pantanal.  Com o...
Paulo Câmara inaugura esgotamento sanitário e visita obras ...|Folha PE|24/09/2020|"Veja também · Ministro de Minas e Energia diz não ter orgulho de lucro da  Petrobras e pede ""sacrifício"" da empresa · ""Consenso total"" de membros da  UE sobre..."
Tenda investe em imóveis pré-fabricados para expandir atuação|Money Times|24/09/2020|Gasolina e etanol têm primeira queda de preço depois de três meses de altas  · Se havia dúvida de que a Petrobras (PETR4) amarrava preço do etanol nas  usinas...
Vinci Partners e Fulwood preparam fundo imobiliário de R$ 1 bilhão para galpões|Money Times|24/09/2020|Gasolina e etanol têm primeira queda de preço depois de três meses de altas  · Se havia dúvida de que a Petrobras (PETR4) amarrava preço do etanol nas  usinas...
Petrobras vai vender Albacora e Albacora Leste|EPBR|25/09/2020|A Petrobras anunciou nesta sexta (25) que vai vender 100% da sua  participação nos campos de Albacora e Albacora Leste, em águas profundas da  Bacia de Campos...
Indícios encontrados pela Petrobras no pré-sal da Bacia de ...|EPBR|25/09/2020|A Petrobras identificou a presença de hidrocarbonetos no primeiro poço  pioneiro perfurado no bloco C-M-657, no pré-sal da Bacia de Campos.
Petrobras acerta com a White Martins venda de 40% de participação na Gás Local|O Globo|25/09/2020|RIO — A Petrobras anunciou nesta sexta-feira a assinatura de contratos com  a White Martins que englobam a venda de sua participação de 40% na empresa  GNL...
Privatização de Urucu entra na campanha “Petrobrás Fica”, da oposição|BNC Amazonas|25/09/2020|Com a suspensão do julgamento, no Supremo Tribunal Federal (STF), da ação  sobre a venda de refinarias e ativos da Petrobras, partidos de oposição ao  governo...
Petrobras contrata duas plataformas semi-submersíveis para manutenção e suporte no pré-sal|CPG Click Petroleo e Gas|25/09/2020|A Petrobras concedeu à POSH de Singapura dois afretamentos de longo prazo  para os navios semi-submersíveis de acomodação POSH Arcadia e POSH Xanadu  para...
ConJur - TJ-SP confirma vitória da ConJur sobre Modesto ...|Consultor Jurídico|25/09/2020|Eles são sócios no negócio de R$ 2,5 bilhões da Petrobras que pretendiam  empalmar com a criação de uma fundação administrada pelos procuradores da  República...
Apple salva o dia, mas Ibovespa tem 4ª queda semanal consecutiva|Exame|25/09/2020|As ações da Petrobras encerraram em queda de 1,3%, após o ministro do  Supremo Tribunal Federal Luiz Fux remarcar o julgamento sobre a venda de  refinarias.
IPO da Petz atraiu quase 40 mil pessoas físicas e movimentou R$ 3,03 bilhões|Money Times|25/09/2020|Petrobras (PETR3:PETR4) salta quase 6%; o que motiva a alta das ações nesta  segunda? Leia mais sobre: Ações, Bolsa de Valores, Comprar ou vender?,  Empresas,...
Geração Greta volta a se manifestar pelo clima|Exame|25/09/2020|FUP convoca protesto contra indicação de Paes de Andrade à Petrobras.  Siga-nos: Facebook da Exame · Instagram da Exame · LinkedIn da Exame.
Acionistas da Tecnisa rejeitam todos os termos propostos para fusão com Gafisa|Money Times|25/09/2020|Se havia dúvida de que a Petrobras (PETR4) amarrava preço do etanol nas  usinas, não há mais · Gasolina e etanol têm primeira queda de preço depois  de três...
Gastar dinheiro não vai fazê-lo feliz|Seu Dinheiro|26/09/2020|'JULGAMENTO' DA PETROBRAS? Descubra se a estatal é culpada pela explosão  nos preços dos combustíveis. Menu. Seu Dinheiro. Últimas Notícias.
Onda de IPOs também chega aos fundos imobiliários|Eu Quero Investir|26/09/2020|Radar traz Petrobras (PETR3; PETR4), CSN (CSNA3) e GPA (PCAR3) · Com Selic  a 13,25%, a poupança vale a pena? Descubra aqui · Mercados operam em baixa  com...
Estudo analisará rotas de migração de baleias jubarte|Money Times|26/09/2020|Se havia dúvida de que a Petrobras (PETR4) amarrava preço do etanol nas  usinas, não há mais · Gasolina e etanol têm primeira queda de preço depois  de três...
MP pede que TCU reveja promoções de 39 servidores do próprio tribunal|Correio Braziliense|26/09/2020|Maior acionista, governo recebe mais R$ 8,8 bi do lucro da Petrobras ...  Lira volta a criticar a Petrobras e diz que País vai enfrentar estatal.
Bolsonaro recebe alta após cirurgia para retirada de cálculo ...|Sagres 730|26/09/2020|“A criação de uma CPI da Petrobras terá o meu apoio”,. ... Petrobras nomeia  Fernando Borges como presidente interino.
Conheça os candidatos mais cotados para suceder Celso de Mello no STF|Exame|26/09/2020|Governistas travam assinaturas pela CPI da Petrobras, cobrada por  Bolsonaro. Medo de recessão, crise dos combustíveis, CVC, Eneva e o que  mais move.
OAB-DF quer informações sobre vazamento de dados pessoais de advogados|Correio Braziliense|26/09/2020|O futuro já começou. O que é a Web 3.0 e como ela vai impactar as nossas  Vidas! Petrobras perde R$ 27,3 bi em valor de mercado em apenas um dia...
Petrobras concede fretamentos de longo prazo para POSH flotel duo|O Petróleo|26/09/2020|Este é o terceiro contrato da POSH Xanadu e o primeiro da POSH Arcadia com  a Petrobras. Os dois navios também apoiaram alguns dos principais projetos  offshore...
“Sou engenheiro da Petrobras”, diz dono de conversível do Leblon|VEJA SÃO PAULO|27/09/2020|“Sou engenheiro da Petrobras”, diz dono de conversível do Leblon. Vídeo que  mostra briga no bairro do Rio de Janeiro repercutiu nas redes sociais. Em  entrevista...
Presidente do Flamengo foi condenado a perda de direitos políticos por falcatrua enquanto presidente da Petrobrás|Blog do Juca Kfouri|27/09/2020|Foram condenados, também, a Petrobrás e outros agentes públicos, como a  ex-prefeita de Campinas, Izalene Tiene. Em 2004, todos eles teriam  concorrido para a...
Jordan Belfort: conheça a trajetória do Lobo de Wall Street|Eu Quero Investir|27/09/2020|Radar traz Petrobras (PETR4), Embraer (EMBR3) e Braskem (BRKM5) · Futuros  de NY sobem e demais mercados operam em terreno positivo; tendência se  mostra de...
A história do mineiro Thiago Galhardo, do Inter, artilheiro do Campeonato Brasileiro|Superesportes|27/09/2020|O mineiro de São João del-Rei foi aprovado em um concurso da Petrobras, mas  preferiu tentar a carreira no futebol, contra a vontade do pai. Hoje no  Inter, é o...
O Brasil é mesmo o pior país emergente para se investir?|Seu Dinheiro|27/09/2020|GAME OVER para Petrobras? Clique aqui e descubra 2 ações que 'vencem' a  estatal. Menu.
Navio APA da Marinha do Brasil doa 15 mil máscaras durante visita a Cabo Verde|Diário do Poder|27/09/2020|Petrobras: lucros rendem até R$31 milhões a diretores · Diário do Poder ...  Ministro de Minas e Energia volta a defender privatização da Petrobras.
Atriz japonesa de 'O Chamado', Yuko Takeuchi é encontrada morta em casa|Yahoo Vida e Estilo|27/09/2020|'CPI da Petrobras não vai nem andar', diz Mourão sobre pressão que  Bolsonaro e Lira querem fazer na estatal sobre alta de preços. há 30  minutos.
Processo seletivo apenas para motoristas: A Distribuidora de combustíveis, Potencial Petróleo inicia vagas de emprego no Paraná|CPG Click Petroleo e Gas|27/09/2020|Petrobras deu início ao Teste de Longa Duração do reservatório de petróleo  em águas profundas da Bacia de Sergipe · Obras em refinaria da Petrobras em  São...
Veja os 10 super apps mais relevantes do Brasil, segundo o iBest|Money Times|27/09/2020|Gasolina e etanol têm primeira queda de preço depois de três meses de altas  · Se havia dúvida de que a Petrobras (PETR4) amarrava preço do etanol nas  usinas...
Projeto Mães da Favela quer conectar à internet 2 milhões de pessoas|Money Times|27/09/2020|... CVC (CVCB3), Petrobras (PETR4) e outras empresas para ficar de olho  hoje · Sanepar (SAPR11) pagará R$ 154 milhões em juros sobre o capital  próprio...
Campo Tupi chega a 2 bilhões de barris de óleo equivalente em julho|Agência Brasil|28/09/2020|De acordo com a Petrobras, os dados foram divulgados pela Agência Nacional  do Petróleo, Gás Natural e Biocombustíveis (ANP). A petroleira, que  divulgou hoje (28)...
Lava Jato denuncia ex-funcionário de logística da Petrobras ...|Poder360|28/09/2020|Lava Jato denuncia ex-funcionário de logística da Petrobras por corrupção.  Trata-se de Ademir de Jesus Magalhães. Teria beneficiado Mariano Ferraz.
Petrobras assume exploração em águas ultraprofundas no ...|Amazonas Atual|28/09/2020|MANAUS – A Petrobras entrou em acordo em 25 de setembro de 2020 para  assumir a operação e a integralidade das participações da empresa Total E&P  do Brasil...
“Sou engenheiro da Petrobras”, diz dono de conversível ...|ISTOÉ Independente|28/09/2020|Em entrevista ao colunista Léo Dias, do site Metrópoles, Vacari afirmou que  é engenheiro da Petrobras e rechaçou as acusações de que teria pagado as...
Costureiras do Cabo de Santo Agostinho irão produzir máscaras para a população vulnerável|Folha PE|28/09/2020|"Durante cinco meses a Petrobrás irá financiar a iniciativa ""Máscara +  Renda"", ... avalia a gerente executiva de Responsabilidade Social da  Petrobras,..."
UFPB se mantém como a líder em depósitos de patentes|Agência Brasil|28/09/2020|Dos 20 maiores depositantes residentes, 17 são universidades públicas, além  de Petrobras (5° lugar), CNH Industrial Brasil (7°) e Robert Bosch (12°).
Senado deveria ouvir o que o BNDES diz sobre o setor de ...|Poder360|28/09/2020|Agência Petrobras. Investimentos em gasodutos dependem de previsão de  aumento da demanda Jorge Celestino Ramos 28.set.2020 (segunda-feira) - 6h00.
Com nova lei de dados, Brasil quer explorar mercado bilionário|Valor Econômico|28/09/2020|... para esclarecer se pretende alterar política de preços da Petrobras.  Comitê de Pessoas (Cope) da Petrobras tentou agendar uma entrevista formal  com o...
Motorista da confusão no Leblon tentou ser candidato a vereador pelo NOVO|Diário do Rio|28/09/2020|Petrobrás? Lula? PT? Contratos? Responder. marcelo 29 de setembro de 2020  At 08:35. O cara com duas gostosas, num menege não sabe viver?
Restoque conclui processo de recuperação extrajudicial; empresa fará emissão de debêntures|Money Times|28/09/2020|Petrobras (PETR3:PETR4) salta mais de 6%; o que motiva a alta das ações  nesta segunda? Leia mais sobre: Empresas, Recuperação Judicial, Restoque,  Varejo. Última...
Liberação da venda de refinarias pode salvar Petrobras ...|Poder360|29/09/2020|Se a Petrobras resolvesse vender os ativos de refino e logística, sem criar  subsidiária o Senado estaria questionando o STF?
Petrobras eleva preço do diesel em 3% e o da gasolina em 5% a partir de quarta|G1|29/09/2020|A Petrobras elevará os preços médios da gasolina em suas refinarias em 5% a  ... importações continuam fechadas, apesar de reajuste do valor da  Petrobras.
Petrobras (PETR4) Anuncia Venda de Polo Potiguar em RN|The Capital Advisor|29/09/2020|Petrobras (PETR4) Anuncia Venda de Polo Potiguar em RN. O Polo compreende  três subpolos, totalizando 26 concessões de produção, 23 terrestres e três  marítimas.
Petrobras prosseguiu em parceria com empresa citada pela ...|Poder360|29/09/2020|Petrobras prosseguiu em parceria com empresa citada pela Lava Jato. Golar é  mencionada na 75ª fase. BR avalia comprar 50% da Golar. Disse desconhecer  fatos...
Linx, Petrobras, Tim, Hapvida, Boa Vista e mais: veja destaques de empresas|Valor Investe|29/09/2020|Linx, Petrobras, Tim, Hapvida, Boa Vista e mais: veja destaques de  empresas. Três companhias já decidiram não estrear na bolsa dado o cenário  mais desafiador...
Petrobras deve gastar cerca de 6 bilhões de dólares em plano de descomissionamento de plataformas, gasodutos submarinos e poços offshore|CPG Click Petroleo e Gas|29/09/2020|Em 2022 e 2023, a Petrobras deverá gastar a cada ano 1,1 bilhão de dólares,  e outros 1 bilhão em 2024 para descomissionamento de plataformas.
Petros: presidente do fundo de pensão diz que pretende reduzir contribuição extra para cobrir déficit de R$ 33 bi|O Globo|29/09/2020|RIO- O presidente da Petros, fundo de pensão dos funcionários da Petrobras,  Bruno Dias, diz que pretende reduzir as contribuições extraordinárias  feitas...
Cauteloso no início da pandemia, Warren Buffett já investiu US$ 19 bilhões desde julho|Seu Dinheiro|29/09/2020|GAME OVER para Petrobras? Clique aqui e descubra 2 ações que 'vencem' a  estatal · Cauteloso no início da pandemia, Warren Buffett já investiu US$  19 bilhões...
Ágora seleciona 10 ativos para apostar em outubro|Money Times|29/09/2020|Lojas Americanas · LAME4, Consumo, 10%. B3 · B3SA3, Serviços financeiros,  10%. Iguatemi · IGTA3, Shoppings, 10%. Petrobras · PETR4, Petróleo, 10%.
Bradesco reforça carteira digital Bitz com aquisição da fintech DinDin|Seu Dinheiro|29/09/2020|GAME OVER para Petrobras? Clique aqui e descubra 2 ações que 'vencem' a  estatal. Menu.
Petrobras recebe US$ 9,4 milhões e conclui venda do Polo Lagoa Parda|G1|30/09/2020|Petrobras recebe US$ 9,4 milhões e conclui venda do Polo Lagoa Parda.  Contrato para venda do ativo à Imetame Energia foi assinado em outubro do  ano passado.
Petrobras dá passo rumo à privatização de gasodutos marítimos que ligam campos do pré-sal à terra|Época Negócios|30/09/2020|De acordo com comunicado da Petrobras, os contratos preveem a interligação  física e o compartilhamento das capacidades de escoamento nas rotas 1, 2 e  3 (a...
STF decidirá se Bolsonaro pode vender refinarias da ...|Brasil de Fato|30/09/2020|O Supremo Tribunal Federal (STF) deve concluir nesta quinta-feira (1º) o  julgamento sobre a legalidade da venda de refinarias da Petrobras pelo  governo...
Governo deve R$ 2,3 bi em precatórios à Petrobras; proposta ...|Consultor Jurídico|30/09/2020|Governo deve R$ 2,3 bi em precatórios à Petrobras; proposta derruba papéis  ... Jair Bolsonaro poderá atingir significativamente as contas da Petrobras.
Áreas vendidas pela Petrobras na Bacia de Campos garantem a Macaé e cidades produtoras de petróleo investimentos bilionários das multinacionais Trident Energy, Perenco e BW Offshore|CPG Click Petroleo e Gas|30/09/2020|Com a entrada da Trident Energy, Perenco e BW Offshore, a estratégia da  Petrobras em desinvestir destas áreas em águas rasas da Bacia de Campos  asseguraram que...
Hypera paga R$ 185,4 milhões em juros sobre capital próprio|Seu Dinheiro|30/09/2020|GAME OVER para Petrobras? Clique aqui e descubra 2 ações que 'vencem' a  estatal. Menu.
As ações mais recomendadas para outubro, segundo 12 ...|E-Investidor|30/09/2020|Ações da Magazine Luiza (MGLU3), Vale (VALE3) e B3 (B3SA3) são as mais  recomendadas para outubro; Gerdau (GGBR4) e Petrobras (PETR4) também  aparecem...
Estoques de petróleo dos EUA caem em 2 milhões de barris|SpaceMoney|30/09/2020|... PetroRecôncavo (RECV3) e PetroRio (PRIO3) caem até 10%, com Petrobras  (PETR4) ... PetroRio (PRIO3): Cade concede aval para Petrobras (PETR4)  vender...
Governo de São Paulo sugere privatização da elétrica Emae|Exame|30/09/2020|A empresa de energia opera ativos hidrelétricos em São Paulo, incluindo a  hidrelétricas Henry Borden Bom Jesus e uma termelétrica arrendada à  Petrobras.
ConJur - Aldem Johnston: O papel constitucional dos ...|Consultor Jurídico|30/09/2020|No Acórdão 39/2006, o TCU determinou, tendo por esteio a Súmula 347 do  Supremo Tribunal Federal, que a Petrobras observasse os artigos 22 e 23 da  Lei...
